{"scopus-eid": "2-s2.0-85112377394", "originalText": "serial JL 271390 291210 291741 291744 291800 31 Journal of Hazardous Materials JOURNALHAZARDOUSMATERIALS 2021-07-27 2021-07-27 2021-08-12 2021-08-12 2021-08-12T03:41:18 1-s2.0-S0304389421017258 S0304-3894(21)01725-8 S0304389421017258 10.1016/j.jhazmat.2021.126760 S250 S250.1 FULL-TEXT 1-s2.0-S0304389421X00131 2021-08-12T04:51:52.278282Z 0 0 20220105 2022 2021-07-27T14:48:56.096485Z absattachment articleinfo articlenumber articletitlenorm authfirstinitialnorm authfirstsurnamenorm cid cids contenttype copyright crossmark dateloaded dateloadedtxt datesearch datesort dateupdated dco docsubtype doctype doi eid ewtransactionid hubeid indexeddate issn issnnorm itemstage itemtransactionid itemweight openaccess openarchive pg pgfirst pii piinorm pubdatestart pubdatetxt pubyr sortorder srctitle srctitlenorm srctype ssids alllist content subj subheadings suppl tomb volfirst volissue volumelist webpdf webpdfpagecount yearnav figure table body acknowledge affil articletitle auth authfirstini authfull authkeywords authlast footnotes grantnumber grantsponsor highlightsabst misctext primabst pubtype ref specialabst 0304-3894 03043894 true 421 421 C Volume 421 134 126760 126760 126760 20220105 5 January 2022 2022-01-05 2022 article rev \u00a9 2021 Elsevier B.V. All rights reserved. BIOMARKERSFORADVERSEEFFECTSRESPIRATORYSYSTEMHEALTHASSOCIATEDATMOSPHERICPARTICULATEMATTEREXPOSURE GUO C 1 Introduction 2 Biomarkers implicated following PM2.5 exposure 2.1 Oxidative stress 2.1.1 ROS 2.1.2 Malondialdehyde (MDA) 2.1.3 Antioxidants 2.1.4 8-iso-prostaglandin-F2\u03b1 (8-iso-PGF2a) 2.1.5 EBC pH 2.2 Inflammation 2.2.1 Inflammatory cells 2.2.2 Inflammatory mediator 2.2.3 Fractional exhaled nitric oxide (FENO) 2.2.4 CC16 2.2.5 Pulmonary surfactant proteins (SPs) 2.3 DNA damage 2.3.1 8-hydroxy-2\u2032-deoxyguanosine (8-OHdG) 2.3.2 \u03b3H2AX 2.3.3 8-oxoguanine glycosylase 1 (OGG1) 2.4 Epigenetic marker 2.4.1 DNA methylation 2.4.2 Histone modification 2.4.3 MicroRNAs (miRs) 2.5 Pulmonary function indexes 2.6 Pulmonary Fibrosis Marker 2.6.1 Transforming growth factor beta (TGF-\u03b2) 2.6.2 Matrix metalloproteases (MMPs) 2.6.3 Epithelial-mesenchymal transition (EMT) 2.7 Omics 3 Conclusion Acknowledgments References ADAMKIEWICZ 2004 204 209 G AGRAVAL 2019 108846 H ALEXIS 2006 1396 1403 N ALFAROMORENO 2008 1184 1194 E ALFAROMORENO 2009 528 535 E AMARA 2007 L170 L181 N AUDI 2017 1363 1374 C AWAD 1993 4161 4169 J AZTATZIAGUILAR 2016 68 O BACCARELLI 2009 572 578 A BACCARELLI 2014 51 A BELINSKY 2002 335 339 S BHAVSAR 2008 580 584 P BILLET 2018 168 178 S BOLLATI 2010 763 768 V BORGIE 2015 352 362 M BORTHWICK 2016 38 55 L BRAUNER 2009 38 47 E BRETON 2012 1320 1326 C BRIDGES 2000 38848 38855 J BROECKAERT 2000 469 475 F BRUCKER 2013 884 893 N CACHON 2014 340 351 B CALIFF 2018 213 221 R CANTONE 2011 964 969 L CHEN 2015 11859 11865 R CHEN 2017 73 81 R CHEN 2019 S CHEN 2018 88 X CHEN 2018 505 509 Y CHEN 2015 318 324 Z CHENG 2019 21 I CHI 2018 155 164 Y CHOU 2020 68 Y CHU 2021 14586 14596 H CHUANG 2015 174 180 H COCHARD 2020 293 318 M CORBEL 2002 51 61 M DANCER 2011 1461 R DEPRINS 2014 440 446 S DEPRINS 2013 418 424 S DELFINO 2006 1736 1743 R DENG 2017 112 125 X DING 2017 43737 R DING 2016 46 53 R DING 2016 170 175 R DING 2019 109425 S DINHXUAN 2015 193 215 A DOMINGUEZRODRIGUEZ 2020 16 25 A DONGRE 2019 69 84 A DOSSANTOS 2012 L627 L633 G FAN 2016 843 850 J FERGUSON 2016 407 413 M FERNANDEZ 2012 111 116 I FORBES 2009 245 253 L FOSSATI 2014 68 78 S FUENTESMATTEI 2010 381 389 E GALI 2019 112841 N GALI 2017 51 64 N GAUDERMAN 2007 571 577 W GAULDIE 2007 661 664 J 2020 1223 1249 GEHRING 2013 1357 1364 U GESSNER 2003 1188 1194 C GILMOUR 2003 L533 L540 P GIODA 2011 106 119 A GONG 2014 5264 5273 J GONG 2013 322 327 J GOWDY 2008 310 319 K GREENE 2002 439 446 K GUAN 2019 530 538 L GUERRA 2015 613 620 S GUO 2020 134 C GUO 2019 127008 C GUO 2021 124626 C GUO 2015 1463 1477 C GUO 2016 5257 5276 C GUO 2018 e114 e125 C GURGUEIRA 2002 749 755 S HABRE 2014 269 278 R HAJAT 2015 310 320 A HE 2020 116 123 L HE 2015 287 299 M HE 2017 1203 1218 M HEMMINGSEN 2015 635 642 J HOSSEINI 2016 2 A HUANG 2012 e37412 H HUANG 2018 1243 1252 Q HUANG 2012 1150 1159 W HUANG 2019 16 Y ISIUGO 2019 408 417 K ITO 2005 1967 1976 K ITO 2002 8921 8926 K JAAFARI 2021 144503 J JAAFARI 2020 139417 J JACQUEMIN 2009 1068 1076 B JANSSEN 2015 49 N JARDIM 2009 1745 1751 M JI 2019 127 136 X JIN 2019 2881 2891 L JIN 2017 1121 1134 Y JOBLING 2006 839 848 M JOHANSSON 2009 65 69 S JUNG 2017 63 K KE 2006 1481 1488 Q KILE 2013 47 M KIM 2017 1218 1223 H KIM 2020 101 J KIM 2004 666 671 J KLOYPAN 2015 375 385 C KOSTIKAS 2013 172 179 K KRAUSKOPF 2018 26 34 J KUROKI 1993 723 729 Y KWONG 2007 171 180 J LADDACOSTA 2015 271 283 C LAI 2016 33515 C LAMADEMA 2019 282 298 N LAMOUILLE 2014 178 196 S LECLERCQ 2017 163 177 B LEE 2001 809 821 C LEE 2010 505 510 M LEI 2005 335 343 Y LEITE 2018 205 212 M LEONKABAMBA 2018 859 864 N LEPEULE 2012 261 269 J LEPEULE 2014 566 572 J LEY 2014 L681 L691 B LI 2018 2480 2486 Y LI 2009 400 409 J LI 2017 539 546 J LI 2018 209 J LI 2003 250 265 N LI 2015 e45 e50 P LI 2017 165 173 R LI 2017 654 663 R LI 2016 35026 35043 X LI 2020 110105 Z LIANG 2021 116601 Y LIN 2015 575 583 W LIN 2009 223 228 Z LIU 2015 65 C LIU 2018 16 S LIU 2020 122608 X LONGHIN 2016 87 98 E LOOMIS 2013 1262 1263 D LU 2015 196 204 F MA 2017 1122 1128 J MA 2015 110 115 M MADSEN 2008 354 360 C MAH 2010 679 686 L MANTECCA 2010 244 254 P MARCHINI 2020 263 279 T MEHTA 2008 116 121 M MENG 2007 1368 1374 Z MENNI 2015 1203 1207 C MILANZI 2018 1800218 E MITKUS 2013 2289 2298 R MOLLER 2014 133 166 P MONTGOMERY 2020 M MONTUSCHI 2004 1791 1800 P NAZARIAH 2013 93 105 S NDONGBA 2019 568 581 A NEOPHYTOU 2014 377 390 A NING 2019 112875 J NISHINO 2014 435 445 R NIU 2017 233 242 Y OGINO 2017 1047 1054 K PAGETBROWN 2006 426 430 A PARDO 2016 23 A PEDERSEN 2017 600 611 B POLETTE 2004 179 186 M QIU 2021 877 887 F RAVA 2013 230 232 M REN 2020 40262 40276 H RICCIARDOLO 2014 53 59 F RIOSDORIA 2006 142 144 J RIVA 2011 257 267 D RODRIGUEZCOTTO 2014 112 120 R ROSSNEROVA 2013 18 26 A RYLANCE 2013 L571 L578 J SALAM 2012 e231 e237 M SAMPATH 2019 102667 H SCHIKOWSKI 2013 1034 1039 T SCHNEKENBURGER 2007 7089 7101 M SEHLSTEDT 2010 21 M SHOENFELT 2009 303 312 J SHULL 2021 352 359 J SKLORZ 2007 1866 1869 M SMEESTER 2014 5 L SOBERANES 2012 275 S SONG 2012 182 190 J SONG 2019 3139 3150 Y SORENSEN 2003 191 196 M SORENSEN 2005 1340 1343 M STOCKFELT 2013 417 425 L STOCKFELT 2012 47 59 L STRAHL 2000 41 45 B STURROCK 2006 L661 l673 A SUGA 2000 1949 1956 M SULLIVAN 2009 1866 1876 D SUN 2020 121566 B SUN 2015 C SUN 2018 359 368 J TARANTINI 2009 217 222 L THACKER 2006 469 486 E THANNICKAL 2004 395 417 V TIMONEN 2004 908 914 K VANMIERT 2005 115 123 E VATTANASIT 2014 23 33 U VAUGHAN 2003 889 894 J VERMA 2015 4646 4656 V VERMA 2012 11384 11392 V VINEIS 2013 461 467 P WANG 2020 552 560 B WANG 2017 450 455 C WANG 2018 484 493 C WANG 2015 343 356 G WANG 2019 105871 L WANG 2015 405 413 T WANG 2018 207 217 Y WANG 2019 159 167 Y WANG 2020 5758 5767 Y WEI 2017 2341 2351 H WEI 2009 4757 4762 Y WEI 2013 e77413 Y WESSELS 2010 3539 3545 A WESTBERG 2016 813 822 H WILLIS 2007 L525 L534 B WU 2017 25071 25081 J WU 2014 168 174 S WU 2017 525 536 X WUYTS 2013 1207 W WYNN 2011 1339 1350 T XING 2020 134397 X XING 2016 Y XU 2019 1404 Z XU 2019 112 121 Z YANG 2018 36136 36146 B YANG 2018 70 75 L YANG 2017 1446 1459 L YANG 2020 111283 L YANG 2016 923 936 L YANG 2015 365 373 L YIN 2020 e386 e398 P ZANOLIN 2015 e341 e345 M ZHANG 2018 1602 1607 J ZHANG 2017 13 26 L ZHANG 2013 214 219 R ZHANG 2019 4453 4465 R ZHANG 2016 306 319 X ZHANG 2015 500 506 Y ZHAO 2019 45 52 C ZHAO 2015 971 983 J ZHAO 2019 120 J ZHAO 2014 72 81 L ZHAO 2021 129969 X ZHAO 2018 34221 34227 Y ZHAO 2019 155 163 Y ZHENG 2017 112 119 Y ZHOU 2019 147 153 J ZHOU 2019 81 91 L ZHOU 2018 7073 7080 T ZHOU 2018 2339 2349 T ZHOU 2016 20691 20703 W ZHOU 2015 Z ZHU 2021 129565 H ZHU 2015 e0116159 L ZHU 2019 3843 3849 Z ZOU 2016 627 635 Y ZOU 2014 e96708 Y ZUURBIER 2011 1384 1389 M GUOX2022X126760 GUOX2022X126760XC 2023-08-12T00:00:00.000Z 2023-08-12T00:00:00.000Z http://creativecommons.org/licenses/by-nc-nd/4.0/ \u00a9 2021 Elsevier B.V. All rights reserved. 2021-07-30T14:22:38.570Z http://vtw.elsevier.com/data/voc/AddOnTypes/50.7/aggregated-refined CIT&TCD201804090 Project of High-level Teachers in Beijing Municipal Universities in the Period of 13th Five-year Plan http://data.elsevier.com/vocabulary/SciValFunders/501100012435 http://sws.geonames.org/1814991 Beijing Municipal Universities in the Period of 13th Five-year Plan National Key R&D Program of China 2017YFC0211600 2017YFC0211604 NKRDPC National Key Research and Development Program of China http://data.elsevier.com/vocabulary/SciValFunders/501100012166 http://sws.geonames.org/1814991/ This work has been financially supported by National Key R&D Program of China ( 2017YFC0211600 , 2017YFC0211604 ), and Support Project of High-level Teachers in Beijing Municipal Universities in the Period of 13th Five-year Plan ( CIT&TCD201804090 ). item S0304-3894(21)01725-8 S0304389421017258 1-s2.0-S0304389421017258 10.1016/j.jhazmat.2021.126760 271390 2021-08-12T04:07:41.079773Z 2022-01-05 1-s2.0-S0304389421017258-main.pdf https://s3-eu-west-1.amazonaws.com/prod-ucs-content-store-eu-west/content/pii:S0304389421017258/MAIN/application/pdf/ab5d7b3f96742e8d5cea5606d45e386d/main.pdf main.pdf pdf true 1001004 MAIN 21 1-s2.0-S0304389421017258-main_1.png https://s3-eu-west-1.amazonaws.com/prod-ucs-content-store-eu-west/content/pii:S0304389421017258/PREVIEW/image/png/c9b255699e052f0848f164cb99b7f7f8/main_1.png main_1.png png 60365 849 656 IMAGE-WEB-PDF 1 1-s2.0-S0304389421017258-ga1.jpg https://s3-eu-west-1.amazonaws.com/prod-ucs-content-store-eu-west/content/pii:S0304389421017258/ga1/DOWNSAMPLED/image/jpeg/5b1ff79a046a15785a9ce84c8ce5501d/ga1.jpg ga1 true ga1.jpg jpg 110184 200 336 IMAGE-DOWNSAMPLED 1-s2.0-S0304389421017258-ga1.sml https://s3-eu-west-1.amazonaws.com/prod-ucs-content-store-eu-west/content/pii:S0304389421017258/ga1/THUMBNAIL/image/gif/0d8771811757cfb4953c4e9524f5ef67/ga1.sml ga1 true ga1.sml sml 80735 130 219 IMAGE-THUMBNAIL 1-s2.0-S0304389421017258-ga1_lrg.jpg https://s3-eu-west-1.amazonaws.com/prod-ucs-content-store-eu-west/content/pii:S0304389421017258/ga1/HIGHRES/image/jpeg/89032cd1c98f86be6c1231acf0bbfe49/ga1_lrg.jpg ga1 true ga1_lrg.jpg jpg 338333 886 1487 IMAGE-HIGH-RES HAZMAT 126760 126760 S0304-3894(21)01725-8 10.1016/j.jhazmat.2021.126760 Elsevier B.V. Table 1 Epidemiological studies of PM2.5 and respiratory toxicity-related biomarkers. Table 1 Classification Study site Study design PM 2.5 type Object Exposed time Exposed concentration Biomarker Methods Ref. Oxidative stress Shanghai, Changsha, China Panel study Atmospheric PM2.5 70 health young adults (Shanghai) and 89 office workers (Changsha) 12, 24 h 37.5 \u00b1 15.3 \u00b5g/m3 (Shanghai), 42.8 \u00b1 35.7 \u00b5g/m3 (Changsha) Urinary MDA HPLC- fluorescence technique (He et al., 2020) China, Germany Panel study Atmospheric PM2.5 9 healthy young male Chinese volunteers (age: 26\u201334 years) traveled from Germany to China 8\u201342 days (mean: 28 days) 21 \u00b5g/m3 (Germany), 108 \u00b5g/m3 (China) Urinary MDA LC-MS/MS (Wu et al., 2017b) Los Angeles, USA Panel study Atmospheric PM2.5 97 elderly residents (age \u2265 65 years) 1 day average 17.6 \u00b1 7.7 \u00b5g/m3 EBC MDA HPLC- fluorescence technique (Zhang et al., 2016) Taiwan, China Cross-sectional study Metal fumes PM2.5 118 welders (exposure group) and 45 office workers (control group) 5 working days 48.8 \u00b1 32.3 \u00b5g/m3 (welding workers), 28.7 \u00b1 15.2 \u00b5g/m3 (office workers) Urinary 8-iso-PGF2a ELISA (Lai et al., 2016) Larissa, Greece Randomized controlled cross-over trial Secondhand smoke 18 young healthy never smokers (age: 32.7 \u00b1 6.0 years) 1 h \u2014 EBC H2O2 Colorimetry (Kostikas et al., 2013) EBC pH pH meter Sweden Randomized controlled cross-over trial Wood smoke 19 healthy volunteers (age: 21\u201331 years) 3 h 224 \u00b1 22 \u00b5g/m3 GSH in BALF GSSG-reductase-DTNB recycling method (Sehlstedt et al., 2010) Inflammation Beijing, China Panel study Atmospheric PM2.5 125 health participants (age: 19\u201333 years) During Beijing Olympics 98.9 \u00b5g/m3 (pre-Olympics), 71.9 \u00b5g/m3 (during-Olympics), 85.3 \u00b5g/m3 (post-Olympics) FENO Chemiluminescence NO analyzer (Huang et al., 2012b) EBC pH pH meter California, USA Panel study Atmospheric PM2.5 45 schoolchildren with persistent asthma (age: 9\u201318 years) 24 h 32.78 \u00b1 21.84 \u00b5g/m3 (Riverside), 36.2 \u00b1 25.46 \u00b5g/m3 (Whittier) FENO Chemiluminescence NO analyzer (Delfino et al., 2006) Steubenville, USA Cohort study Atmospheric PM2.5 29 non-smoking adult volunteers (median age: 70.7 years) 24 h 19.7 \u00b5g/m3 FENO Chemiluminescence NO analyzer (Adamkiewicz et al., 2004) Utrecht, The Netherlands Semi-experimental design Atmospheric PM2.5 31 health volunteers (age: 19\u201326 years) 5 h Geometric mean: 37.8 \u00b5g/m3 (all sites), 23.4 \u00b5g/m3 (outdoor sites), 142.0 \u00b5g/m3 (underground) IL-6 in nasal lavage fluid ELISA (Janssen et al., 2015) FENO Niox Mino monitor Tehran, Iran Panel study Atmospheric PM2.5 44 healthy subjects (22 from the urban area and 22 from the rural area; age: 16\u201322 years) 24 h 75.3 \u03bcg/m3 (urban area), 21.3 \u03bcg/m3 (rural area) Number of white blood cells Hematological analyzer (Jaafari et al., 2021) IL-6 in blood ELISA Klang Valley, Malaysia Case control study Indoor PM2.5 430 healthy children (198 from the rural area and 232 from the urban area; age: 8 and 10 years) 8 h 50.77 \u00b1 10.93 \u00b5g/m3 (urban area), 25.63 \u00b1 8.66 \u00b5g/m3 (rural area) Sputum IL-6 ELISA (Nazariah et al., 2013) Auvergne, France Cohort study Indoor PM2.5 72 farmers (mean age: 47.02 years) \u2014 Highest mean value of PM2.5 (11 \u00b5g/m3), with the highest median value (3 \u00b5g/m3) and the highest third quartile value (8 \u00b5g/m3) IL-4, \u22126, \u22128, \u221213, TNF\u03b1, IFN\u03b3 in blood Multiplex cytokine assay kit (Audi et al., 2017) Shanghai, China Panel study Ambient PM2.5 36 healthy nonsmoking college students 72 h 36\u201352 \u00b5g/m3 CC16 in serum ELISA (Wang et al., 2017) China Cohort study Coke oven emission (COE) and diesel engine exhaust (DEE) 558 coke plant workers and 210 controls for COE cohort, 50 DEE workers and 50 controls for DEE cohort 8 h 62.6 \u00b5g/m3 (COE control group), 120.0 \u00b5g/m3 (low COE exposure group), 216.3 \u00b5g/m3 (high COE exposure group); 91.9 \u03bcg/m3 (DEE control group), 267.5 \u03bcg/ m3 (DEE exposure group) CC16, SP-A in serum ELISA (Wang et al., 2018b) Gothenburg, Sweden Randomized controlled cross-over trial Wood smoke 13 healthy subjects 3 h 295 \u00b5g/m3 (start-up session), 146 \u00b5g/m3 (burn-out session) CC16 in serum ELISA (Stockfelt et al., 2012) FENO Chemiluminescence NO analyzer Europe Cohort study Atmospheric PM2.5 121 subjects with coronary heart disease 6 months \u2014 Urinary CC16 Automated latex immunoassay (Jacquemin et al., 2009) DNA damage Beijing, China Panel study Atmospheric PM2.5 36 schoolchildren (average age: 10.6 years) \u2014 \u2014 Urinary 8-OHdG HPLC/ECD (Lin et al., 2015) Taiwan, China Longitudinal study Traffic-related PM2.5 91 traffic conductors and 53 indoor office workers 9\u201310 h Median: 82.87 \u00b5g/m3 Urinary 8-OHdG LC-MS/MS (Huang et al., 2012a) DNA strand breaks Comet assay Taiwan, China Repeated-measures study Diesel exhaust particles 43 workers (11 in the exposed group and 32 in the control group) 2 weeks (5 consecutive working days each week) 107.25 \u00b1 39.76 \u00b5g/m3 (environmental concentrations), 155.96 \u00b1 75.70 \u00b5g/m3 (personal concentrations) Urinary 8-OHdG ELISA (Lee et al., 2010) USA Repeated-measures study Traffic-related PM2.5 82 male trucking industry workers 2.2\u201313.4 h 10.81 \u00b1 4.73 \u00b5g/m3 Urinary 8-OHdG HPLC/ECD (Neophytou et al., 2014) Epigenetics Shanghai, China Panel study Atmospheric PM2.5 30 COPD patients 24 h 38.4 \u00b1 20.8 \u00b5g/m3 DNA methylation (NOS2A) in blood Bisulfite sequencing PCR and pyrosequencing assay (Chen et al., 2015a) Boston, USA Longitudinal study Traffic-related PM2.5 718 elderly participants (age: 55\u2013100 years) 4 h-7 days \u2014 DNA methylation (LINE-1) in blood Bisulfite sequencing PCR and pyrosequencing assay (Baccarelli et al., 2009) Massachusetts, USA Panel study Metal rich-PM2.5 38 male boilermaker welders 6 h 1.06 mg/m3 DNA methylation (iNOS) in blood Bisulfite sequencing PCR and pyrosequencing assay (Kile et al., 2013) Guangzhou, China Panel study Atmospheric PM2.5 36 university students (age: 19\u201323 years) 8 h 78.38 \u00b1 30.45 \u00b5g/m3 (personal concentration), 40.46 \u00b1 14.32 \u00b5g/m3 (ambient concentration) DNA methylation (L3MBTL1, NNAT, PEG10, GNAS Ex1A, MCTS2, SNURF/SNRPN, IGF2R, RB1, CYP1B1) in blood MethylTarget (Liang et al., 2021) California, USA Cohort study Atmospheric PM2.5 940 children 7 days average 13.8 \u00b1 7.7 \u00b5g/m3 DNA methylation (iNOS) in blood Bisulfite sequencing PCR and pyrosequencing assay (Salam et al., 2012) Boston, USA Cohort study Traffic-related PM2.5 776 elderly men 28 days 11 \u00b1 7 \u00b5g/m3 DNA methylation (CRAT, IFN\u03b3, IL-6) in blood Bisulfite sequencing PCR and pyrosequencing assay (Lepeule et al., 2014) New York, USA Nested cohort study Indoor PM2.5 163 children with asthmatic and non-asthmatic (age: 9\u201314 years) 6 days Median (interquartile range): 11.9 (9.1) \u00b5g/m3 DNA methylation (IL-4, IFN\u03b3, NOS2A) in blood Bisulfite sequencing PCR and pyrosequencing assay (Jung et al., 2017) California, USA Cohort study Atmospheric PM2.5 940 children 7 days, 1 month, 6 months, 1 year Median: 11.5\u201315.8 \u00b5g/m3 DNA methylation (NOS2A, NOS3) in blood Bisulfite sequencing PCR and pyrosequencing assay (Breton et al., 2012) Beijing, China \u2014 Atmospheric PM2.5 4 Healthy subjects \u2014 \u2014 Histone modification H3K27ac ChIP-Seq assay (Liu et al., 2015) Brescia, Italy Cross-sectional study Metal rich-PM 63 steel workers 3 working days \u2014 H3K9 acetylation,H3K4 dimethylation in blood ELISA (Cantone et al., 2011) microRNA (miR-222, \u221221, \u2212146a) in blood RT-PCR (Bollati et al., 2010) London, UK Randomized experimental crossover study Traffic-related PM2.5 24 non-smoking adults 2 h 5.6 \u00b5g/m3 (Hyde Park), 25.6 \u00b5g/m3 (Oxford Street) Circulating microRNA in blood RNA-sequencing (Krauskopf et al., 2018) Pulmonary function Taiwan, China Longitudinal cohort study Atmospheric PM2.5 278,065 Taiwan residents 2 years 26.7 \u00b1 7.8 \u00b5g/m3 FVC, FEV1, MMEF Spirometer (MICROSPIRO HI-501 or CHESTGRAH HI-701) (Guo et al., 2020) Beijing, China Panel study Atmospheric PM2.5 21 healthy university students 1 h-7 days 82.1 \u00b1 68.0 \u00b5g/m3 (suburban period), 78.9 \u00b1 86.2, 60.5 \u00b1 59.3 \u00b5g/m3 (urban period 1, 2) PEF, FEV1 Electronic PEF/FEV1 diary meter (Wu et al., 2014) Beijing, China Repeated-measure study Atmospheric PM2.5 60 truck drivers and 60 office workers 8 h 94.6 \u00b5g/m3 (office workers), 126.8 \u00b5g/m3 (truck drivers) FEV1, FVC Spirometer (EasyOneultrasonic flow-sensing) (Baccarelli et al., 2014) The Netherlands Cohort study Atmospheric PM2.5 Children aged 8\u201316 years Preschool (birth-4 years), primary school (5\u201312 years), secondary school (13\u201316 years) 16.2 \u00b1 0.7 \u00b5g/m3 (preschool), 16.2 \u00b1 0.7 \u00b5g/m3 (primary school), 16.2 \u00b1 0.6 \u00b5g/m3 (secondary school) FEV1, FVC Pneumotachograph (Jaeger) and spirometer (EasyOne) (Milanzi et al., 2018) Cincinnati-Kentucky-Indiana tristate area, USA Panel study Outdoor and indoor PM2.5 44 asthmatic children (age: 10\u201316 years) 48 h 13.0 \u00b5g/m3 (outdoor PM2.5), 14.6 \u00b5g/m3 (indoor PM2.5) FEV1, FVC, FEV1/FVC, FEF25\u201375 Spirometer (KoKo Sx 1000, NSpire Health) (Isiugo et al., 2019) 8-iso-PGF2a, 8-iso-prostaglandin-F2\u03b1; 8-OHdG, 8-hydroxydeoxyguanosine; BALF, bronchoalveolar lavage fluid; CC16, club cell secretory protein; ChIP-Seq, chromatin immunoprecipitation sequencing; DTNB, 5,5\u2032-dithiobis-(2-nitrobenzoic acid); EBC, exhaled breath condensate; ECD, electrochemical detector; ELISA, enzyme linked immunosorbent assay; FENO, fractional exhaled nitric oxide; FEF25\u201375, forced expiratory flow at 25% and 75% of the pulmonary volume; FEV1, forced expiratory volume in 1 s; FEV1/FVC, a value obtained from dividing FEV1 by FVC and multiplying by 100; FVC, forced vital capacity; iNOS, inducible nitric oxide synthase; IL, interleukin; GSH, glutathione; GSSG, oxidized glutathione; HPLC, high performance liquid chromatography; LC-MS/MS, liquid chromatography tandem mass spectrometry; LINE-1, long interspersed nucleotide element; MDA, malondialdehyde; MMEF, maximal mid-expiratory flow; PEF, peak expiratory flow; PM2.5, particulate matter (<2.5 \u00b5m); PCR, polymerase chain reaction; RT-PCR, reverse transcription-PCR; SPs, pulmonary surfactant proteins; \u03b3H2AX, phosphorylated H2AX at serine 139; TNF-\u03b1, tumor necrosis factor \u03b1. Table 2 In vivo studies of PM2.5 and respiratory toxicity-related biomarkers. Table 2 Classification Animal model PM 2.5 Sampling location PM 2.5 type Exposure mode Biomarker Methods Ref. Exposure route Exposure dose Exposure duration Oxidative stress BALB/c mice China Atmospheric PM2.5 Nasal instillation 4.0 mg/kg\u00b7bw Once a day for 5 days ROS in BALF ELISA (Jin et al., 2017) Sprague-Dawley rats Boston, America Concentrated ambient particles Inhalation 300 \u00b1 60 \u00b5g/m3 1, 3, 5 h ROS in lung tissue In situ chemi-luminescence (Gurgueira et al., 2002) Wistar rats China Atmospheric PM2.5 Nasal instillation 1.5, 7.5 mg/kg\u00b7bw 7,14 days MDA, GSH-Px in lung tissue and peripheral Blood Colorimetric assay kit (Lin et al., 2009) Wistar rats Shanghai, China Atmospheric PM2.5 Intratracheal instillation 0.2, 0.8, 3.2 mg/rat Twice per week for 3 weeks MDA, SOD, GSH-Px in lung tissue Colorimetric assay kit (Wang et al., 2015a) Inflammation NC/Nga mice Yokohama, Japan Atmospheric PM2.5 Nasal instillation 200 \u00b5g per mouse Once per day for 5 times Macrophages, eosinophils, neutrophils and lymphocytes in BALF Hemocytometer (Ogino et al., 2017) BALB/c mice Fukuoka, Japan Atmospheric PM2.5 (during haze weather) Intratracheal instillation 100 \u00b5g per mouse 4 times at 2-week intervals Macrophages, neutrophils and lymphocytes in BALF Hemocytometer (He et al., 2015) IL-1\u03b2, TNF-\u03b1 in BALF ELISA BALB/c mice Yantai, China Atmospheric PM2.5 Nasal instillation 40 mg/kg\u00b7bw Once per week for 3 weeks IL-6, TNF-\u03b1 in BALF ELISA (Zhang et al., 2018) BALB/c mice USA Diesel exhaust particles Inhalation 0.5 or 2 mg/m3 4 h per day for 1 or 5 days Neutrophil in BALF Coulter Counter (Gowdy et al., 2008) IL-6, TNF-\u03b1 in lung tissues RT-PCR CC16, SP-A and SP-D in lung tissue RT-PCR, Western blot, IHC C57BL/6 mice Wuhan, China Atmospheric PM2.5 Inhalation 560 \u00b5g/m3 6 h per day, 5 days per week for 48 weeks IL-6, IL-8 in BALF ELISA (Zhao et al., 2019b) Wistar rats Xinxiang, China Atmospheric PM2.5 Intratracheal instillation 1.2 mg/kg\u00b7bw Once per day for 3 consecutive days IL-1\u03b2, IL-8, TNF-\u03b1 in BALF ELISA (Zhao et al., 2018) DNA damage Sprague-Dawley rats Taiwan, China Traffic-related PM2.5 Intratracheal instillation 200 \u00b5g per house Single exposure 8-OHdG in blood ELISA (Lei et al., 2005) Wistar rats \u2014 Cigarette smoke from Great Gate cigarettes, China Inhalation Ratio of smoke volume to whole air volume in the chamber: 20% and 60% for two smoking groups 5 days per week for 45 weeks, twice per day for 30 min each with a 4-h interval between exposures 8-OHdG in urine, lung tissue and lymphocytes ELISA (Chen et al., 2015b) OGG1 in lung tissue RT-PCR Epigenetics C57BL/6 mice Taiyuan, China Atmospheric PM2.5 Oropharyngeal aspirations 3 mg/kg\u00b7bw Once every other day for 2 or 4 weeks and for 4 weeks following 1 week and 2 weeks recovery Histone modification (H3K27ac) in lung tissue ChIP (Ji et al., 2019) C57BL/6 mice Shijiazhuang, China Atmospheric PM2.5 Inhalation 900.21 \u00b5g/m3 6 h per day for 8 weeks 8 miRNAs associated with lung cancer in lung and serum (miR-3971, miR-411\u20133p, let-7a-1\u20133p, miR-93\u20133p, miR-20b-3p, miR-27a-5p, miR-7013\u20135p, miR-6996\u20135p) miRNA microarray analysis (Ning et al., 2019) F344/N rats Albuquerque, USA Diesel exhaust (DE), carbon black (CB) Inhalation 2.4 \u00b1 0.02 and 6.33 \u00b1 0.04 mg/m3 for DE, 2.46 \u00b1 0.03 and 6.55 \u00b1 0.06 mg/m3 for CB 16 h per day, 5 days per week for 24 months DNA methylation (p16, estrogen receptor \u03b1) in lung tumors MSP and bisulfite sequencing PCR (Belinsky et al., 2002) C57BL/6 mice Shanghai, China Atmospheric PM2.5 Nasal instillation 100 \u03bcg Once per day for 4 weeks TGF-\u03b21 in serum ELISA (Xu et al., 2019b) COL1, \u03b1-SMA and TGF-\u03b21 in lung tissue IHC C57BL/6 mice Xinxiang, China Atmospheric PM2.5 Inhalation 131.99 \u00b5g/m3 6 h per day, 7 days per week for 5 months IL-1\u03b2, TGF-\u03b21 in BALF ELISA (Ding et al., 2019) \u03b1-SMA in lung tissue IHC C57BL/6 mice \u2014 Cigarette smoke form Baisha cigarettes with filter, China Inhalation 20 mL 20 mL smoke per 8 s, two times a day for 50 min with 20-minute smoke-free intervals, 5 days per week for 24 weeks in total MMP-9 in lung tissue IHC and RT-PCR (Zhou et al., 2019b) BALB/c mice Beijing, Xian, Hong Kong, China Atmospheric PM2.5 in different cities Pharyngeal aspiration 50 or 150 \u00b5g per mouse Once per week for 2 weeks E-cadherin in lung tissue Immunohistochemistry and ELISA (Chuang et al., 2015) Sprague-Dawley rats Beijing, China Atmospheric PM2.5 Intratracheal instillation 1.8, 5.4, 16.2 mg/kg\u00b7bw Once every 3 days and 10 times in total E-cadherin, Fibronectin in lung tissue Western blot (Sun et al., 2020) Hydroxyproline in lung tissue Hydroxyproline Assay Kit Wistar rats Shenyang, China Atmospheric PM2.5 Inhalation 750 \u00b5g/m3 4 h per day, 5 days per week for a total of 2 weeks MMP9 in lung tissue IF (Yang et al., 2018a) Plasma MMP-8 and TIMP-1 Cytokine antibody array kit \u03b1-SMA, \u03b1-smooth muscle actin; ChIP, chromatin immunoprecipitation; COL1, collagen type I; E-cadherin, epithelial cadherin; GSH-Px, glutathione peroxidase; H3K9, histone 3 lysine 9; IF, immunofluorescence; IHC, immunohistochemistry; MMPs, matrix metalloproteases; MSP, methylation-specific PCR; OGG1, 8-oxoguanine glycosylase 1; ROS, reactive oxygen species; SOD, superoxide dismutase; TGF-\u03b2, transforming growth factor beta; TIMP-1, tissue inhibitor of metalloproteinase-1. Table 3 In vitro studies of PM2.5 and respiratory toxicity-related biomarkers. Table 3 Classification Cell model PM 2.5 sample location PM 2.5 type Exposure mode Biomarker Methods Ref. Time Dose Oxidative stress BEAS-2B Guangzhou, Wuhan, Chengdu, Beijing, Shanghai, Zhanjiang, China Atmospheric PM2.5 100 \u00b5g/mL 24 h ROS FCM (DCFH-DA staining) (Yang et al., 2016) BEAS-2B Beijing, Guangzhou, China Atmospheric PM2.5 in different cities 10, 20 and 30 \u00b5g/mL 24 h ROS Automated microplate reader (DCFH-DA staining) (Jin et al., 2019) A549 Shanghai, China Water-soluble and -insoluble PM2.5 400 \u00b5g/mL 4, 6, 24 and 48 h ROS FCM (CellROX green) (Zou et al., 2016) BEAS-2B Benin, France Atmospheric PM2.5 3, 12 \u03bcg/cm2 24, 48 and 72 h MDA, GSH HPLC (Cachon et al., 2014) SOD SOD Assay Kit A549 Nanjing, China Atmospheric PM2.5 1, 10, 100, 200 and 400 \u00b5g/mL 24 h GSH, SOD ELISA (Chen et al., 2018b) Inflammation BEAS-2B Guangzhou, Wuhan, Chengdu, Beijing, Shanghai, Zhanjiang, China Atmospheric PM2.5 in different cities 100 \u00b5g/mL 24 h IL-1\u03b2 ELISA and RT-PCR (Yang et al., 2016) BEAS-2B Dakar, France Atmospheric PM2.5 in rural and urban 3, 12 \u00b5g/cm2 8, 24 h TNF-\u03b1, IL-1\u03b2, IL-6, IL-8 ELISA (Ndong Ba et al., 2019) RAW264.7 and A549 Baltimore, USA Atmospheric PM2.5 and NIST Interim Reference Material PM2.5 1, 2, 3.9, 7.8, 15.6, 31.2, 62.5, 125, 250, 500 or 1000 \u00b5g/mL 24 h TNF-\u03b1, IL-6, IL-8, MCP-1 ELISA (Mitkus et al., 2013) A549 SRM 2975 from NIST Diesel exhaust particles 25, 50, 75 and 100 \u03bcg/mL 24 h IL-6, IL-8, CC16, SP-A RT-PCR (Vattanasit et al., 2014) DNA damage BEAS-2B Guangzhou, Wuhan, Chengdu, Beijing, Shanghai, Zhanjiang, China Atmospheric PM2.5 100 \u00b5g/mL 24 h \u03b3H2AX IF (Yang et al., 2016) BEAS-2B Beirut, Bejje, Lebanon Atmospheric PM2.5 in urban area and rural area 3, 12 \u00b5g/m2 24, 48 and 72 h \u03b3H2AX FCM (Borgie et al., 2015) BEAS-2B Dunkerque, France Atmospheric PM2.5 3, 15 \u00b5g/cm2 48 h 8-OHdG ELISA (Billet et al., 2018) 72 h \u03b3H2AX FCM BEAS-2B Zhanjiang, China Atmospheric PM2.5 100 \u00b5g/mL 24 h OGG1 Western blot and IF (Yang et al., 2015) DNA strand break Comet assay Epigenetics BEAS-2B Wuhan, China Atmospheric PM2.5 1.5, 3 and 6 \u00b5g/cm2 5, 10 days DNA methylation (P53 promoter region) Bisulfite sequencing PCR (Zhou et al., 2016) HBE Taiyuan, China Atmospheric PM2.5 10, 50 \u00b5g/mL 24 h DNA methylation (A2M, IL23A, TPIP6, IL27, MYD88, ILE2B, NLRC4, TNF) Illumina 850 K methylation chip (Wang et al., 2020a) Primary mouse tracheal epithelial Taiyuan, China Atmospheric PM2.5 0.2,0.4, 0.8 and 1.6 mg/mL 48 h MicroRNA (miR-206) RT-PCR (Wang et al., 2019a) A549 NIST, USA PM2.5 50 \u00b5g/mL 48 h MicroRNA (miR-486) RT-PCR (Li et al., 2018a) Pulmonary Fibrosis BEAS-2B Shanghai, China Atmospheric PM2.5 25 \u03bcg/mL 1, 20, 30 passages TGF-\u03b21 E-Cadherin, COL1 ELISA and Western blot (Xu et al., 2019b) HFL-1 25, 50, 100, 200 \u03bcg/mL 24 h TGF-\u03b21, \u03b1-SMA, COL1 ELISA, Western blot, IF RAW264.7 25, 50, 100, 200 \u03bcg/mL 24 h TGF-\u03b21 ELISA and Western blot BEAS-2B Shanghai, Ningbo, Nanjing, China Atmospheric PM2.5 in different cities 0.1, 1, 5 \u03bcg/mL 48 h E-cadherin, Vimentin RT-PCR and Western blot (Chi et al., 2018) A549 and SAEC \u2014 Cigarette smoke extract form Marlboro red cigarettes 2.5%, 5%, 10%, 20% (v/v) 24 h E-cadherin, Vimentin Western blot and IF (Agraval and Yadav, 2019) MMP-2, MMP-9 Western blot and Gelatin zymography A549 SRM 2975 from NIST Diesel exhaust particles 5, 10 \u00b5g/cm2 6, 24 h MMP-1 RT-PCR, Western blot, Zymography assay (Amara et al., 2007) MH-S, RAW264.7 \u2014 Cigarette smoke extract form Baisha cigarettes with filter 0.5% 48 h MMP-9 RT-PCR and Western blot (Zhou et al., 2019b) A549, human alveolar epithelial adenocarcinoma cells; AEC2s, type 2 alveolar epithelial cells; AMs, alveolar macrophages; BEAS-2B, human lung/bronchial epithelial cell; DCFH-DA, dichlorofluorescein diacetate; FCM, flow cytometry; HBE, human bronchial epithelial; HFL-1, human fetal lung fibroblast 1; MCP-1, monocyte chemoattractant protein-1; MH-S, mouse alveolar macrophage cells; NIST, National Institute of Standards and Technology; RAW264.7, mouse monocytic/macrophage-like cells; SAEC, human small airway epithelial cells. Review Biomarkers for the adverse effects on respiratory system health associated with atmospheric particulate matter exposure Caixia Guo a b 1 Songqing Lv b c 1 Yufan Liu b c Yanbo Li b c \u204e a Department of Occupational Health and Environmental Health, School of Public Health, Capital Medical University, Beijing 100069, China Department of Occupational Health and Environmental Health, School of Public Health, Capital Medical University Beijing 100069 China Department of Occupational Health and Environmental Health, School of Public Health, Capital Medical University, Beijing, 100069, China b Beijing Key Laboratory of Environmental Toxicology, Capital Medical University, Beijing 100069, China Beijing Key Laboratory of Environmental Toxicology, Capital Medical University Beijing 100069 China Beijing Key Laboratory of Environmental Toxicology, Capital Medical University, Beijing, 100069, China c Department of Toxicology and Sanitary Chemistry, School of Public Health, Capital Medical University, Beijing 100069, China Department of Toxicology and Sanitary Chemistry, School of Public Health, Capital Medical University Beijing 100069 China Department of Toxicology and Sanitary Chemistry, School of Public Health, Capital Medical University, Beijing, 100069, China \u204e Corresponding author at: Beijing Key Laboratory of Environmental Toxicology, Capital Medical University, Beijing 100069, China. Beijing Key Laboratory of Environmental Toxicology, Capital Medical University Beijing 100069 China 1 The two authors contributed to this work equally. Editor: Dr. S. Nan Large amounts of epidemiological evidence have confirmed the atmospheric particulate matter (PM2.5) exposure was positively correlated with the morbidity and mortality of respiratory diseases. Nevertheless, its pathogenesis remains incompletely understood, probably resulting from the activation of oxidative stress, inflammation, altered genetic and epigenetic modifications in the lung upon PM2.5 exposure. Currently, biomarker investigations have been widely used in epidemiological and toxicological studies, which may help in understanding the biologic mechanisms underlying PM2.5-elicited adverse health outcomes. Here, the emerging biomarkers to indicate PM2.5-respiratory system interactions were summarized, primarily related to oxidative stress (ROS, MDA, GSH, etc.), inflammation (Interleukins, FENO, CC16, etc.), DNA damage (8-OHdG, \u03b3H2AX, OGG1) and also epigenetic modulation (DNA methylation, histone modification, microRNAs). The identified biomarkers shed light on PM2.5-elicited inflammation, fibrogenesis and carcinogenesis, thus may favor more precise interventions in public health. It is worth noting that some inconsistent findings may possibly relate to the inter-study differentials in the airborne PM2.5 sample, exposure mode and targeted subjects, as well as methodological issues. Further research, particularly by -omics technique to identify novel, specific biomarkers, is warranted to illuminate the causal relationship between PM2.5 pollution and deleterious lung outcomes. Graphical Abstract ga1 Keywords Particulate matter Oxidative stress Inflammation Epigenetics Pulmonary function Biomarker 1 Introduction Ambient particulate matter (PM) pollution has been widely regarded as an important environmental risk factor, contributing to tremendous disease burden, health and economic loss. According to the report of State of global air/2020 released by the Health Effects Institute, air pollution is the 4th leading risk factor for early death worldwide in 2019 (Health Effects Institute, 2020). Among these, ambient PM2.5 pollution accounts for 62% of all air pollution-attributable deaths and 55% of lost disability-adjusted lifer years (DALYs), that is, 4.14 (95% uncertainty interval [UI]: 2.50\u20133.36) million deaths and 118 (95% UI: 95.9\u2013138) million DALYs (Health Effects Institute, 2020). The Global Burden of Disease Study (GBD) reveals ambient PM pollution has increased from 13th in 1990\u20137th in 2019 leading risk factor for attributable DALYs globally (GBD 2019 Risk Factors Collaborators, 2020). PM2.5 pollution is an extremely pressing public health issue in China, and still remains a challenge. In despite of a 33.3% decline in the annual average level of PM2.5 during 2013\u20132017, over 80% of the Chinese population still experienced PM2.5 that exceeded the least stringent WHO air quality interim target of 35 \u03bcg/m3 (Yin et al., 2020). The global cost of health effects attributable to ambient PM2.5 pollution has increased to 3552 billion in 2013 (Niu et al., 2017). In China, the economic loss attributable to air pollution was reported to account for about 0.72%\u201310% of its Gross Domestic Production (GDP) based on different study settings (Chen and Bloom, 2019). A large amount of epidemiological evidence links short- and long-term PM2.5 exposures with higher rates of disease prevalence and mortality, among which respiratory diseases are most obvious (Lu et al., 2015). According to the GBD 2017, 35% of deaths due to lower respiratory infections in China were associated with air pollution (Institute for Health Metrics and Evaluation (IHME), 2017). It was estimated that the per capita economic burden due to air pollution-attributable chronic respiratory diseases in China amount to a loss of US$ 222 and US$ 89 in 1990\u20132030 and 2015\u20132030, respectively (Chen and Bloom, 2019). In an epidemiological study conducted in 272 cities in China, a 10 \u03bcg/m3 increase of atmospheric PM2.5 would contribute to 0.29% (95% posterior interval [PI], 0.17%\u22120.42%) increment in mortality from respiratory diseases (Chen et al., 2017). PM2.5 exposure was pointed out to impair lung function (Guo et al., 2018, 2019), and related to the occurrence and aggravate of bronchial asthma (Fan et al., 2016). PM2.5 exposure also increases the risk and mortality of lung cancer (Li et al., 2017a). In 2013, PM from outdoor air pollution has been defined as a Group 1 human carcinogen (Loomis et al., 2013). Accumulating experimental evidence have demonstrated PM2.5 can be easily inhaled into and deposit in the trachea, bronchi and even alveoli, resulting in adverse effects on respiratory system and function. A recent in vivo study found that PM2.5 exposure would increase lung susceptibility, in despite of a gradual recovery from lung injury after the cessation of PM2.5 exposure (Ren et al., 2020). Overall, PM2.5 acts as a possible etiological factor of lung diseases (Xing et al., 2016), but its pathogenesis is far from fully understood. Additionally, the complexity of chemical composition in PM2.5 brings in a great challenge to toxicological evaluation. A biomarker is kind of a biological observation result, which can be a cell or a small molecular mediator, and is an index used to detect pathophysiological processes or reactions after exposure (Califf, 2018). Biomarkers could be exposure or effect indicators, which were intensively applied to explore the inter-connection between the environment stimuli and adverse health events (Rylance et al., 2013). In recent years, biomarkers have been used as a powerful tool to investigate the interplay of PM2.5 with its-associated health outcomes. Overall, the adverse respiratory effects of PM2.5 were mainly in the following aspects: oxidative stress, inflammation, respiratory epithelial injury, fibrosis, genetic and epigenetic changes. Here, this paper mainly reviews the current progress in biomarkers investigation related to respiratory toxicity upon PM2.5 exposure, which would facilitate to understand the contribution of PM2.5 on the etiology, disease development of respiratory diseases. 2 Biomarkers implicated following PM2.5 exposure 2.1 Oxidative stress Oxidative stress was commonly regarded as a major way of respiratory injury caused by PM2.5. It has been well-documented that respiratory deposition PM2.5 could cause reactive oxygen species (ROS) in lung due to redox reaction of its components with lung antioxidants, resulting in the activation of pulmonary and/or systemic oxidative stress (Guan et al., 2019; Marchini et al., 2020; Guo et al., 2021). In turn, data from population study (Qiu et al., 2021) and animal models (Yang et al., 2018b) suggested that the upregulation of antioxidant system was beneficial to counteract PM2.5-induced lung injury. 2.1.1 ROS The excessive generation of ROS (e.g., superoxide, hydroxyl radical and hydrogen peroxide [H2O2]) stimulated by the external air pollutants was commonly used as the most direct evidence of oxidative stress. Increased H2O2 content in exhaled breath condensate (EBC) was found in secondhand smoke-exposed healthy people (Kostikas et al., 2013). An in vivo study conducted by Gurgueira et al. demonstrated a rapid ROS generation in the lungs of rats after PM2.5 inhalation (Gurgueira et al., 2002). Similarly, a significantly elevated ROS level was detected in bronchoalveolar lavage fluid (BALF) of PM2.5-exposed mice (Jin et al., 2017), and also the in vitro lung/bronchial epithelial cells, BEAS-2B (Liu et al., 2020). Yang et al. reported PM2.5 elevated ROS levels in BEAS-2B, whereas no alteration on the enzymatic activity of antioxidant SOD and total antioxidant capacity was detected (Yang et al., 2016). Their further component analysis revealed that the increased ROS level was associated with Fe in PM2.5. Another domestic study revealed summer-winter differences in PM2.5-induced respiratory toxicity, owing to a severer induction of ROS generation and GSH depletion by winter PM2.5, as well as inflammatory response (Chen et al., 2018b). The heterogeneity of PM2.5-induced oxidative potential was closely linked with its composition. Studies have reported the greater induction of respiratory toxicity by organic fraction of PM2.5 over water-soluble PM2.5 (Meng and Zhang, 2007; Song et al., 2019). Verma et al. identified organic aerosol as the main ROS-related sources of water-soluble PM2.5 fractions (Verma et al., 2015). Gali et al. harvested solid particulate phase (solid-PM) and semi-volatile PM (SV-PM) by using front and backup filters (Gali et al., 2017). They concluded SV-PM triggered more than two-fold ROS production compared to solid-PM on a PM2.5 mass basis (Gali et al., 2019). Simultaneously, organic extract from solid-PM and SV-PM was found capable of inducing a much higher oxidative stress in macrophages and epithelial cells compared to water-soluble PM2.5 extract (Gali et al., 2019). Also, hydrophobic components in both water-soluble and insoluble organic aerosols were pointed out to be a major contributor to the environmental PM-related oxidative properties (Verma et al., 2012). An in vitro evidence revealed water-soluble fraction of PM2.5 triggered ROS production at early response times (2, 4, and 6 h), and conversely, water-insoluble fraction increased ROS just at a later time (24 or 48 h) (Zou et al., 2016). Researches have shown polycyclic aromatic hydrocarbons (PAHs) was the major redox-active component on PM2.5, and its content was directly correlated with ROS generation capacity (Sklorz et al., 2007; Sun et al., 2018). An in vitro study performed by Jin et al. quantified metals and PAHs accounting for 38% and 24% on PM2.5-elicited ROS generation in Beijing and Guangzhou, respectively (Jin et al., 2019). In comparison to summer PM2.5, higher accumulations of some transition metals such as Cu, Mn and Co in winter PM2.5 samples may explain the seasonal variation of ROS generated by PM2.5 (Chen et al., 2018b). 2.1.2 Malondialdehyde (MDA) MDA in urine, serum or EBC was frequently monitored to reflect air pollution-derived systemic or airway oxidative stress. Quite a few studies have proven the elevated MDA level in accordance with high PM2.5 exposure. For instance, per inter-quartile range (IQR) increase in airborne PM2.5 was related to a 10%\u221220% increase in urinary MDA level (Gong et al., 2014). He et al. also demonstrated the correlation of an IQR increase in 12 h PM2.5 with 6.1% (95% confidence interval [CI]: 1.6%\u221210.8%) increase in urinary MDA (He et al., 2020). Moreover, a pilot study of nine volunteers traveled from Germany to China observed strong correlations between PM2.5 and urinary MDA (Wu et al., 2017b). A decline of EBC MDA in healthy young adults was observed to associate with air quality improvement during the Beijing Olympic Games period (Gong et al., 2013). A panel study of 125 Beijing residents to compare the association of PM2.5 with biomarkers reflecting respiratory events observed significant associations of EBC MDA with PM2.5 at lag 3, 4, and 5 (Gong et al., 2014). Another panel study investigated 97 elderly residents in metropolitan area of Los Angeles, and showed an interquartile increase in PAHs (5-d average) was related to a 6.3% (95% CI: 1.1%\u221211.6%) increment in EBC MDA (Zhang et al., 2016). By meta-analysis, Li et al. showed a 1.60% (95% CI: 0.21%, 3.01%) increase in MDA (P = 0.024) accompanying with per 10 \u03bcg/m3 increase of short-term PM2.5 exposure (Li et al., 2020). Consistently, in vivo and in vitro data confirmed the elevation of MDA in the lung tissues of PM2.5-exposed animal models (Li et al., 2018b; Lin et al., 2009) and bronchial epithelial cells (Cachon et al., 2014; Wu et al., 2017a). 2.1.3 Antioxidants Some in vivo and in vitro studies have confirmed that the declined glutathione (GSH), whilst increased oxidized glutathione (GSSG) in lung tissue or cells after PM2.5 exposure (Chen et al., 2018b; Riva et al., 2011; Zhu et al., 2019). Oppositely, an enhanced GSH content was detected in BALF of healthy volunteers after wood smoke exposure (Sehlstedt et al., 2010). The increased GSH in BALF may reflect GSH mobilized to the air-lung interface to cope with oxidative stress induced by the investigated wood smoke-derived PM. Besides, antioxidants, such as GSH-Px, superoxide dismutase (SOD) and catalase (CAT) were inhibited after PM2.5 exposure in mouse lung tissues (Wang et al., 2015a). Likewise, there were exceptions to this tendency. For example, chalk PM2.5 exposure could make oxidative damages on alveolar macrophages (AMs), characterized by the increased intracellular MDA and CAT levels while decreased SOD level (Zhang et al., 2015). In addition, heme oxygenase 1 (HO-1) is an inducible antioxidant enzyme to against PM2.5-caused oxidative stress (Li et al., 2017b), as well as inflammation (Kim et al., 2020). But no alteration of HO-1 was found in the bronchi of the healthy volunteers exposed to wood smoke (Sehlstedt et al., 2010). 2.1.4 8-iso-prostaglandin-F2\u03b1 (8-iso-PGF2a) 8-iso-PGF2a is proposed to be a reliable indicator to oxidative stress and lipid peroxidation (Awad et al., 1993; Montuschi et al., 2004). Upon PM2.5 exposure, the content of 8-iso-PGF2a in urine was reported to be increased, as well as 8-isoprostane in EBC (Ferguson et al., 2016). In welding workers, a 10 \u03bcg/m3 increase in PM2.5 corresponded to the increments in 8-OHdG and 8-iso-PGF2\u03b1 by 2.15% and 8.43%, respectively (Lai et al., 2016). Curiously, urinary 8-iso-PGF2a in healthy subjects exposed to wood smoke was decreased after PM exposure (Stockfelt et al., 2013). 2.1.5 EBC pH EBC pH value is a valid indicator for airway acidification (Vaughan et al., 2003), and has been proved to relate to respiratory oxidative stress and inflammation (Gessner et al., 2003). In 404 healthy volunteers, only 6.4% of EBC samples present a pH range less than 7.4 (Paget-Brown et al., 2006). Healthy people showed a decline in pH value of airway after secondhand smoke exposure (Kostikas et al., 2013). Similar findings were reported in a study of firemen exposure to wood smoke (Ferguson et al., 2016). In addition, Gong et al. reported EBC pH was significantly correlated with PM2.5 from lag 0 to lag 5 (Gong et al., 2014). 2.2 Inflammation Inflammation is a defense-based pathological response after external stimulation. Toxic components in the air, such as organic compounds and metals, can cause inflammation and damage to the respiratory system when they come into contact with the respiratory tract. The excessive inflammation is considered as a major causal event, resulting in the occurrence or aggravation of respiratory diseases. Experimental data have revealed the activation of inflammatory responses by PM2.5 in in vitro cultured human bronchial epithelial cells (16HBE) (Zhou et al., 2015), lung epithelial cells (A549) (Wessels et al., 2010) and mice lungs in vivo (Riva et al., 2011). Panel studies performed by Jaafari et al. revealed PM exposure increased inflammatory biomarkers, e.g., interleukin-6 (IL-6) and white blood cells (WBC) (Jaafari et al., 2021). In particular, the changes in biomarkers varied by the source of PM exposure (Jaafari et al., 2020, 2021). Oxidative stress in high level could activate the oxidative pathways (e.g., NF-\u03baB, MAPK) to modulate inflammation (Li et al., 2003; Guo et al., 2015, 2016). Along with higher levels of ROS and MDA, the secretions of pro-inflammatory cytokines (IL-1\u03b2, IL-6 and TNF-\u03b1) were detected in PM2.5-treated BEAS-2B cells, as well as nitric oxide (NO) production (Song et al., 2019). A proteomic analysis revealed the activation of antioxidant enzymes (e.g., CAT, HO-1) in macrophage (Raw264.7) at a lower dose of organic extract of diesel exhaust particulate (DEP), whilst the induction of pro-inflammatory related enzymes required a higher dose. He et al. also revealed PM2.5-triggered inflammation in type II alveolar cell-rich lungs was predominantly oxidative stress-dependent, but not LPS/MyD88-dependent (He et al., 2017). In addition, Club Cell secretory proteins (e.g., CC16) secreted mainly by non-ciliated bronchiolar Clara cells and lung surfactant proteins (SPs) by alveolar type II epithelial cells could protect the respiratory system against inflammatory damage. For instance, CC16 could inhibit inflammatory cell infiltration (Johansson et al., 2009). In DEP-treated A549 cells, the expression of anti-inflammatory CC16 was negatively correlated with pro-inflammatory cytokines (IL-6, \u22128) (Vattanasit et al., 2014). 2.2.1 Inflammatory cells Inflammatory cells gather in the inflammatory site and release inflammatory mediators to particulate the inflammatory response. Inflammatory cells were detected in sputum samples from 9 healthy volunteers exposed to PM2.5\u201310, among which, the number of neutrophils was increased (Alexis et al., 2006). Some studies pointed out the induction of airway hyperresponsiveness by PM2.5 was associated with neutrophils (Zhao et al., 2019c), not eosinophils (Hosseini et al., 2016). NC/Nga mice are sensitive to respiratory allergy induced by environmental chemical allergens (Nishino et al., 2014). Ogino et al. reported PM2.5 induced asthma-like airway inflammation in NC/Nga mice, where PM2.5 increased the total cell counts including eosinophils in BALF (Ogino et al., 2017). Similar results were found in PM2.5-exposed mice, that is, PM2.5 significantly increased the number of macrophages, neutrophils and lymphocytes in BALF of mice (He et al., 2015). After the phagocytosis of inhaled particles, alveolar macrophage releases chemotactic mediators that could attract inflammatory cells into the adjacent lung tissue. The pro-inflammatory mediators released by alveolar macrophages are crucial to the pathogenesis of PM2.5-caused inflammatory and allergic lung diseases (Shoenfelt et al., 2009). 2.2.2 Inflammatory mediator Cytokines were synthetized and secreted by immune or non-immune cells in response to a stimulus, thereafter regulating gene expression, immune response, inflammation and other cellular functions. Interleukins (ILs) were linked with pulmonary inflammatory processes induced by PM (Alfaro-Moreno et al., 2008). IL-1\u03b2 has been detected to be elevated in children exposed to black carbon (De Prins et al., 2014), and also in taxi driver owing to traffic-related air pollution (Brucker et al., 2013). However, a study of Swedish paper workers showed the opposite (Westberg et al., 2016). An in vitro study revealed the high concentrations of PAHs and nickel (Ni) in PM2.5 samples were strongly associated with high level of IL-1\u03b2 in BEAS-2B cells (Yang et al., 2016). IL-6 is known to cause pulmonary inflammation and injury in response to environmental insults to the lung (Thacker, 2006). Short- or long-term PM2.5 exposure increased IL-6 in human nasal lavage fluid (NAL) (Janssen et al., 2015) and mice BALF (Zhao et al., 2019b). Through monitoring indoor PM2.5 level and collected sputum samples from 430 healthy children, researchers figured out the association between indoor PM2.5 and IL-6 levels, and urban children had higher IL-6 levels than rural children (Nazariah et al., 2013). Also, long-term and high-level PM2.5 exposure was reported to cause a remarkable increase in circulating IL-6 in a mixed population (Hajat et al., 2015). Recently, Zhu et al. found that per 10 mg/m3 increase in PM2.5 concentration was dramatically correlated with a 4.66% increase in IL-6 level (95% CI: 1.14%\u22128.18%, P = 0.010) (Zhu et al., 2021). IL-8 is a chemokine that mainly acts on neutrophils, also known as neutrophil-activating protein. Populational study have reported increased IL-8 and TNF\u03b1 in sputum of healthy volunteers exposed to PM2.5\u201310 (Alexis et al., 2006). Experimental evidence also showed the level of IL-1\u03b2, \u22126, \u22128 and TNF\u03b1 were all remarkably increased in BALF of rats after pulmonary exposure to PM2.5 via intratracheal instillation (Zhao et al., 2018) and in vitro BEAS-2B (Ndong Ba et al., 2019). It is worthy to note the conflicting findings in the relationship between PM2.5 exposure and cytokines. Exposure to PM2.5 in farmers was negatively correlated to IL-4, \u22126, \u22128 and \u221213, as well as to TNF\u03b1 and interferon-gamma (IFN\u03b3) (Audi et al., 2017). This phenomenon was explained by adaptability owing to the long-term exposure to PM2.5. Similarly, inverse correlation of long-term air pollution exposure with inflammatory markers was observed by Forbes et al. (Forbes et al., 2009). The declined IL-1\u03b2, \u22126 were also detected in factory dust-exposed Swedish paper workers (Westberg et al., 2016). Toxicological studies have shown an induction of IL-6 whilst inhibition of IL-8 after exposure to PM2.5 (Alfaro-Moreno et al., 2009; Fuentes-Mattei et al., 2010). The release of IL-8 and monocyte chemotactic protein (MCP-1) in A549 cells, as well as IL-6 and TNF\u03b1 secreted from macrophages (Raw264.7), were dose-dependently increased following PM2.5 treatment (Mitkus et al., 2013). Impressively, the elements Ni, arsenic (As), and vanadium (V) were regarded as the most important metals to be closely linked with the induction or inhibition of cytokines upon PM2.5 exposure (Gioda et al., 2011). Moreover, an in vitro study performed by Rodriguez-Cotto et al. demonstrated the site-specific and time-dependent influence of PM on cytokines (Rodr\u00edguez-Cotto et al., 2014). Additionally, the pro-inflammatory potential of PM was particle size-dependent (Mantecca et al., 2010). 2.2.3 Fractional exhaled nitric oxide (FENO) FENO is currently proposed as a biomarker for detection of airway inflammation (Dinh-Xuan et al., 2015). NO in the respiratory system is mainly produced by constitutive nitric oxide synthase (NOS) and inducible NOS (iNOS). A variety of proinflammatory cytokines can induce a large number of NOS expression, resulting in a large release of NO (Ricciardolo, 2014). In vivo data showed an increased expression of iNOS in the lung tissues of mice after exposed to PM2.5 (Li et al., 2017a; Zhang et al., 2018). Air pollution was confirmed to be associated with increase in FENO in children (Delfino et al., 2006), young adult (Huang et al., 2012b) and also elderly people (Adamkiewicz et al., 2004). For instance, a study of 130 children monitored the exposure of carbon black was positively associated with FENO (De Prins et al., 2014). 2.2.4 CC16 Serum CC16 was extensively applied to evaluate the integrity and permeability of lung epithelium. Increased level of CC16 in serum was observed after acute exposure to diverse environmental pollutants exposure, including PM (Madsen et al., 2008). Wang et al. conducted a panel study among healthy, nonsmoking college students in Shanghai, China, and reported the serum CC16 level was elevated immediately at 0\u20132 h after PM2.5 exposure and this upward trend could last for up to 24 h (Wang et al., 2017). Apart from in blood, CC16 can also appear in urine, but with a slightly longer time lag (Timonen et al., 2004; Jacquemin et al., 2009). Timonen et al. assessed the associations between urinary CC16 level and PM exposure in patients with coronary heart disease, and found urinary CC16 level corresponding to an increase of PM2.5 levels in Helsinki, especially in patients with lung disorders (Timonen et al., 2004). On the other hand, serum CC16 level was recognized as a potential indicator to pulmonary dysfunction and obstructive pulmonary disease (Rava et al., 2013). Growing evidence have suggested the anti-inflammatory and anti-oxidative effects of CC16 in the lungs (Broeckaert and Bernard, 2000). Wang et al. indicated an immediate impairment in lung function upon acute PM2.5 exposure by virtue of the loss of pulmonary epithelium integrity, as evidenced by increased serum CC16 (Wang et al., 2017). By contrast, prospective studies have shown that low serum concentrations of CC16 were associated with an accelerated progression of chronic obstructive pulmonary diseases (COPD) or increased risk of lung cancer death in the general adult population (Guerra et al., 2015). Consistently, the decline in CC16 concentration was observed after environmental exposure to cigarette smoke (Van Miert et al., 2005; Zhu et al., 2015), diesel exhaust (Gowdy et al., 2008) and heave metal Cr (Zhao et al., 2014; Li et al., 2015). Researchers speculated that atmospheric pollution compromised the pulmonary permeability upon acute exposure, leading to the secretion of CC16 protein in extrapulmonary fluid (Leite et al., 2018). In turn, a consequence of decreased secretion of CC16 after long-term or chronic exposure may attribute to destruction of lung Clara cells or their differentiation for the repair of damaged lung tissue (Leite et al., 2018). In a traffic-related study of healthy, nonsmoking volunteers in Netherlands (Zuurbier et al., 2011), no consistent association between PM2.5 and serum CC16 was observed after 2-h commute during the morning rush hour. That was in line with no detectable acute effects of traffic-related PM exposure on blood-gas permeability and pulmonary function among healthy Caucasian nonsmokers (Br\u00e4uner et al., 2009). And also, Zhao et al. observed no difference of CC16 between traffic policemen and the general population, but remarkable lower in lung function, as well as higher systemic inflammatory response were noticed in traffic policemen due to PM2.5 exposure (Zhao et al., 2015). 2.2.5 Pulmonary surfactant proteins (SPs) Growing evidence indicate hydrophilic SP-A and SP-D as pulmonary host defense molecules, participate in mechanical functions of the lung, and serve as potent antioxidants to modulate oxidation of the phospholipids (Bridges et al., 2000). Specifically, they have been proposed as molecular biomarkers for diagnosis and prognostic evaluation in idiopathic pulmonary fibrosis (IPF) (Greene et al., 2002; Ley et al., 2014). Elevated levels of SP-A and SP-D in serum were reported in patients with IPF and pulmonary alveolar proteinosis (Kuroki et al., 1993). The alterations of their levels reflect dysfunction, injury and apoptosis of type II alveolar epithelial cells (Ley et al., 2014). It was found that the levels of serum SP-D and SP-A in coking plant workers were higher than those in healthy non-smokers, meanwhile, SP-A increased slowly after long-term PM2.5 exposure, indicating a rise in pulmonary surfactant compensation for lung homeostasis (Wang et al., 2018b). However, no significant alteration of SP-D in EBC and blood was detected in firemen exposed to wood smoke (Ferguson et al., 2016). Animal experimental evidence also support PM could modulate pulmonary SPs and lung function. For instance, the expression of SP-A in PM2.5-exposed rat lungs was decreased, conversely, the cell counts of macrophages, monocytes, lymphocytes were increased in BALF (Aztatzi-Aguilar et al., 2016). Similarly, SP-A and SP-D were decreased in the lung tissue of mice following DEP exposure at a concentration of 0.5 mg/m3, but not at a higher concentration of 2 mg/m3 (Gowdy et al., 2008). The recovery in expression and production of SP-A and SP-D may due to hypertrophy of type II cells caused by prolonged exposure to air pollutants (Gowdy et al., 2008). In vitro study also demonstrated that SP-A in A549 cells was increased under DEP exposure at a lower dose (25 \u03bcg/mL), but no significant change at 50\u2013100 \u03bcg/mL (Vattanasit et al., 2014). 2.3 DNA damage It has been well-documented the induction of DNA strand breaks caused by PM2.5 by a majority of human, animal and cell studies (S\u00f8rensen et al., 2003; Ma et al., 2015). M\u00f8ller et al. indicated air pollution particles led to oxidatively damaged DNA through oxidative stress and inflammation (M\u00f8ller et al., 2014). If unrepaired or repaired incorrectly, cytotoxicity, mutations or chromosomal translocations may occur. Indeed, PM2.5 exposure was reported to highly inhibit nucleotide excision repair (NER) in human lung cells, resulting in the suppressed DNA repair and promotion of DNA replication errors (Mehta et al., 2008). Meng et al. revealed the potency of DNA damage by PM2.5 from both sand storm and normal weather, and the organic compounds and insoluble particle-core acting as the main contributors (Meng and Zhang, 2007). 2.3.1 8-hydroxy-2\u2032-deoxyguanosine (8-OHdG) 8-OHdG, an oxidatively modified guanine derivative, is extensively applied to indicate oxidative stress-mediated DNA damage upon environmental stress like PM2.5 (Zanolin et al., 2015). 8-OHdG in urine commonly serves as a detectable biomarker of early effects upon PM2.5 exposure. By studying thirty-six schoolchildren during Olympic Games in Beijing, Lin et al. reported substantial reductions in air pollution, urinary 8-OHdG and MDA during the Olympic intervention period (Lin et al., 2015). They revealed the significant associations of MDA and 8-OHdG with air-borne PM2.5 and black carbon. Lee et al. found a dramatically increase in urinary 8-OHdG owing to an occupational exposure to DEP-derived PM2.5 (Lee et al., 2010). 8-OHdG in urine was also increased after exposure to traffic-related PM2.5 in vehicle (Neophytou et al., 2014). A longitudinal study revealed a 11% increase in 8-OHdG per 10 \u03bcg/m3 increase in personal PM2.5 exposure level (p = 0.007) (Huang et al., 2012a). By using a group of boilermakers who was exposed to residual oil fly ash and metal fumes in Boston, USA (Kim et al., 2004), researchers found an increase of 1.67 \u03bcg/g (95% CI, 0.21\u20133.14) in urinary 8-OHdG per 1 mg/m3 increase of PM2.5. Circulating lymphocytes was considered as a substitute for the assessment of PM-elicited pulmonary oxidative DNA damage. A human study recruiting 51 healthy people living in areas with heavy traffic in Bangkok, found 8-OHdG levels in lymphocyte DNA were increased and positively connected with the levels of PM2.5 and particle-bound PAHs (Vattanasit et al., 2014). Moreover, a panel study of 49 students from central Copenhagen, Denmark suggested that independent of PM2.5 mass, water-soluble transition metals (V; chromium, Cr) in PM2.5 were positively associated with 8-OHdG in lymphocytes (S\u00f8rensen et al., 2005). Likewise, animal and cell studies showed that PM exposure increased 8-OHdG in rats (Lei et al., 2005; Chen et al., 2015b) and in vitro cultured bronchial epithelial cells (Billet et al., 2018). One traffic-related PM2.5 exposure study found 8-OHdG concentration was positively correlated with PM2.5 mass, as well as PAHs and heavy metals, while not with polar organic species (Wei et al., 2009). Huang et al. revealed that PAHs bound to PM2.5 induced an increase in urinary 8-OHdG by virtue of elevating 1-hydroxypyrene-glucuronide (1-OHPG) in urine (Huang et al., 2012a). Another study in coke-even workers also found the urinary 8-OHdG linking to five heavy metals (As; Cr; Ni; Pb; cadmium, Cd), as well as PAH (Wang et al., 2015b). Furthermore, high levels of co-exposure to PAHs and heavy metals resulted in robustly oxidative DNA damage and lipid peroxidation. 2.3.2 \u03b3H2AX The phosphorylation of histone H2AX at serine 139 (named as \u03b3H2AX) is one of the earliest events after DNA damage (Rios-Doria et al., 2006), and frequently used for indicating DNA double-strand breaks. Yang et al. collected PM2.5 from six cities in China, and enhanced level of \u03b3H2AX were detected in BEAS-2B cells after PM2.5 treatment, especially that from Guangzhou, possibly due to its stronger induction of ROS (Yang et al., 2016). Further, their data showed the content of Fe and Cr in PM were significantly related to DNA damage. Similarly, another in vitro study also found that when compared to rural samples, urban PM0.3\u20132.5 exposure caused a higher level of \u03b3H2AX in BEAS-2B, probably attributing to the contents of inorganic chemicals, such as PAHs and Fe (Borgie et al., 2015). Besides, H2AX gene mutations were related to DNA damage repair defect (Mah et al., 2010; Huang et al., 2012a). In an epidemiological study of 307 healthy urban residents, the researchers monitored PM2.5 exposure and collected blood to isolate lymphocytes (Sun et al., 2015). Finally, they found increased DNA damage along with PM2.5 exposure, as indicated by % Tail DNA using Comet assay. Meanwhile, three single nucleotide polymorphisms of H2AX corresponding to PM2.5-modulated DNA damage levels were identified, including rs10790283 G >A, rs604714 C >A and rs7759 A> G. 2.3.3 8-oxoguanine glycosylase 1 (OGG1) OGG1 is a kind of DNA glycosylase that can recognize and remove bases that are altered in the base excision to repair (BER) pathway, such as 8-OHdG, and participate in the repair of oxidative DNA damage (Sampath and Lloyd, 2019). In a study of rats, OGG1 mRNA level was up-regulated in the lungs after exposure to either PM2.5 or 9-nitroanthracene (9-NA), a typical nitro-PAHs compound in PM2.5 (Li et al., 2017b). Simultaneously, PM2.5 and 9-NA inhibited expressions of DNA damage repair genes, which may surpass the scavenging effect of OGG1 on damaged DNA. Another in vitro study found that overexpression of OGG1 could alleviate PM2.5-induced ROS, oxidative damage and apoptosis in BEAS-2B cells (Yang et al., 2015). By contrast, Yang et al. found OGG1 deficiency could aggravate PM2.5-induced lung injury and pulmonary fibrosis, which was mediated by oxidative stress and the hyperactivation of NF-\u03baB signaling (Yang et al., 2020). 2.4 Epigenetic marker Epigenetic alterations are increasing being linked with gene dysregulation, cellular response induced by environmental pollutants like PM (De Prins et al., 2013; Ladd-Acosta and Fallin, 2015). Together with genetic events, epigenetic changes were proven to be a major contributor to diseased phenotypes after repeated exposure to atmospheric PM2.5 (Leclercq et al., 2017). 2.4.1 DNA methylation DNA methylation is closely involved in the regulation of series of cellular processes, including genomic imprinting, chromatin remodeling and chromosome stability. Current studies have demonstrated DNA methylation modifications in specific genes or non-coding repetitive elements were altered upon PM2.5 stimulus (Baccarelli et al., 2009; Salam et al., 2012). In a study of 48 healthy, non-smoking adults, total DNA methylation in whole blood was found to be inversely associated with PM2.5 (De Prins et al., 2013). Another study analyzed the DNA methylation pattern in children (aged 7\u201315 y) by using the Human Methylation 27 K Bead Chip with 27,578 CpG loci (Rossnerova et al., 2013). They revealed 9916 CpG sites with remarkably different methylation between children from the highly polluted area and the control region, from which 58 CpG sites had differences more than 10%. DNA methylation was associated with respiratory health. Lepeule et al. found the gene promoter hypomethylation of Carnitine O-acetyltransferase, toll-like receptor-2 (TLR2) and coagulation factor-3 linking with lower pulmonary function. Conversely, hypomethylation of IFN\u03b3 and IL-6 were related to the improvement of lung function (Lepeule et al., 2012). DNA methylation may account for PM2.5-mediated inflammatory pathways (Wang et al., 2018a). A cohort study of elder population from the Normative Aging Study revealed that methylation status related to inflammation-related genes, glucocorticoid receptor (GCR) and TLR2, contributed to lower lung function induced by PM2.5 (Lepeule et al., 2014). A nested subcohort study of African American and Dominican children showed transition metal V (PM component) exposure was associated with lower buccal cell DNA methylation of allergic and proinflammatory asthma genes, primarily IL-4, IFN\u03b3 and NOS2A (Jung et al., 2017). As a tumor suppressor gene, DLEC1 can reduce the invasion and metastasis of tumor cells (Kwong et al., 2007). The abnormal methylation of DLEC1 is associated with esophageal and lung cancers. In a study of 496 patients, PM2.5 exposure was positively correlated with DLEC1 methylation, and exercise can alleviate its hypermethylation and subsequent adverse reactions related to PM2.5 (Chou et al., 2020). The imprinted control region (ICR) of imprinted gene is more sensitive to environmental changes (Smeester et al., 2014). In a study on PM2.5 exposure of college students, DNA methylation changes in one non-imprinted gene (CYP1B1) and eight ICRs, especially L3MBTL1, were observed to be associated with PM2.5 components, in despite of no direct correlation between DNA methylation and personal PM2.5 exposure mass (Liang et al., 2021). A few epidemiology studies showed the link of alterations in DNA methylation at the NOS promoter region with PM exposure. In a cohort study of electric furnace steel plant workers, decreased iNOS methylation was detected after PM exposure (Tarantini et al., 2009). Conversely, increased iNOS methylation was reported in welders who were occupationally exposed to metal-rich PM2.5 (Kile et al., 2013). A cohort of children provided evidence that PM2.5 exposure was associated with DNA methylation of NOS genes, primarily NOS2A and NOS3 (Breton et al., 2012). Salam et al. also found the interrelated effects of short-term PM2.5 exposure, NOS2 promoter haplotypes and methylation on FENO levels in children (Salam et al., 2012). A longitudinal study among COPD patients in Shanghai, China regarded organic carbon, element carbon, NO3 - and NH4 + in PM2.5 as major contributors for declined NOS2A methylation and increased FENO (Chen et al., 2015a). Experimental data also provided preliminary evidence that DEP and PM2.5 constituents (e.g., black carbon, PAH, heavy metals) were responsible for epigenetic regulation in DNA methylation in lungs (Belinsky et al., 2002). LINE-1 has been recognized as a mediator of pulmonary diseases, especially lung cancer (Zhang et al., 2019). LINE-1 hypomethylation could induce genomic alterations and disruption of gene transcription. Human studies have revealed a decreased LINE-1 methylation after PM2.5 or black carbon exposure in the Normative Aging Study (Baccarelli et al., 2009). Animal studies of rats found short-term and prolonged exposure to traffic-derived PM2.5 significant decreased LINE-1 and iNOS methylation, whilst increased p16CDNK2A and adenomatous polyposis coli (APC) methylation in lung tissue (Ding et al., 2016a). Even exposure to PM2.5 for 4 h, a remarkable LINE-1 hypomethylation was detected in DNA from blood and lung tissues. Curiously, their data indicated a systemic regulation of methylation changes for restoration of the normal levels after the adaption to PM pollution. However, in a panel study among boilermaker welders (Kile et al., 2013), investigators found that no obvious association between occupational PM2.5 exposure and LINE-1 or Alu methylation. These inconsistent findings may be related to the species and PM composition in the two studies; welders were exposed to PM with higher levels of metal elements whilst lower metal levels contained in traffic-related air pollution (TRAP). Although the mechanisms underlying alterations in DNA methylation at specific sites associated with PM are less well understood, some evidence indicated that ROS-mediated oxidative stress, central to the downstream effects of PM2.5 exposure, could regulate DNA methylation through inactivation of the methyl donor S-adenosyl methionine (SAM) (Lamadema et al., 2019) or SAM depletion (Kloypan et al., 2015), upregulation of DNMTs and enhanced expression and activity of HDAC (Zhang et al., 2013). In support of the increased risk of lung cancer by PM2.5 exposure, experimental evidence showed that a suppressive effect of repeated PM2.5 exposure on p53 expression via ROS-protein kinase B (Akt)-DNMT3B pathway-mediated promoter hypermethylation (Zhou et al., 2016). Additionally, PM2.5 could induce p16 promoter hypermethylation via a mitochondrial ROS-c-Jun N-terminal kinase (JNK)-DNMT1 pathway (Soberanes et al., 2012). 2.4.2 Histone modification Histone modification affects the interaction of histone with DNA and effector proteins, resulting in changes in the structure and function of chromatin (Strahl and Allis, 2000). Histone modifications were associated with a pleural of lung diseases. For instance, increased histone H4 acetylation has been proved to be linked with lung inflammation, asthma and also COPD (Ito et al., 2002, 2005). Global modifications on histone H3 and H4 were proposed as potential biomarkers of lung cancer (Song et al., 2012). Ding et al. reported the TRAP-caused dose- and time-effect on histone 3 lysine 9 (H3K9) acetylation in peripheral blood mononuclear cells (PBMCs) and lung tissues of rats, as well as DNA methylation (Ding et al., 2017). Regardless of no significant association in 4 h exposure window, 7-d or prolonged exposure to PM2.5 and PM10 were closely associated with acetylated H3K9 (Ding et al., 2016b). A human study reported elevated H3K27ac patterns in individuals under ambient PM2.5 exposure in Beijing (Liu et al., 2015). However, the Beijing Truck Driver Air Pollution Study observed no association of personal PM2.5 or elemental constituents with histone modifications (including global levels of H3K9 acetylation, H3K9 tri-methylation, H3K27 tri-methylation, H3K36 trimethylation) in blood leukocytes (Zheng et al., 2017). On the other hand, the investigation showed the association between PM10 exposure and lower H3K27/H3K36 tri-methylation levels. The inter-study inconsistencies may due to the differences in sampling times, PM components, and also personal and citywide PM exposures. Some reports also provided evidence of the dysregulated histone acetylation by environmental contaminants that contained PM (Ke et al., 2006; Schnekenburger et al., 2007). An epidemiological study conducted among healthy steel workers with metal-rich PM exposure in Italy, indicated the cumulative exposures to PM-related Ni and as were associated with H3K4 di-methylation and H3K9 acetylation in blood leukocytes (Cantone et al., 2011). Differential histone modification was involved in PM-elicited inflammatory response and oxidative stress (Gilmour et al., 2003), specifically contributing to pulmonary diseases (Bhavsar et al., 2008). Liu et al. obtained genome-wide profiles of H3K27 acetylation in individuals subjected to different levels of PM2.5, and found differential H3K27ac by PM2.5 was related to immune cell activation and inflammatory responses (Liu et al., 2015). Recently, Ji et al. reported that inhaled PM2.5 caused histone modification related to lung dysfunction and inflammation (Ji et al., 2019). Acetylation is reversible and is regulated by two classes of enzymes, including histone acetyltransferases (HATs) to promote acetylation, and histone deacetylase (HDACs) for deacetylation. The balance of HATs and HDACs regulates histone acetylation. Likewise, histone methyltransferases (HMTs) and histone demethylases (HDMs) work together to balance histone methylation. Evidences revealed the contribution of HATs, HDACs and HDMs to the histone modification (acetylation/methylation) induced by airborne PM2.5. Zhou et al. suggested that PM2.5 may exacerbate asthma through the enrichment of H3K9 and H3K14 acetylation in IL-4 gene promoter region of CD4+ T cells, together with increased P300/CBP and declined HDAC1 expressions in mice (Zhou et al., 2019a). Ma et al. confirmed long-term PM2.5 exposure down-regulated histone demethylase Kdm6a expression in pulmonary macrophages, resulting in a increase in H3K4 and H3K9 methylation in promoter regions of IL-6 and IFN-\u03b2 (Ma et al., 2017). 2.4.3 MicroRNAs (miRs) Accumulating evidence has highlighted the expression profiles of circulating miRs as novel biomarkers for clinical diagnosis of human diseases and for toxicological studies. Equally noteworthy, miRs are key modulators of toxicogenomic response to airborne PM pollution, but the underlying mechanisms remain elusive. Some epidemiology studies have reported up- or down-regulated miRs in processes associated with PM exposure. For instance, increased miR-222 and miR-21 in peripheral blood leukocytes were detected in metal-rich PM-exposed foundry workers (Bollati et al., 2010). Another study pointed out the association of PM with miR-1, \u22129, \u221221, \u2212126, \u2212135a, \u2212146a, \u2212155, and \u2212222 in a group of elderly males from the Normative Aging Study (n = 153) (Fossati et al., 2014). In a study of healthy people exposed to TRAP, the researchers observed that short-term PM2.5 exposure (2 h) up-regulated let-7i-5p and miR-98\u20135p, which may result in the resolution of airway inflammation by reducing the level of IL-13 (Krauskopf et al., 2018). Under high levels of TRAP exposure, asthma-related miR-223\u20133p was decreased, whilst miR-574\u20135p was increased. A pilot study suggested the potency of blood miR-194\u20133p in regulating the toxicological pathways of PM2.5-associated COPD, in view of miR-194\u20133p positively correlated with lag0\u20131, forced expiratory volume in 1s (FEV1) and forced vital capacity (FVC) during PM2.5 exposure (Zhou et al., 2018a). A large quantity of experimental evidence has shown global alterations in miRs profiles in the lungs and bronchial epithelium induced by PM (Jardim et al., 2009; Yang et al., 2017). Ning et al. identified 13 differential lung cancer-associated miRs in both serum and lung of PM2.5-exposed mice (Ning et al., 2019). PM2.5 could increase miR-206 in lung tissue of asthmatic mice, with SOD1 as its target, resulting in elevated ROS level, inflammatory response and aggravated asthma symptoms (Wang et al., 2019a). Chronic PM2.5 could induce epithelial-mesenchymal transition (EMT) event through miR-139\u20135p targeting Notch1 signal pathway (Wang et al., 2020b). Another study also demonstrated miR-802/Rho family GTPase 3 (Rnd3) pathway-mediated the growth and metastasis of lung cancer promoted by PM2.5 (Li et al., 2016). Moreover, miR-486 could relieve PM2.5-induced cell apoptosis and ROS generation by targeting PTEN and FOXO1 in A549 cells (Li et al., 2018a), and miR-194\u20133p could prevent the bronchial epithelial injury aggravated by PM2.5 through targeting death-associated protein kinase 1 (DAPK1), a regulator of caspase 3 in the apoptotic pathway (Zhou et al., 2018b). The differential derivation and components may partially cause the uncontrolled dysregulation of miRNA caused by PM2.5 exposure (Ning et al., 2019). Notably, in response to PM stimulus, the lung may first go through an adaptation process (e.g., metabolic detoxification, DNA repair, apoptosis activation) via miRs-mediated pathways. However, long-time or prolonged PM2.5 exposure resulted in irreversible miRs alterations. In addition, long non-coding RNAs (lncRNAs) were also involved in PM2.5-associated respiratory toxicity. PM2.5 activated lncRNA loc146880 through ROS, followed by up-regulating autophagy and promoting malignant behaviors of lung cancer cells (Deng et al., 2017). Collectively, further investigations are in need to fully understand how epigenetic biomarkers influence the health outcome of PM2.5. 2.5 Pulmonary function indexes PM2.5 could penetrate deeply into the lung, irritate the alveolar wall, and eventually impair pulmonary function (Xing et al., 2016). A large quantity of population evidence reflected the correlation of PM2.5 and impaired lung function in children, adolescence and adults. Based on the European Study of Cohorts for Air Pollution Effect (ESCAPE), Gehring et al. analyzed PM2.5 exposure and lung function of children (aged 6\u20138 y, n = 5921) and found each 5 \u03bcg/m3 increase of PM2.5 could reduce FEV1 by 1.77% (95% CI: \u22123.34%, \u22120.18%) (Gehring et al., 2013). In Netherlands, Milanzi et al. revealed air pollution was associated with decreased FEV1 growth in adolescence aged 8\u201316 y and a decrease in FEV1 at age 16, especially in boys (Milanzi et al., 2018), indicating increased airway obstruction under air pollution. Guo et al. also found that remarkably declined lung function in children, adolescents and young people after long-term PM2.5 exposure, but no gender association (Guo et al., 2019). A recent longitudinal cohort study, including 278,065 Taiwan residents (aged \u2265 20 y) also showed a decline of 2.43% in FVC, 2.78% in FEV1, and 3.10% in maximum mid-expiratory flow (MMEF) with each 10 \u03bcg/m3 increase in PM2.5 (Guo et al., 2020). Previous studies showed the anti-inflammatory effects of regular physical activity (PA) (Pedersen, 2017). Conversely, PA may attenuate its benefits on lung function in view of PM2.5 intake (Guo et al., 2020). Consistently, a study of 20 healthy men indicated that people with heavily or intensively exercise have a higher risk of respiratory tract inflammation caused by PM2.5 (Chen et al., 2018a). Regardless of the regional air quality, local exposure to traffic-related pollutants, NO2 and PM2.5 on a freeway impaired the lung-function growth in children, and even attained lung function defect at age 18-y old (Gauderman et al., 2007). Additionally, an inverse association between PM2.5 and lung function has been proven in a diesel engine exhaust (DEE) cohort (Zhang et al., 2017). However, a panel study among truck drivers from Beijing, did not find a significant association between PM2.5 and FEV1 or FVC (Baccarelli et al., 2014). It is worth noting that body mass index (BMI) was a confounding factor in analyzing the influence of air pollution on lung function (Xing et al., 2020). Based on Swiss adult population-based SAPALDIA cohort, Schikowski et al. reported the improvement in air quality was associated with an amelioration of lung function among low- and normal-BMI participants, but not overweight or obese participants (Schikowski et al., 2013). A recent cross-sectional study of 6740 children (aged 7\u201314 y) in China also found the interplays between air pollution and obesity on pulmonary function (Xing et al., 2020). Similarly, a study conducted by Kim et al. in Korean men (aged 51.6 \u00b1 5.7 y) suggested abdominal adiposity could intensify the inverse correlation of air pollution and lung function (Kim et al., 2017). The IQR increase in NO2 level was dramatically associated with a lower of 2.5% in FEV1 (95% CI: \u22124.6% ~ \u22120.5%) and 2.9% in FVC (95% CI: \u22125.1% ~ \u22120.7%). By studying dust-exposed workers in open-pit Mn mine (280 in total), Huang et al. (Huang et al., 2019) indicated PM2.5-associated pulmonary function damage, as evidenced by lower values of FEV1, MMEF, PEFR, PEFR%, FEF25, FEF75, FEF25%, FEF50%, FEF75%, and FEV1/FVC%. Meanwhile, a higher prevalence of restrictive respiratory dysfunction was detected in comparison to controls (41.4% vs 23.6%, p = 0.016). Likewise, higher prevalence of respiratory diseases was detected in Congolese informal coltan miners, as well as impairment of lung function as indicated by a markedly lower PEFR (347.93 \u00b1 6.88 L/min, whilst 493.23 \u00b1 67.38 L/min for controls) (Leon-Kabamba et al., 2018). The high PM2.5 and increased levels of VOC in mining sites were probably the major contributors, in consideration of an inverse association between PEFR and PM2.5 exposure, between PEFR and VOC exposure. To note, a more strongly association between indoor PM and decreased lung function in children with asthma was manifested as compared with outdoor PM (Isiugo et al., 2019). That may relate to the difference of components in PM2.5 between indoor sources and outdoor origins. For example, Habre et al. suggested that the elemental carbon (EC) in PM2.5 from indoor sources was originated from smoldering combustion, whilst EC in PM2.5 from outdoor origins from internal-combustion engine exhaust soot (Habre et al., 2014). 2.6 Pulmonary Fibrosis Marker Pulmonary fibrosis (PF) is a pathological change caused by inflammation, genetic factors and abnormal immune function, mainly characterized with the proliferation of pulmonary parenchyma and interstitial fibrous tissue, significant thickening of alveolar wall, decrease of pulmonary capillary bed and bronchiole stenosis (Thannickal et al., 2004; Wynn, 2011). Alveolar epithelial injury is the key process of PF. In the context of interactions between genetic susceptibility and harmful environmental factors (Wuyts et al., 2013), repeated injury of alveolar epithelium and the subsequently abnormal repair followed by EMT, lung resident fibroblasts activation, migration and proliferation, inevitably result in the accumulation of extracellular matrix (ECM) and abnormal collagen in lung tissues. A large body of epidemiological investigation and animal researches have suggested PM2.5 pollution acting as a potential initiator of PF (Shull et al., 2021; Cheng et al., 2019; Xu et al., 2019b), and associated with lower lung function, increased risk of acute exacerbation of PF. The aforementioned oxidative stress, inflammatory response and immune cell activation caused after PM2.5 exposure are highly associated with pulmonary fibrosis pathogenesis. Inflammation serves as a relentless driver of fibrogenesis after lung injury, and its persistent stimulus contributes to a vicious cycle with lung injury and fibrotic disorders. A recent in vivo study has unraveled a persistent development of pulmonary fibrosis in post-exposure duration after short-term PM2.5 exposure, probably mediated by oxidative stress-initiated NF-\u03baB/inflammation/EMT pathway (Sun et al., 2020). 2.6.1 Transforming growth factor beta (TGF-\u03b2) TGF-\u03b2 participates in cellular differentiation, proliferation and remodeling processes (Fernandez and Eickelberg, 2012). Accumulating evidence has demonstrated TGF-\u03b2 is the most potent and ubiquitous profibrogenic cytokine, and involved in lung fibrogenesis (Gauldie et al., 2007). Experimental evidences also showed remarkable increase in TGF-\u03b2 level in BALF or lung tissues, as well as inflammatory cytokines (e.g., IL-1\u03b2), contributing to the collagen deposition and fibrogenesis (Xu et al., 2019b; Sun et al., 2020). A recent epidemiology study showed a strong association of TGF-\u03b21 in sputum with PM10 intake from the Saharan desert (Dominguez-Rodriguez et al., 2020). The secretion of IL-1\u03b2 and inflammatory response in lung is attributed to the increased TGF-\u03b2 production (dos Santos et al., 2012). TNF\u03b1 is an inducer of TGF-\u03b2 (Sullivan et al., 2009), and also, anti-inflammatory cytokine IL-13 is a mediator of fibrogenesis by regulating TGF-\u03b2 and recruiting leukocytes into lesion site (Lee et al., 2001; Borthwick et al., 2016). Ding et al. indicated long-term PM2.5 exposure led to lung fibrosis through NLRP3 inflammasome activity/IL-1\u03b2/TGF-\u03b21 signal pathway (Ding et al., 2019). In addition, TGF-\u03b2 could stimulate ROS generation; in turn, ROS activate latent TGF-\u03b2 (Jobling et al., 2006). Numerous studies have shown ROS-mediated oxidative stress was involved in TGF-\u03b2\u2019s fibrogenic effects (Sturrock et al., 2006). 2.6.2 Matrix metalloproteases (MMPs) MMPs participate in the tissue remodeling and fibrogenesis process, and play a role in pathogenesis of PM-related pulmonary fibrosis (Pardo et al., 2016). MMP-9, released by inflammatory cells, promotes the migration of inflammatory cells into the airways through extracellular matrix (ECM) destruction, whilst MMP-2 induces collagen deposition disorder and chronic remodeling in lung tissue (Corbel et al., 2002). Moreover, MMPs could activate TGF-\u03b2 (Dancer et al., 2011). MMP-9 and MMP-2 levels were increased in BALF and lung tissue of pulmonary fibrosis patients (Suga et al., 2000). This phenomenon has also been validated on animal versus cell models. Dose-dependently increased levels of MMP-9, fibronectin, collagen and TGF-\u03b21 protein expression were noticed in PM2.5-exposed human bronchial epithelial cells, and also in lung tissues of PM2.5-exposed mice (Zhao et al., 2019b) and rats (Yang et al., 2018a). Increased change in MMP-9 levels was found in rat serum after wood smoke exposure (Zou et al., 2014). High levels of MMPs in lung tissues were detected in wood smoke- and cigarette smoke-exposed animals (Zou et al., 2014; Zhou et al., 2019b). Besides, experimental evidence on increased expressions and activities of MMPs in alveolar epithelial cells after DEP exposure may partially explain the deleterious effects of PM on lung tissue (Amara et al., 2007; Li et al., 2009). 2.6.3 Epithelial-mesenchymal transition (EMT) Studies have preliminarily revealed the correlation of PM2.5 and EMT (Xu et al., 2019a), ultimately contributing to the pathogenesis of PM2.5-elicited lung fibrosis, cancer, COPD. A series of underlying molecular events involved in EMT process has been uncovered. Acute or chronic exposure to PM2.5 altered a series of characteristic EMT-related markers and transcription factors in the epithelia (Xu et al., 2019a). For example, epithelial cadherin (E-cadherin) is crucial for the epithelial integrity (Dongre and Weinberg, 2019), while its down-regulation is an indicator for EMT initiation. A mice study found a dose-dependent decline of E-cadherin in the lung tissue, and increased inflammatory cytokines (IL-2, \u22126 and \u221210) upon PM2.5 exposure, which were associated with organic carbon (OC) and free amino acids in PM2.5 (Chuang et al., 2015). Another study inferred that the EMT caused by PM2.5 organic extract was mainly derived from PAH (Chi et al., 2018). In vitro studies revealed the PM2.5-induced phenotype transformation in human bronchial epithelial cells, as evidenced by declined E-cadherin while increased Vimentin (a mesenchymal phenotype marker) (Chi et al., 2018). ROS was linked to multiple inflammatory- and EMT-related signaling pathways, such as MAPK, NF-\u03baB, and hypoxia-inducible factor 1 (HIF-1) (Lamouille et al., 2014). TGF-\u03b2 could serve as a prototypical cytokine for induction of EMT (Willis and Borok, 2007), meanwhile, MMPs are known for their role in the degradation of epithelial reticular basement membrane for EMT (Polette et al., 2004). MMP-2 and MMP-9 were reported to modulate EMT event in airway epithelial cells caused by cigarette smoke extract (Agraval and Yadav, 2019). Notably, besides the trigger of EMT event, chronic PM2.5 exposure induced the acquisition of obvious cancer stem cells properties in lung tissues/cells (Wei et al., 2017; Wang et al., 2019b), which was consistent with the increased lung cancer risk according to the epidemiological investigations. More investigations should perform to combine the necessary endpoints to verify pulmonary EMT and to analyze the specific PM2.5 components contributing to EMT events (Cochard et al., 2020). 2.7 Omics The complex PM's chemical composition limited our understanding of the underlying causal interpretation between PM2.5 and respiratory diseases. Currently, the development and application of high-throughput approaches such as genome, transcriptome, methylome and miRNA sequencing, and proteome, metabolome, are especially useful for providing unbiased information, meet the possibility to reveal the mechanisms of action in support of classical toxicological analyses (Vineis et al., 2013; Chu et al., 2021; Zhao et al., 2021). Recently, Montgomery et al. found that organic components but not the water-soluble extract of PM2.5, elicited a potent, dose-dependent transcriptomic response from the mucociliary epithelium, probably originating from PM2.5-induced the activation of aryl hydrocarbon receptor signaling and IL-1-driven inflammation in the epithelium, resulting in mucus secretion and ciliated cell dysfunction (Montgomery et al., 2020). By using integrative transcriptomic analysis, Longhin et al. evidenced the interaction of oxidative stress, inflammation and DNA damage in PM-exposed BEAS-2B cells (Longhin et al., 2016). Proteomics and metabolomics are powerful tools to screen and identify the critical environmental stresses-related biomarkers. In a mice study to mimic a \u201creal-world\u201d airborne PM2.5 exposure, 32 differentially expressed proteins in total were screened in PM2.5-exposed lung tissue by proteomic technology (Liu et al., 2018). Gene ontology analysis indicated biological processes, like oxidoreductase activity, receptor activity, and protein binding, were responsible for PM2.5-induced lung toxicity. Wei et al. revealed an exposure-response relationship between high-dose PM2.5 exposure and declined unsaturated fatty acids in boilermakers (Wei et al., 2013). Eight circulating metabolites were remarkably correlated with long-term PM2.5 exposure and lung function in a general population (Menni et al., 2015). Among these, the circulating level of \u03b1-tocopherol, a biologically active form of the fat-soluble antioxidant vitamin E, manifested the strongest association with both PM2.5 and lung function (FEV1). From a metabolomic perspective, Huang et al. identified 7 PM2.5-associated metabolic biomarkers linked with glycolysis, purine and amino acid metabolism, indicating PM2.5 aggravated COPD via lowering pulmonary antioxidant capacity and energy production (Huang et al., 2018). Similarly, a mass spectrometry-based metabolomics study done by Song et al. also revealed the disturbed purine metabolism, arginine and proline metabolism, GSH metabolism, glycolysis and tricarboxylic acid (TCA) cycle in PM2.5-exposed BEAS-2B cells (Song et al., 2019). Another in vitro study suggested ceramide accumulation and altered RNA splicing were responsible to PM2.5-induced cytotoxicity of A549 cells (Zhao et al., 2019a). 3 Conclusion Accumulating evidences have demonstrated the adverse respiratory effects of PM2.5, including the induction of lung hyperpermeability, impaired function and structural damage, eventually causing or aggravating some respiratory diseases. Growing evidences have demonstrated the crucial contributions of oxidative stress, inflammatory response, genetic and epigenetic changes on the deleterious respiratory outcome caused by short- or long-term PM2.5 exposure. In the context of updated human, animals and cell studies related to respiratory toxicity caused by PM2.5, we comprehensively summarized some PM2.5-associated biomarkers, which would guide better prevention and control of the damaging effect of PM2.5 on the respiratory system, and help improve our understanding of human complex diseases/traits. Tables 1\u20133 concisely summarize the evidence for the association between PM exposure and respiratory toxicity-related biomarkers from the population, animal and cell aspects. These biomarkers were primarily involved in eliciting oxidative stress, initiating and aggravating inflammation, genetic or epigenetic alterations, and lung function impairment, and a resultant fibrogenesis and even cancer in the lung. Conversely, Hemmingsen et al. reported 5-h exposure to urban traffic-derived PM2.5 did not increase ROS production, oxidatively damaged DNA or alter gene expressions related to inflammation (IL-8, TNF, MCP-1), oxidative stress or DNA repair (HO-1, OGG1) in PBMCs from elderly overweight people (Hemmingsen et al., 2015). It is worth noting that the currently heterogenous findings likely depend upon the difference in studied PM2.5 (e.g., source, concentrations, components, particle size), exposure mode (acute vs chronic, dose, time of duration), targeted subjects (healthy or diseased). Besides, methodological issues like confounding, publication bias and use of surrogate tissues on biomarker studies are worthy of attention. Biomarkers are reliable tools for the link between clinical respiratory diseases and PM2.5 pollution. The identified biomarkers have potential to unravel the pathways of PM2.5-elicited inflammation, fibrogenesis and carcinogenesis, thereby facilitating a precious public health intervention. Currently, the markers of oxidative stress and inflammation induced by PM2.5 have been fully studied. But the participation of PM2.5 in respiratory diseases is rarely mediated by a single mechanism. There must be multiple markers involved through various modulation ways. The interactions among PM2.5-associated biomarkers need to be further studied, and the functions of each marker in different pathological processes also need to be excavated. Moreover, a suitable integration of multiple biomarkers may be better in the diagnosis and prognosis of PM2.5-caused respiratory diseases. At the same time, more new possible mechanisms of PM2.5-induced disease need to be explored, and more convenient and specific markers need to be discovered. Declaration of Competing Interest The authors declare that they have no known competing financial interests or personal relationships that could have appeared to influence the work reported in this paper. Acknowledgments This work has been financially supported by National Key R&D Program of China (2017YFC0211600, 2017YFC0211604), and Support Project of High-level Teachers in Beijing Municipal Universities in the Period of 13th Five-year Plan (CIT&TCD201804090). References Adamkiewicz et al., 2004 G. Adamkiewicz S. Ebelt M. Syring J. Slater F.E. Speizer J. Schwartz H. Suh D.R. Gold Association between air pollution exposure and exhaled nitric oxide in an elderly population Thorax 59 2004 204 209 10.1136/thorax.2003.006445 Adamkiewicz, G., Ebelt, S., Syring, M., Slater, J., Speizer, F. E., Schwartz, J., Suh, H. and Gold, D. R., 2004. Association between air pollution exposure and exhaled nitric oxide in an elderly population. Thorax. 59, 204\u2010209. https://doi.org/10.1136/thorax.2003.006445. Agraval and Yadav, 2019 H. Agraval U.C.S. Yadav MMP-2 and MMP-9 mediate cigarette smoke extract-induced epithelial-mesenchymal transition in airway epithelial cells via EGFR/Akt/GSK3\u03b2/\u03b2-catenin pathway: amelioration by fisetin Chem. Biol. Inter. 314 2019 108846 10.1016/j.cbi.2019.108846 Agraval, H. and Yadav, U. C. S., 2019. MMP-2 and MMP-9 mediate cigarette smoke extract-induced epithelial-mesenchymal transition in airway epithelial cells via EGFR/Akt/GSK3\u03b2/\u03b2-catenin pathway: Amelioration by fisetin. Chem Biol Interact. 314, 108846. https://doi.org/10.1016/j.cbi.2019.108846. Alexis et al., 2006 N.E. Alexis J.C. Lay K. Zeman W.E. Bennett D.B. Peden J.M. Soukup R.B. Devlin S. Becker Biological material on inhaled coarse fraction particulate matter activates airway phagocytes in vivo in healthy volunteers J. Allergy Clin. Immunol. 117 2006 1396 1403 10.1016/j.jaci.2006.02.030 Alexis, N. E., Lay, J. C., Zeman, K., Bennett, W. E., Peden, D. B., Soukup, J. M., Devlin, R. B. and Becker, S., 2006. Biological material on inhaled coarse fraction particulate matter activates airway phagocytes in vivo in healthy volunteers. Journal of Allergy and Clinical Immunology. 117, 1396\u20101403. https://doi.org/10.1016/j.jaci.2006.02.030. Alfaro-Moreno et al., 2008 E. Alfaro-Moreno T.S. Nawrot B.M. Vanaudenaerde M.F. Hoylaerts J.A. Vanoirbeek B. Nemery P.H. Hoet Co-cultures of multiple cell types mimic pulmonary cell communication in response to urban PM10 Eur. Respir. J. 32 2008 1184 1194 10.1183/09031936.00044008 Alfaro-Moreno, E., Nawrot, T. S., Vanaudenaerde, B. M., Hoylaerts, M. F., Vanoirbeek, J. A., Nemery, B. and Hoet, P. H., 2008. Co-cultures of multiple cell types mimic pulmonary cell communication in response to urban PM10. Eur Respir J. 32, 1184\u20101194. https://doi.org/10.1183/09031936.00044008. Alfaro-Moreno et al., 2009 E. Alfaro-Moreno V. Torres J. Miranda L. Mart\u00ednez C. Garc\u00eda-Cuellar T.S. Nawrot B. Vanaudenaerde P. Hoet P. Ram\u00edrez-L\u00f3pez I. Rosas B. Nemery A.R. Osornio-Vargas Induction of IL-6 and inhibition of IL-8 secretion in the human airway cell line Calu-3 by urban particulate matter collected with a modified method of PM sampling Environ. Res. 109 2009 528 535 10.1016/j.envres.2009.02.010 Alfaro-Moreno, E., Torres, V., Miranda, J., Mart\u00ednez, L., Garc\u00eda-Cuellar, C., Nawrot, T. S., Vanaudenaerde, B., Hoet, P., Ram\u00edrez-L\u00f3pez, P., Rosas, I., Nemery, B. and Osornio-Vargas, A. R., 2009. Induction of IL-6 and inhibition of IL-8 secretion in the human airway cell line Calu-3 by urban particulate matter collected with a modified method of PM sampling. Environ Res. 109, 528\u2010535. https://doi.org/10.1016/j.envres.2009.02.010. Amara et al., 2007 N. Amara R. Bachoual M. Desmard S. Golda C. Guichard S. Lanone M. Aubier E. Ogier-Denis J. Boczkowski Diesel exhaust particles induce matrix metalloprotease-1 in human lung epithelial cells via a NADP(H) oxidase/NOX4 redox-dependent mechanism Am. J. Physiol. Lung Cell. Mol. Physiol. 293 2007 L170 L181 10.1152/ajplung.00445.2006 Amara, N., Bachoual, R., Desmard, M., Golda, S., Guichard, C., Lanone, S., Aubier, M., Ogier-Denis, E. and Boczkowski, J., 2007. Diesel exhaust particles induce matrix metalloprotease-1 in human lung epithelial cells via a NADP(H) oxidase/NOX4 redox-dependent mechanism. American journal of physiology. Lung cellular and molecular physiology. 293, L170-L181. https://doi.org/10.1152/ajplung.00445.2006. Audi et al., 2017 C. Audi N. Ba\u00efz C.N. Maesano O. Ramousse D. Reboulleau A. Magnan D. Caillaud I. Annesi-Maesano Serum cytokine levels related to exposure to volatile organic compounds and PM(2.5) in dwellings and workplaces in French farmers \u2212 a mechanism to explain nonsmoking COPD Int. J. Chron. Obstruct Pulmon Dis. 12 2017 1363 1374 10.2147/COPD.S117866 Audi, C., Ba\u00efz, N., Maesano, C. N., Ramousse, O., Reboulleau, D., Magnan, A., Caillaud, D. and Annesi-Maesano, I., 2017. Serum cytokine levels related to exposure to volatile organic compounds and PM(2.5) in dwellings and workplaces in French farmers - a mechanism to explain nonsmoking COPD. Int J Chron Obstruct Pulmon Dis. 12, 1363\u20101374. https://doi.org/10.2147/COPD.S117866. Awad et al., 1993 J.A. Awad J.D. Morrow K. Takahashi L.J. Roberts 2nd Identification of non-cyclooxygenase-derived prostanoid (F2-isoprostane) metabolites in human urine and plasma J. Biol. Chem. 268 1993 4161 4169 Awad, J. A., Morrow, J. D., Takahashi, K. and Roberts, L. J., 2nd,1993. Identification of non-cyclooxygenase-derived prostanoid (F2-isoprostane) metabolites in human urine and plasma. J Biol Chem. 268, 4161\u20104169. Aztatzi-Aguilar et al., 2016 O.G. Aztatzi-Aguilar M. Uribe-Ram\u00edrez J. Narv\u00e1ez-Morales A. De Vizcaya-Ruiz O. Barbier Early kidney damage induced by subchronic exposure to PM(2.5) in rats Part Fibre Toxicol. 13 2016 68 10.1186/s12989-016-0179-8 Aztatzi-Aguilar, O. G., Uribe-Ram\u00edrez, M., Narv\u00e1ez-Morales, J., De Vizcaya-Ruiz, A. and Barbier, O., 2016. Early kidney damage induced by subchronic exposure to PM(2.5) in rats. Part Fibre Toxicol. 13, 68. https://doi.org/10.1186/s12989\u2010016\u20100179\u20108. Baccarelli et al., 2009 A. Baccarelli R.O. Wright V. Bollati L. Tarantini A.A. Litonjua H.H. Suh A. Zanobetti D. Sparrow P.S. Vokonas J. Schwartz Rapid DNA methylation changes after exposure to traffic particles Am. J. Respir. Crit. Care Med. 179 2009 572 578 10.1164/rccm.200807-1097OC Baccarelli, A., Wright, R. O., Bollati, V., Tarantini, L., Litonjua, A. A., Suh, H. H., Zanobetti, A., Sparrow, D., Vokonas, P. S. and Schwartz, J., 2009. Rapid DNA methylation changes after exposure to traffic particles. Am J Respir Crit Care Med. 179, 572\u2010578. https://doi.org/10.1164/rccm.200807\u20101097OC. Baccarelli et al., 2014 A.A. Baccarelli Y. Zheng X. Zhang D. Chang L. Liu K.R. Wolf Z. Zhang J.P. McCracken A. D\u00edaz P.A. Bertazzi J. Schwartz S. Wang C.M. Kang P. Koutrakis L. Hou Air pollution exposure and lung function in highly exposed subjects in Beijing, China: a repeated-measure study Part Fibre Toxicol. 11 2014 51 10.1186/s12989-014-0051-7 Baccarelli, A. A., Zheng, Y., Zhang, X., Chang, D., Liu, L., Wolf, K. R., Zhang, Z., McCracken, J. P., D\u00edaz, A., Bertazzi, P. A., Schwartz, J., Wang, S., Kang, C. M., Koutrakis, P. and Hou, L., 2014. Air pollution exposure and lung function in highly exposed subjects in Beijing, China: a repeated-measure study. Part Fibre Toxicol. 11, 51. https://doi.org/10.1186/s12989\u2010014\u20100051\u20107. Belinsky et al., 2002 S.A. Belinsky S.S. Snow K.J. Nikula G.L. Finch C.S. Tellez W.A. Palmisano Aberrant CpG island methylation of the p16(INK4a) and estrogen receptor genes in rat lung tumors induced by particulate carcinogens Carcinogenesis 23 2002 335 339 10.1093/carcin/23.2.335 Belinsky, S. A., Snow, S. S., Nikula, K. J., Finch, G. L., Tellez, C. S. and Palmisano, W. A., 2002. Aberrant CpG island methylation of the p16(INK4a) and estrogen receptor genes in rat lung tumors induced by particulate carcinogens. Carcinogenesis. 23, 335\u2010339. https://doi.org/10.1093/carcin/23.2.335. Bhavsar et al., 2008 P. Bhavsar T. Ahmad I.M. Adcock The role of histone deacetylases in asthma and allergic diseases J. Allergy Clin. Immunol. 121 2008 580 584 10.1016/j.jaci.2007.12.1156 Bhavsar, P., Ahmad, T. and Adcock, I. M., 2008. The role of histone deacetylases in asthma and allergic diseases. J Allergy Clin Immunol. 121, 580\u2010584. https://doi.org/10.1016/j.jaci.2007.12.1156. Billet et al., 2018 S. Billet Y. Landkocz P.J. Martin A. Verdin F. Ledoux C. Lepers V. Andr\u00e9 F. Cazier F. Sichel P. Shirali P. Gosset D. Courcot Chemical characterization of fine and ultrafine PM, direct and indirect genotoxicity of PM and their organic extracts on pulmonary cells J. Environ. Sci. 71 2018 168 178 10.1016/j.jes.2018.04.022 Billet, S., Landkocz, Y., Martin, P. J., Verdin, A., Ledoux, F., Lepers, C., Andr\u00e9, V., Cazier, F., Sichel, F., Shirali, P., Gosset, P. and Courcot, D., 2018. Chemical characterization of fine and ultrafine PM, direct and indirect genotoxicity of PM and their organic extracts on pulmonary cells. Journal of Environmental Sciences. 71, 168\u2010178. https://doi.org/10.1016/j.jes.2018.04.022. Bollati et al., 2010 V. Bollati B. Marinelli P. Apostoli M. Bonzini F. Nordio M. Hoxha V. Pegoraro V. Motta L. Tarantini L. Cantone J. Schwartz P.A. Bertazzi A. Baccarelli Exposure to metal-rich particulate matter modifies the expression of candidate microRNAs in peripheral blood leukocytes Environ. Health Perspect. 118 2010 763 768 10.1289/ehp.0901300 Bollati, V., Marinelli, B., Apostoli, P., Bonzini, M., Nordio, F., Hoxha, M., Pegoraro, V., Motta, V., Tarantini, L., Cantone, L., Schwartz, J., Bertazzi, P. A. andBaccarelli, A., 2010. Exposure to metal-rich particulate matter modifies the expression of candidate microRNAs in peripheral blood leukocytes. Environ Health Perspect. 118, 763\u2010768. https://doi.org/10.1289/ehp.0901300. Borgie et al., 2015 M. Borgie F. Ledoux A. Verdin F. Cazier H. Greige P. Shirali D. Courcot Z. Dagher Genotoxic and epigenotoxic effects of fine particulate matter from rural and urban sites in Lebanon on human bronchial epithelial cells Environ. Res. 136 2015 352 362 10.1016/j.envres.2014.10.010 Borgie, M., Ledoux, F., Verdin, A., Cazier, F., Greige, H., Shirali, P., Courcot, D. and Dagher, Z., 2015. Genotoxic and epigenotoxic effects of fine particulate matter from rural and urban sites in Lebanon on human bronchial epithelial cells. Environmental Research. 136, 352\u2010362. https://doi.org/10.1016/j.envres.2014.10.010. Borthwick et al., 2016 L.A. Borthwick L. Barron K.M. Hart K.M. Vannella R.W. Thompson S. Oland A. Cheever J. Sciurba T.R. Ramalingam A.J. Fisher T.A. Wynn Macrophages are critical to the maintenance of IL-13-dependent lung inflammation and fibrosis Mucosal Immunol. 9 2016 38 55 10.1038/mi.2015.34 Borthwick, L. A., Barron, L., Hart, K. M., Vannella, K. M., Thompson, R. W., Oland, S., Cheever, A., Sciurba, J., Ramalingam, T. R., Fisher, A. J. and Wynn, T. A., 2016. Macrophages are critical to the maintenance of IL-13-dependent lung inflammation and fibrosis. Mucosal Immunol. 9, 38\u201055. https://doi.org/10.1038/mi.2015.34. Br\u00e4uner et al., 2009 E.V. Br\u00e4uner J. Mortensen P. M\u00f8ller A. Bernard P. Vinzents P. W\u00e5hlin M. Glasius S. Loft Effects of ambient air particulate exposure on blood-gas barrier permeability and lung function Inhal. Toxicol. 21 2009 38 47 10.1080/08958370802304735 Br\u00e4uner, E. V., Mortensen, J., M\u00f8ller, P., Bernard, A., Vinzents, P., W\u00e5hlin, P., Glasius, M. and Loft, S., 2009. Effects of ambient air particulate exposure on blood-gas barrier permeability and lung function. Inhal Toxicol. 21, 38\u201047. https://doi.org/10.1080/08958370802304735. Breton et al., 2012 C.V. Breton M.T. Salam X. Wang H.-M. Byun K.D. Siegmund F.D. Gilliland Particulate matter, DNA methylation in nitric oxide synthase, and childhood respiratory disease Environ. Health Perspect. 120 2012 1320 1326 10.1289/ehp.1104439 Breton, C. V., Salam, M. T., Wang, X., Byun, H.-M., Siegmund, K. D. and Gilliland, F. D., 2012. Particulate matter, DNA methylation in nitric oxide synthase, and childhood respiratory disease. Environmental health perspectives. 120, 1320\u20101326. https://doi.org/10.1289/ehp.1104439. Bridges et al., 2000 J.P. Bridges H.W. Davis M. Damodarasamy Y. Kuroki G. Howles D.Y. Hui F.X. McCormack Pulmonary surfactant proteins A and D are potent endogenous inhibitors of lipid peroxidation and oxidative cellular injury J. Biol. Chem. 275 2000 38848 38855 10.1074/jbc.M005322200 Bridges, J. P., Davis, H. W., Damodarasamy, M., Kuroki, Y., Howles, G., Hui, D. Y. and McCormack, F. X., 2000. Pulmonary surfactant proteins A and D are potent endogenous inhibitors of lipid peroxidation and oxidative cellular injury. J Biol Chem. 275, 38848\u201038855. https://doi.org/10.1074/jbc.M005322200. Broeckaert and Bernard, 2000 F. Broeckaert A. Bernard Clara cell secretory protein (CC16): characteristics and perspectives as lung peripheral biomarker Clin. Exp. Allergy 30 2000 469 475 10.1046/j.1365-2222.2000.00760.x Broeckaert, F. and Bernard, A., 2000. Clara cell secretory protein (CC16): characteristics and perspectives as lung peripheral biomarker. Clin Exp Allergy. 30, 469\u2010475. https://doi.org/10.1046/j.1365\u20102222.2000.00760.x. Brucker et al., 2013 N. Brucker A.M. Moro M.F. Char\u00e3o J. Durgante F. Freitas M. Baierle S. Nascimento B. Gauer R.P. Bulc\u00e3o G.B. Bubols P.D. Ferrari F.V. Thiesen A. Gioda M.M. Duarte I. de Castro P.H. Saldiva S.C. Garcia Biomarkers of occupational exposure to air pollution, inflammation and oxidative damage in taxi drivers Sci. Total Environ. 463\u2013464 2013 884 893 10.1016/j.scitotenv.2013.06.098 Brucker, N., Moro, A. M., Char\u00e3o, M. F., Durgante, J., Freitas, F., Baierle, M., Nascimento, S., Gauer, B., Bulc\u00e3o, R. P., Bubols, G. B., Ferrari, P. D., Thiesen, F. V., Gioda, A., Duarte, M. M., de Castro, I., Saldiva, P. H. and Garcia, S. C., 2013. Biomarkers of occupational exposure to air pollution, inflammation and oxidative damage in taxi drivers. The Science of the total environment. 463\u2010464, 884\u2010893. https://doi.org/10.1016/j.scitotenv.2013.06.098. Cachon et al., 2014 B.F. Cachon S. Firmin A. Verdin L. Ayi-Fanou S. Billet F. Cazier P.J. Martin F. Aissi D. Courcot A. Sanni P. Shirali Proinflammatory effects and oxidative stress within human bronchial epithelial cells exposed to atmospheric particulate matter (PM(2.5) and PM(>2.5)) collected from Cotonou, Benin Environ. Pollut. 185 2014 340 351 10.1016/j.envpol.2013.10.026 Cachon, B. F., Firmin, S., Verdin, A., Ayi-Fanou, L., Billet, S., Cazier, F., Martin, P. J., Aissi, F., Courcot, D., Sanni, A. and Shirali, P., 2014. Proinflammatory effects and oxidative stress within human bronchial epithelial cells exposed to atmospheric particulate matter (PM(2.5) and PM(>2.5)) collected from Cotonou, Benin. Environ Pollut. 185, 340\u2010351. https://doi.org/10.1016/j.envpol.2013.10.026. Califf, 2018 R.M. Califf Biomarker definitions and their applications Exp. Biol. Med. (Maywood, N. J.) 243 2018 213 221 10.1177/1535370217750088 Califf, R. M., 2018. Biomarker definitions and their applications. Experimental biology and medicine (Maywood, N.J.). 243, 213\u2010221. https://doi.org/10.1177/1535370217750088. Cantone et al., 2011 L. Cantone F. Nordio L. Hou P. Apostoli M. Bonzini L. Tarantini L. Angelici V. Bollati A. Zanobetti J. Schwartz P.A. Bertazzi A. Baccarelli Inhalable metal-rich air particles and histone H3K4 dimethylation and H3K9 acetylation in a cross-sectional study of steel workers Environ. Health Perspect. 119 2011 964 969 10.1289/ehp.1002955 Cantone, L., Nordio, F., Hou, L., Apostoli, P., Bonzini, M., Tarantini, L., Angelici, L., Bollati, V., Zanobetti, A., Schwartz, J., Bertazzi, P. A. and Baccarelli, A., 2011. Inhalable metal-rich air particles and histone H3K4 dimethylation and H3K9 acetylation in a cross-sectional study of steel workers. Environ Health Perspect. 119, 964\u2010969. https://doi.org/10.1289/ehp.1002955. Chen et al., 2015a R. Chen L. Qiao H. Li Y. Zhao Y. Zhang W. Xu C. Wang H. Wang Z. Zhao X. Xu H. Hu H. Kan Fine particulate matter constituents, nitric oxide synthase DNA methylation and exhaled nitric oxide Environ. Sci. Technol. 49 2015 11859 11865 10.1021/acs.est.5b02527 Chen, R., Qiao, L., Li, H., Zhao, Y., Zhang, Y., Xu, W., Wang, C., Wang, H., Zhao, Z., Xu, X., Hu, H. and Kan, H., 2015a. Fine Particulate Matter Constituents, Nitric Oxide Synthase DNA Methylation and Exhaled Nitric Oxide. Environ Sci Technol. 49, 11859\u201011865. https://doi.org/10.1021/acs.est.5b02527. Chen et al., 2017 R. Chen P. Yin X. Meng C. Liu L. Wang X. Xu J.A. Ross L.A. Tse Z. Zhao H. Kan M. Zhou Fine particulate air pollution and daily mortality. a nationwide analysis in 272 Chinese cities Am. J. Respir. Crit. Care Med. 196 2017 73 81 10.1164/rccm.201609-1862OC Chen, R., Yin, P., Meng, X., Liu, C., Wang, L., Xu, X., Ross, J. A., Tse, L. A., Zhao, Z., Kan, H. and Zhou, M., 2017. Fine Particulate Air Pollution and Daily Mortality. A Nationwide Analysis in 272 Chinese Cities. Am J Respir Crit Care Med. 196, 73\u201081. https://doi.org/10.1164/rccm.201609\u20101862OC. Chen and Bloom, 2019 S. Chen D.E. Bloom The macroeconomic burden of noncommunicable diseases associated with air pollution in China PloS One 14 2019 10.1371/journal.pone.0215663 Chen, S. and Bloom, D. E., 2019. The macroeconomic burden of noncommunicable diseases associated with air pollution in China. PloS one. 14, e0215663-e0215663. https://doi.org/10.1371/journal.pone.0215663. Chen et al., 2018a X. Chen W. Chen Y. Wang Y. Han T. Zhu Responses of healthy young males to fine-particle exposure are modified by exercise habits: a panel study Environ. Health 17 2018 88 10.1186/s12940-018-0437-3 Chen, X., Chen, W., Wang, Y., Han, Y. and Zhu, T., 2018a. Responses of healthy young males to fine-particle exposure are modified by exercise habits: a panel study. Environ Health. 17, 88\u201088. https://doi.org/10.1186/s12940\u2010018\u20100437\u20103. Chen et al., 2018b Y. Chen X.-S. Luo Z. Zhao Q. Chen D. Wu X. Sun L. Wu L. Jin Summer\u2013winter differences of PM2.5 toxicity to human alveolar epithelial cells (A549) and the roles of transition metals Ecotoxicol. Environ. Saf. 165 2018 505 509 10.1016/j.ecoenv.2018.09.034 Chen, Y., Luo, X.-S., Zhao, Z., Chen, Q., Wu, D., Sun, X., Wu, L. and Jin, L., 2018b. Summer\u2013winter differences of PM2.5 toxicity to human alveolar epithelial cells (A549) and the roles of transition metals. Ecotoxicology and Environmental Safety. 165, 505\u2010509. https://doi.org/10.1016/j.ecoenv.2018.09.034. Chen et al., 2015b Z. Chen D. Wang X. Liu W. Pei J. Li Y. Cao J. Zhang Y. An J. Nie J. Tong Oxidative DNA damage is involved in cigarette smoke-induced lung injury in rats Environ. Health Prev. Med. 20 2015 318 324 10.1007/s12199-015-0469-z Chen, Z., Wang, D., Liu, X., Pei, W., Li, J., Cao, Y., Zhang, J., An, Y., Nie, J. and Tong, J., 2015b. Oxidative DNA damage is involved in cigarette smoke-induced lung injury in rats. Environ Health Prev Med. 20, 318\u2010324. https://doi.org/10.1007/s12199\u2010015\u20100469\u2010z. Cheng et al., 2019 I.Y. Cheng C.C. Liu J.H. Lin T.W. Hsu J.W. Hsu A.F. Li W.C. Ho S.C. Hung H.S. Hsu Particulate matter increases the severity of Bleomycin-induced pulmonary fibrosis through KC-mediated neutrophil chemotaxis Int. J. Mol. Sci. 2019 21 10.3390/ijms21010227 Cheng, I. Y., Liu, C. C., Lin, J. H., Hsu, T. W., Hsu, J. W., Li, A. F., Ho, W. C., Hung, S. C. and Hsu, H. S., 2019. Particulate Matter Increases the Severity of Bleomycin-Induced Pulmonary Fibrosis through KC-Mediated Neutrophil Chemotaxis. International journal of molecular sciences. 21. https://doi.org/10.3390/ijms21010227. Chi et al., 2018 Y. Chi Q. Huang Y. Lin G. Ye H. Zhu S. Dong Epithelial-mesenchymal transition effect of fine particulate matter from the Yangtze River Delta region in China on human bronchial epithelial cells J. Environ. Sci. 66 2018 155 164 10.1016/j.jes.2017.05.002 Chi, Y., Huang, Q., Lin, Y., Ye, G., Zhu, H. and Dong, S., 2018. Epithelial-mesenchymal transition effect of fine particulate matter from the Yangtze River Delta region in China on human bronchial epithelial cells. Journal of Environmental Sciences. 66, 155\u2010164. https://doi.org/10.1016/j.jes.2017.05.002. Chou et al., 2020 Y.H. Chou D.M. Tantoh M.C. Wu Y.S. Tyan P.H. Chen O.N. Nfor S.Y. Hsu C.Y. Shen C.N. Huang Y.P. Liaw PM(2.5) exposure and DLEC1 promoter methylation in Taiwan Biobank participants Environ. Health Prev. Med. 25 2020 68 10.1186/s12199-020-00909-x Chou, Y. H., Tantoh, D. M., Wu, M. C., Tyan, Y. S., Chen, P. H., Nfor, O. N., Hsu, S. Y., Shen, C. Y., Huang, C. N. and Liaw, Y. P., 2020. PM(2.5) exposure and DLEC1 promoter methylation in Taiwan Biobank participants. Environ Health Prev Med. 25, 68. https://doi.org/10.1186/s12199\u2010020\u201000909\u2010x. Chu et al., 2021 H. Chu F.Q. Huang Q. Yuan Y. Fan J. Xin M. Du M. Wang Z. Zhang G. Ma Metabolomics identifying biomarkers of PM(2.5) exposure for vulnerable population: based on a prospective cohort study Environ. Sci. Pollut. Res. Int. 28 2021 14586 14596 10.1007/s11356-020-11677-0 Chu, H., Huang, F. Q., Yuan, Q., Fan, Y., Xin, J., Du, M., Wang, M., Zhang, Z. and Ma, G., 2021. Metabolomics identifying biomarkers of PM(2.5) exposure for vulnerable population: based on a prospective cohort study. Environmental science and pollution research international. 28, 14586\u201014596. https://doi.org/10.1007/s11356\u2010020\u201011677\u20100. Chuang et al., 2015 H.-C. Chuang K.-F. Ho J.-J. Cao K.-J. Chuang S.S.H. Ho P.-H. Feng L. Tian C.-H. Lee Y.-M. Han C.-N. Lee T.-J. Cheng Effects of non-protein-type amino acids of fine particulate matter on E-cadherin and inflammatory responses in mice Toxicol. Lett. 237 2015 174 180 10.1016/j.toxlet.2015.06.013 Chuang, H.-C., Ho, K.-F., Cao, J.-J., Chuang, K.-J., Ho, S. S. H., Feng, P.-H., Tian, L., Lee, C.-H., Han, Y.-M., Lee, C.-N. and Cheng, T.-J., 2015. Effects of non-protein-type amino acids of fine particulate matter on E-cadherin and inflammatory responses in mice. Toxicology Letters. 237, 174\u2010180. https://doi.org/10.1016/j.toxlet.2015.06.013. Cochard et al., 2020 M. Cochard F. Ledoux Y. Landkocz Atmospheric fine particulate matter and epithelial mesenchymal transition in pulmonary cells: state of the art and critical review of the in vitro studies J. Toxicol. Environ. Health B Crit. Rev. 23 2020 293 318 10.1080/10937404.2020.1816238 Cochard, M., Ledoux, F. and Landkocz, Y., 2020. Atmospheric fine particulate matter and epithelial mesenchymal transition in pulmonary cells: state of the art and critical review of the in vitro studies. J Toxicol Environ Health B Crit Rev. 23, 293\u2010318. https://doi.org/10.1080/10937404.2020.1816238. Corbel et al., 2002 M. Corbel C. Belleguic E. Boichot V. Lagente Involvement of gelatinases (MMP-2 and MMP-9) in the development of airway inflammation and pulmonary fibrosis Cell Biol. Toxicol. 18 2002 51 61 10.1023/A:1014471213371 Corbel, M., Belleguic, C., Boichot, E. and Lagente, V., 2002. Involvement of gelatinases (MMP-2 and MMP-9) in the development of airway inflammation and pulmonary fibrosis. Cell Biology and Toxicology. 18, 51\u201061. https://doi.org/10.1023/A:1014471213371. Dancer et al., 2011 R.C.A. Dancer A.M. Wood D.R. Thickett Metalloproteinases in idiopathic pulmonary fibrosis Eur. Respir. J. 38 2011 1461 10.1183/09031936.00024711 Dancer, R. C. A., Wood, A. M. and Thickett, D. R., 2011. Metalloproteinases in idiopathic pulmonary fibrosis. European Respiratory Journal. 38, 1461. https://doi.org/10.1183/09031936.00024711. De Prins et al., 2014 S. De Prins E. Dons M. Van Poppel L. Int Panis E. Van de Mieroop V. Nelen B. Cox T.S. Nawrot C. Teughels G. Schoeters G. Koppen Airway oxidative stress and inflammation markers in exhaled breath from children are linked with exposure to black carbon Environ. Int. 73 2014 440 446 10.1016/j.envint.2014.06.017 De Prins, S., Dons, E., Van Poppel, M., Int Panis, L., Van de Mieroop, E., Nelen, V., Cox, B., Nawrot, T. S., Teughels, C., Schoeters, G. and Koppen, G., 2014. Airway oxidative stress and inflammation markers in exhaled breath from children are linked with exposure to black carbon. Environ Int. 73, 440\u2010446. https://doi.org/10.1016/j.envint.2014.06.017. De Prins et al., 2013 S. De Prins G. Koppen G. Jacobs E. Dons E. Van de Mieroop V. Nelen F. Fierens L. Int Panis P. De Boever B. Cox T.S. Nawrot G. Schoeters Influence of ambient air pollution on global DNA methylation in healthy adults: a seasonal follow-up Environ. Int. 59 2013 418 424 10.1016/j.envint.2013.07.007 De Prins, S., Koppen, G., Jacobs, G., Dons, E., Van de Mieroop, E., Nelen, V., Fierens, F., Int Panis, L., De Boever, P., Cox, B., Nawrot, T. S. and Schoeters, G., 2013. Influence of ambient air pollution on global DNA methylation in healthy adults: A seasonal follow-up. Environment International. 59, 418\u2010424. https://doi.org/10.1016/j.envint.2013.07.007. Delfino et al., 2006 R.J. Delfino N. Staimer D. Gillen T. Tjoa C. Sioutas K. Fung S.C. George M.T. Kleinman Personal and ambient air pollution is associated with increased exhaled nitric oxide in children with asthma Environ. Health Perspect. 114 2006 1736 1743 10.1289/ehp.9141 Delfino, R. J., Staimer, N., Gillen, D., Tjoa, T., Sioutas, C., Fung, K., George, S. C. and Kleinman, M. T., 2006. Personal and ambient air pollution is associated with increased exhaled nitric oxide in children with asthma. Environ Health Perspect. 114, 1736\u20101743. https://doi.org/10.1289/ehp.9141. Deng et al., 2017 X. Deng N. Feng M. Zheng X. Ye H. Lin X. Yu Z. Gan Z. Fang H. Zhang M. Gao Z.J. Zheng H. Yu W. Ding B. Qian PM(2.5) exposure-induced autophagy is mediated by lncRNA loc146880 which also promotes the migration and invasion of lung cancer cells Biochim Biophys. Acta Gen. Subj. 1861 2017 112 125 10.1016/j.bbagen.2016.11.009 Deng, X., Feng, N., Zheng, M., Ye, X., Lin, H., Yu, X., Gan, Z., Fang, Z., Zhang, H., Gao, M., Zheng, Z. J., Yu, H., Ding, W. and Qian, B., 2017. PM(2.5) exposure-induced autophagy is mediated by lncRNA loc146880 which also promotes the migration and invasion of lung cancer cells. Biochim Biophys Acta Gen Subj. 1861, 112\u2010125. https://doi.org/10.1016/j.bbagen.2016.11.009. Ding et al., 2017 R. Ding Y. Jin X. Liu H. Ye Z. Zhu Y. Zhang T. Wang Y. Xu Dose- and time- effect responses of DNA methylation and histone H3K9 acetylation changes induced by traffic-related air pollution Sci. Rep. 7 2017 43737 10.1038/srep43737 Ding, R., Jin, Y., Liu, X., Ye, H., Zhu, Z., Zhang, Y., Wang, T. and Xu, Y., 2017. Dose- and time- effect responses of DNA methylation and histone H3K9 acetylation changes induced by traffic-related air pollution. Sci Rep. 7, 43737. https://doi.org/10.1038/srep43737. Ding et al., 2016a R. Ding Y. Jin X. Liu Z. Zhu Y. Zhang T. Wang Y. Xu Characteristics of DNA methylation changes induced by traffic-related air pollution Mutat. Res. /Genet. Toxicol. Environ. Mutagen. 796 2016 46 53 10.1016/j.mrgentox.2015.12.002 Ding, R., Jin, Y., Liu, X., Zhu, Z., Zhang, Y., Wang, T. and Xu, Y., 2016a. Characteristics of DNA methylation changes induced by traffic-related air pollution. Mutation Research/Genetic Toxicology and Environmental Mutagenesis. 796, 46\u201053. https://doi.org/10.1016/j.mrgentox.2015.12.002. Ding et al., 2016b R. Ding Y. Jin X. Liu Z. Zhu Y. Zhang T. Wang Y. Xu H3K9 acetylation change patterns in rats after exposure to traffic-related air pollution Environ. Toxicol. Pharmacol. 42 2016 170 175 10.1016/j.etap.2016.01.016 Ding, R., Jin, Y., Liu, X., Zhu, Z., Zhang, Y., Wang, T. and Xu, Y., 2016b. H3K9 acetylation change patterns in rats after exposure to traffic-related air pollution. Environmental Toxicology and Pharmacology. 42, 170\u2010175. https://doi.org/10.1016/j.etap.2016.01.016. Ding et al., 2019 S. Ding H. Wang M. Wang L. Bai P. Yu W. Wu Resveratrol alleviates chronic \u201creal-world\u201d ambient particulate matter-induced lung inflammation and fibrosis by inhibiting NLRP3 inflammasome activation in mice Ecotoxicol. Environ. Saf. 182 2019 109425 10.1016/j.ecoenv.2019.109425 Ding, S., Wang, H., Wang, M., Bai, L., Yu, P. and Wu, W., 2019. Resveratrol alleviates chronic \"real-world\" ambient particulate matter-induced lung inflammation and fibrosis by inhibiting NLRP3 inflammasome activation in mice. Ecotoxicol Environ Saf. 182, 109425. https://doi.org/10.1016/j.ecoenv.2019.109425. Dinh-Xuan et al., 2015 A.T. Dinh-Xuan I. Annesi-Maesano P. Berger A. Chambellan P. Chanez T. Chinet B. Degano C. Delclaux V. Demange A. Didier G. Garcia A. Magnan B. Mahut N. Roche S. French Speaking Respiratory Contribution of exhaled nitric oxide measurement in airway inflammation assessment in asthma. A position paper from the French Speaking Respiratory Society Rev. Mal. Respir. 32 2015 193 215 10.1016/j.rmr.2014.11.004 Dinh-Xuan, A. T., Annesi-Maesano, I., Berger, P., Chambellan, A., Chanez, P., Chinet, T., Degano, B., Delclaux, C., Demange, V., Didier, A., Garcia, G., Magnan, A., Mahut, B., Roche, N. and French Speaking Respiratory, S., 2015. Contribution of exhaled nitric oxide measurement in airway inflammation assessment in asthma. A position paper from the French Speaking Respiratory Society. Rev Mal Respir. 32, 193\u2010215. https://doi.org/10.1016/j.rmr.2014.11.004. Dominguez-Rodriguez et al., 2020 A. Dominguez-Rodriguez S. Rodr\u00edguez N. Baez-Ferrer P. Abreu-Gonzalez J. Abreu-Gonzalez P. Avanzas M. Carnero C. Moris J. L\u00f3pez-Darias D. Hern\u00e1ndez-Vaquero Impact of Saharan dust exposure on airway inflammation in patients with ischemic heart disease Transl. Res. 224 2020 16 25 10.1016/j.trsl.2020.05.011 Dominguez-Rodriguez, A., Rodr\u00edguez, S., Baez-Ferrer, N., Abreu-Gonzalez, P., Abreu-Gonzalez, J., Avanzas, P., Carnero, M., Moris, C., L\u00f3pez-Darias, J. and Hern\u00e1ndez-Vaquero, D., 2020. Impact of Saharan dust exposure on airway inflammation in patients with ischemic heart disease. Transl Res. 224, 16\u201025. https://doi.org/10.1016/j.trsl.2020.05.011. Dongre and Weinberg, 2019 A. Dongre R.A. Weinberg New insights into the mechanisms of epithelial-mesenchymal transition and implications for cancer Nat. Rev. Mol. Cell Biol. 20 2019 69 84 10.1038/s41580-018-0080-4 Dongre, A. and Weinberg, R. A., 2019. New insights into the mechanisms of epithelial-mesenchymal transition and implications for cancer. Nature reviews. Molecular cell biology. 20, 69\u201084. https://doi.org/10.1038/s41580\u2010018\u20100080\u20104. dos Santos et al., 2012 G. dos Santos M.A. Kutuzov K.M. Ridge The inflammasome in lung diseases. American journal of physiology Lung Cell. Mol. Physiol. 303 2012 L627 L633 10.1152/ajplung.00225.2012 dos Santos, G., Kutuzov, M. A. and Ridge, K. M., 2012. The inflammasome in lung diseases. American journal of physiology. Lung cellular and molecular physiology. 303, L627-L633. https://doi.org/10.1152/ajplung.00225.2012. Fan et al., 2016 J. Fan S. Li C. Fan Z. Bai K. Yang The impact of PM2.5 on asthma emergency department visits: a systematic review and meta-analysis Environ. Sci. Pollut. Res. Int. 23 2016 843 850 10.1007/s11356-015-5321-x Fan, J., Li, S., Fan, C., Bai, Z. and Yang, K., 2016. The impact of PM2.5 on asthma emergency department visits: a systematic review and meta-analysis. Environmental science and pollution research international. 23, 843\u2010850. https://doi.org/10.1007/s11356\u2010015\u20105321\u2010x. Ferguson et al., 2016 M.D. Ferguson E.O. Semmens C. Dumke J.C. Quindry T.J. Ward Measured pulmonary and systemic markers of inflammation and oxidative stress following wildland firefighter simulations J. Occup. Environ. Med. 58 2016 407 413 10.1097/JOM.0000000000000688 Ferguson, M. D., Semmens, E. O., Dumke, C., Quindry, J. C. and Ward, T. J., 2016. Measured Pulmonary and Systemic Markers of Inflammation and Oxidative Stress Following Wildland Firefighter Simulations. J Occup Environ Med. 58, 407\u2010413. https://doi.org/10.1097/JOM.0000000000000688. Fernandez and Eickelberg, 2012 I.E. Fernandez O. Eickelberg The impact of TGF-beta on lung fibrosis: from targeting to biomarkers Proc. Am. Thorac. Soc. 9 2012 111 116 10.1513/pats.201203-023AW Fernandez, I. E. and Eickelberg, O., 2012. The impact of TGF-beta on lung fibrosis: from targeting to biomarkers. Proceedings of the American Thoracic Society. 9, 111\u2010116. https://doi.org/10.1513/pats.201203\u2010023AW. Forbes et al., 2009 L.J. Forbes M.D. Patel A.R. Rudnicka D.G. Cook T. Bush J.R. Stedman P.H. Whincup D.P. Strachan R.H. Anderson Chronic exposure to outdoor air pollution and markers of systemic inflammation Epidemiology 20 2009 245 253 10.1097/EDE.0b013e318190ea3f Forbes, L. J., Patel, M. D., Rudnicka, A. R., Cook, D. G., Bush, T., Stedman, J. R., Whincup, P. H., Strachan, D. P. and Anderson, R. H., 2009. Chronic exposure to outdoor air pollution and markers of systemic inflammation. Epidemiology. 20, 245\u2010253. https://doi.org/10.1097/EDE.0b013e318190ea3f. Fossati et al., 2014 S. Fossati A. Baccarelli A. Zanobetti M. Hoxha P.S. Vokonas R.O. Wright J. Schwartz Ambient particulate air pollution and microRNAs in elderly men Epidemiology 25 2014 68 78 10.1097/ede.0000000000000026 Fossati, S., Baccarelli, A., Zanobetti, A., Hoxha, M., Vokonas, P. S., Wright, R. O. and Schwartz, J., 2014. Ambient particulate air pollution and microRNAs in elderly men. Epidemiology. 25, 68\u201078. https://doi.org/10.1097/ede.0000000000000026. Fuentes-Mattei et al., 2010 E. Fuentes-Mattei E. Rivera A. Gioda D. Sanchez-Rivera F.R. Roman-Velazquez B.D. Jimenez-Velez Use of human bronchial epithelial cells (BEAS-2B) to study immunological markers resulting from exposure to PM(2.5) organic extract from Puerto Rico Toxicol. Appl. Pharm. 243 2010 381 389 10.1016/j.taap.2009.12.009 Fuentes-Mattei, E., Rivera, E., Gioda, A., Sanchez-Rivera, D., Roman-Velazquez, F. R. and Jimenez-Velez, B. D., 2010. Use of human bronchial epithelial cells (BEAS-2B) to study immunological markers resulting from exposure to PM(2.5) organic extract from Puerto Rico. Toxicol Appl Pharmacol. 243, 381\u2010389. https://doi.org/10.1016/j.taap.2009.12.009. Gali et al., 2019 N.K. Gali G. Li Z. Ning P. Brimblecombe Diurnal trends in redox characteristics of water-soluble and -insoluble PM components Environ. Pollut. (Barking, Essex: 1987) 254 2019 112841 10.1016/j.envpol.2019.07.009 Gali, N. K., Li, G., Ning, Z. and Brimblecombe, P., 2019. Diurnal trends in redox characteristics of water-soluble and -insoluble PM components. Environmental pollution (Barking, Essex: 1987). 254, 112841. https://doi.org/10.1016/j.envpol.2019.07.009. Gali et al., 2017 N.K. Gali F. Yang C.S. Cheung Z. Ning A comparative analysis of chemical components and cell toxicity properties of solid and semi-volatile PM from diesel and biodiesel blend J. Aerosol Sci. 111 2017 51 64 10.1016/j.jaerosci.2017.06.005 Gali, N. K., Yang, F., Cheung, C. S. and Ning, Z., 2017. A comparative analysis of chemical components and cell toxicity properties of solid and semi-volatile PM from diesel and biodiesel blend. Journal of Aerosol Science. 111, 51\u201064. https://doi.org/10.1016/j.jaerosci.2017.06.005. Gauderman et al., 2007 W.J. Gauderman H. Vora R. McConnell K. Berhane F. Gilliland D. Thomas F. Lurmann E. Avol N. Kunzli M. Jerrett J. Peters Effect of exposure to traffic on lung development from 10 to 18 years of age: a cohort study Lancet (Londond, England) 369 2007 571 577 10.1016/s0140-6736(07)60037-3 Gauderman, W. J., Vora, H., McConnell, R., Berhane, K., Gilliland, F., Thomas, D., Lurmann, F., Avol, E., Kunzli, N., Jerrett, M. and Peters, J., 2007. Effect of exposure to traffic on lung development from 10 to 18 years of age: a cohort study. Lancet (London, England). 369, 571\u2010577. https://doi.org/10.1016/s0140\u20106736(07)60037\u20103. Gauldie et al., 2007 J. Gauldie P. Bonniaud P. Sime K. Ask M. Kolb TGF-beta, Smad3 and the process of progressive fibrosis Biochem Soc. Trans. 35 2007 661 664 10.1042/bst0350661 Gauldie, J., Bonniaud, P., Sime, P., Ask, K. and Kolb, M., 2007. TGF-beta, Smad3 and the process of progressive fibrosis. Biochem Soc Trans. 35, 661\u2010664. https://doi.org/10.1042/bst0350661. GBD, 2019 GBD 2019 Risk Factors Collaborators Global burden of 87 risk factors in 204 countries and territories, 1990\u20132019: a systematic analysis for the Global Burden of Disease Study 2019 Lancet 396 2020 1223 1249 10.1016/S0140-6736(20)30752-2 GBD 2019 Risk Factors Collaborators, 2020. Global burden of 87 risk factors in 204 countries and territories, 1990\u20132019: a systematic analysis for the Global Burden of Disease Study 2019. The Lancet. 396, 1223\u20101249. https://doi.org/10.1016/S0140\u20106736(20)30752\u20102. Gehring et al., 2013 U. Gehring O. Gruzieva R.M. Agius R. Beelen A. Custovic J. Cyrys M. Eeftens C. Flexeder E. Fuertes J. Heinrich B. Hoffmann J.C. de Jongste M. Kerkhof C. Klumper M. Korek A. Molter E.S. Schultz A. Simpson D. Sugiri M. Svartengren A. von Berg A.H. Wijga G. Pershagen B. Brunekreef Air pollution exposure and lung function in children: the ESCAPE project Environ. Health Perspect. 121 2013 1357 1364 10.1289/ehp.1306770 Gehring, U., Gruzieva, O., Agius, R. M., Beelen, R., Custovic, A., Cyrys, J., Eeftens, M., Flexeder, C., Fuertes, E., Heinrich, J., Hoffmann, B., de Jongste, J. C., Kerkhof, M., Klumper, C., Korek, M., Molter, A., Schultz, E. S., Simpson, A., Sugiri, D., Svartengren, M., von Berg, A., Wijga, A. H., Pershagen, G. and Brunekreef, B., 2013. Air pollution exposure and lung function in children: the ESCAPE project. Environ Health Perspect. 121, 1357\u20101364. https://doi.org/10.1289/ehp.1306770. Gessner et al., 2003 C. Gessner S. Hammerschmidt H. Kuhn H.J. Seyfarth U. Sack L. Engelmann J. Schauer H. Wirtz Exhaled breath condensate acidification in acute lung injury Respir. Med. 97 2003 1188 1194 10.1016/s0954-6111(03)00225-7 Gessner, C., Hammerschmidt, S., Kuhn, H., Seyfarth, H. J., Sack, U., Engelmann, L., Schauer, J. and Wirtz, H., 2003. Exhaled breath condensate acidification in acute lung injury. Respiratory medicine. 97, 1188\u20101194. https://doi.org/10.1016/s0954\u20106111(03)00225\u20107. Gilmour et al., 2003 P.S. Gilmour I. Rahman K. Donaldson W. MacNee Histone acetylation regulates epithelial IL-8 release mediated by oxidative stress from environmental particles Am. J. Physiol. Lung Cell. Mol. Physiol. 284 2003 L533 L540 10.1152/ajplung.00277.2002 Gilmour, P. S., Rahman, I., Donaldson, K. and MacNee, W., 2003. Histone acetylation regulates epithelial IL-8 release mediated by oxidative stress from environmental particles. American journal of physiology. Lung cellular and molecular physiology. 284, L533-L540. https://doi.org/10.1152/ajplung.00277.2002. Gioda et al., 2011 A. Gioda E. Fuentes-Mattei B. Jimenez-Velez Evaluation of cytokine expression in BEAS cells exposed to fine particulate matter (PM2.5) from specialized indoor environments Int J. Environ. Health Res. 21 2011 106 119 10.1080/09603123.2010.515668 Gioda, A., Fuentes-Mattei, E. and Jimenez-Velez, B., 2011. Evaluation of cytokine expression in BEAS cells exposed to fine particulate matter (PM2.5) from specialized indoor environments. Int J Environ Health Res. 21, 106\u2010119. https://doi.org/10.1080/09603123.2010.515668. Gong et al., 2014 J. Gong T. Zhu H. Kipen G. Wang M. Hu Q. Guo P. Ohman-Strickland S.E. Lu Y. Wang P. Zhu D.Q. Rich W. Huang J. Zhang Comparisons of ultrafine and fine particles in their associations with biomarkers reflecting physiological pathways Environ. Sci. Technol. 48 2014 5264 5273 10.1021/es5006016 Gong, J., Zhu, T., Kipen, H., Wang, G., Hu, M., Guo, Q., Ohman-Strickland, P., Lu, S. E., Wang, Y., Zhu, P., Rich, D. Q., Huang, W. and Zhang, J., 2014. Comparisons of ultrafine and fine particles in their associations with biomarkers reflecting physiological pathways. Environ Sci Technol. 48, 5264\u20105273. https://doi.org/10.1021/es5006016. Gong et al., 2013 J. Gong T. Zhu H. Kipen G. Wang M. Hu P. Ohman-Strickland S.E. Lu L. Zhang Y. Wang P. Zhu D.Q. Rich S.R. Diehl W. Huang J.J. Zhang Malondialdehyde in exhaled breath condensate and urine as a biomarker of air pollution induced oxidative stress J. Expo. Sci. Environ. Epidemiol. 23 2013 322 327 10.1038/jes.2012.127 Gong, J., Zhu, T., Kipen, H., Wang, G., Hu, M., Ohman-Strickland, P., Lu, S. E., Zhang, L., Wang, Y., Zhu, P., Rich, D. Q., Diehl, S. R., Huang, W. and Zhang, J. J., 2013. Malondialdehyde in exhaled breath condensate and urine as a biomarker of air pollution induced oxidative stress. J Expo Sci Environ Epidemiol. 23, 322\u2010327. https://doi.org/10.1038/jes.2012.127. Gowdy et al., 2008 K. Gowdy Q.T. Krantz M. Daniels W.P. Linak I. Jaspers M.I. Gilmour Modulation of pulmonary inflammatory responses and antimicrobial defenses in mice exposed to diesel exhaust Toxicol. Appl. Pharmacol. 229 2008 310 319 10.1016/j.taap.2008.01.040 Gowdy, K., Krantz, Q. T., Daniels, M., Linak, W. P., Jaspers, I. and Gilmour, M. I., 2008. Modulation of pulmonary inflammatory responses and antimicrobial defenses in mice exposed to diesel exhaust. Toxicol Appl Pharmacol. 229, 310\u2010319. https://doi.org/10.1016/j.taap.2008.01.040. Greene et al., 2002 K.E. Greene T.E. King Jr. Y. Kuroki B. Bucher-Bartelson G.W. Hunninghake L.S. Newman H. Nagae R.J. Mason Serum surfactant proteins-A and -D as biomarkers in idiopathic pulmonary fibrosis Eur. Respir. J. 19 2002 439 446 10.1183/09031936.02.00081102 Greene, K. E., King, T. E., Jr., Kuroki, Y., Bucher-Bartelson, B., Hunninghake, G. W., Newman, L. S., Nagae, H. and Mason, R. J., 2002. Serum surfactant proteins-A and -D as biomarkers in idiopathic pulmonary fibrosis. Eur Respir J. 19, 439\u2010446. https://doi.org/10.1183/09031936.02.00081102. Guan et al., 2019 L. Guan X. Geng C. Stone E.E.P. Cosky Y. Ji H. Du K. Zhang Q. Sun Y. Ding PM(2.5) exposure induces systemic inflammation and oxidative stress in an intracranial atherosclerosis rat model Environ. Toxicol. 34 2019 530 538 10.1002/tox.22707 Guan, L., Geng, X., Stone, C., Cosky, E. E. P., Ji, Y., Du, H., Zhang, K., Sun, Q. and Ding, Y., 2019. PM(2.5) exposure induces systemic inflammation and oxidative stress in an intracranial atherosclerosis rat model. Environ Toxicol. 34, 530\u2010538. https://doi.org/10.1002/tox.22707. Guerra et al., 2015 S. Guerra M. Halonen M.M. Vasquez A. Spangenberg D.A. Stern W.J. Morgan A.L. Wright I. Lavi L. Tar\u00e8s A.E. Carsin C. Doba\u00f1o E. Barreiro J.P. Zock J. Mart\u00ednez-Moratalla I. Urrutia J. Sunyer D. Keidel M. Imboden N. Probst-Hensch J. Hallberg E. Mel\u00e9n M. Wickman J. Bousquet D.C. Belgrave A. Simpson A. Custovic J.M. Ant\u00f3 F.D. Martinez Relation between circulating CC16 concentrations, lung function, and development of chronic obstructive pulmonary disease across the lifespan: a prospective study Lancet Respir. Med. 3 2015 613 620 10.1016/s2213-2600(15)00196-4 Guerra, S., Halonen, M., Vasquez, M. M., Spangenberg, A., Stern, D. A., Morgan, W. J., Wright, A. L., Lavi, I., Tar\u00e8s, L., Carsin, A. E., Doba\u00f1o, C., Barreiro, E., Zock, J. P., Mart\u00ednez-Moratalla, J., Urrutia, I., Sunyer, J., Keidel, D., Imboden, M., Probst-Hensch, N., Hallberg, J., Mel\u00e9n, E., Wickman, M., Bousquet, J., Belgrave, D. C., Simpson, A., Custovic, A., Ant\u00f3, J. M. and Martinez, F. D., 2015. Relation between circulating CC16 concentrations, lung function, and development of chronic obstructive pulmonary disease across the lifespan: a prospective study. Lancet Respir Med. 3, 613\u2010620. https://doi.org/10.1016/s2213\u20102600(15)00196\u20104. Guo et al., 2020 C. Guo Y. Bo T.C. Chan Z. Zhang C. Lin T. Tam A.K.H. Lau L.Y. Chang G. Hoek X.Q. Lao Does fine particulate matter (PM(2.5)) affect the benefits of habitual physical activity on lung function in adults: a longitudinal cohort study BMC Med. 18 2020 134 10.1186/s12916-020-01570-5 Guo, C., Bo, Y., Chan, T. C., Zhang, Z., Lin, C., Tam, T., Lau, A. K. H., Chang, L. Y., Hoek, G. and Lao, X. Q., 2020. Does fine particulate matter (PM(2.5)) affect the benefits of habitual physical activity on lung function in adults: a longitudinal cohort study. BMC Med. 18, 134. https://doi.org/10.1186/s12916\u2010020\u201001570\u20105. Guo et al., 2019 C. Guo G. Hoek L.Y. Chang Y. Bo C. Lin B. Huang T.C. Chan T. Tam A.K.H. Lau X.Q. Lao Long-term exposure to ambient fine particulate matter (PM2.5) and lung function in children, adolescents, and young adults: a longitudinal cohort study Environ. Health Perspect. 127 2019 127008 10.1289/ehp5220 Guo, C., Hoek, G., Chang, L. Y., Bo, Y., Lin, C., Huang, B., Chan, T. C., Tam, T., Lau, A. K. H. and Lao, X. Q., 2019. Long-Term Exposure to Ambient Fine Particulate Matter (PM2.5) and Lung Function in Children, Adolescents, and Young Adults: A Longitudinal Cohort Study. Environ Health Perspect. 127, 127008. https://doi.org/10.1289/ehp5220. Guo et al., 2021 C. Guo Y. Liu Y. Li Adverse effects of amorphous silica nanoparticles: focus on human cardiovascular health J. Hazard. Mater. 406 2021 124626 10.1016/j.jhazmat.2020.124626 Guo, C., Liu, Y. and Li, Y., 2021. Adverse effects of amorphous silica nanoparticles: Focus on human cardiovascular health. J Hazard Mater. 406, 124626. https://doi.org/10.1016/j.jhazmat.2020.124626. Guo et al., 2015 C. Guo Y. Xia P. Niu L. Jiang J. Duan Y. Yu X. Zhou Y. Li Z. Sun Silica nanoparticles induce oxidative stress, inflammation, and endothelial dysfunction in vitro via activation of the MAPK/Nrf2 pathway and nuclear factor-\u03baB signaling Int. J. Nanomed. 10 2015 1463 1477 10.2147/ijn.S76114 Guo, C., Xia, Y., Niu, P., Jiang, L., Duan, J., Yu, Y., Zhou, X., Li, Y. and Sun, Z., 2015. Silica nanoparticles induce oxidative stress, inflammation, and endothelial dysfunction in vitro via activation of the MAPK/Nrf2 pathway and nuclear factor-\u03baB signaling. Int J Nanomedicine. 10, 1463\u20101477. https://doi.org/10.2147/ijn.S76114. Guo et al., 2016 C. Guo M. Yang L. Jing J. Wang Y. Yu Y. Li J. Duan X. Zhou Y. Li Z. Sun Amorphous silica nanoparticles trigger vascular endothelial cell injury through apoptosis and autophagy via reactive oxygen species-mediated MAPK/Bcl-2 and PI3K/Akt/mTOR signaling Int. J. Nanomed. 11 2016 5257 5276 10.2147/ijn.S112030 Guo, C., Yang, M., Jing, L., Wang, J., Yu, Y., Li, Y., Duan, J., Zhou, X., Li, Y. and Sun, Z., 2016. Amorphous silica nanoparticles trigger vascular endothelial cell injury through apoptosis and autophagy via reactive oxygen species-mediated MAPK/Bcl-2 and PI3K/Akt/mTOR signaling. Int J Nanomedicine. 11, 5257\u20105276. https://doi.org/10.2147/ijn.S112030. Guo et al., 2018 C. Guo Z. Zhang A.K.H. Lau C.Q. Lin Y.C. Chuang J. Chan W.K. Jiang T. Tam E.K. Yeoh T.C. Chan L.Y. Chang X.Q. Lao Effect of long-term exposure to fine particulate matter on lung function decline and risk of chronic obstructive pulmonary disease in Taiwan: a longitudinal, cohort study Lancet Planet Health 2 2018 e114 e125 10.1016/s2542-5196(18)30028-7 Guo, C., Zhang, Z., Lau, A. K. H., Lin, C. Q., Chuang, Y. C., Chan, J., Jiang, W. K., Tam, T., Yeoh, E. K., Chan, T. C., Chang, L. Y. and Lao, X. Q., 2018. Effect of long-term exposure to fine particulate matter on lung function decline and risk of chronic obstructive pulmonary disease in Taiwan: a longitudinal, cohort study. Lancet Planet Health. 2, e114-e125. https://doi.org/10.1016/s2542\u20105196(18)30028\u20107. Gurgueira et al., 2002 S.A. Gurgueira J. Lawrence B. Coull G.G. Murthy B. Gonz\u00e1lez-Flecha Rapid increases in the steady-state concentration of reactive oxygen species in the lungs and heart after particulate air pollution inhalation Environ. Health Perspect. 110 2002 749 755 10.1289/ehp.02110749 Gurgueira, S. A., Lawrence, J., Coull, B., Murthy, G. G. and Gonz\u00e1lez-Flecha, B., 2002. Rapid increases in the steady-state concentration of reactive oxygen species in the lungs and heart after particulate air pollution inhalation. Environ Health Perspect. 110, 749\u2010755. https://doi.org/10.1289/ehp.02110749. Habre et al., 2014 R. Habre B. Coull E. Moshier J. Godbold A. Grunin A. Nath W. Castro N. Schachter A. Rohr M. Kattan J. Spengler P. Koutrakis Sources of indoor air pollution in New York City residences of asthmatic children J. Expo. Sci. Environ. Epidemiol. 24 2014 269 278 10.1038/jes.2013.74 Habre, R., Coull, B., Moshier, E., Godbold, J., Grunin, A., Nath, A., Castro, W., Schachter, N., Rohr, A., Kattan, M., Spengler, J. and Koutrakis, P., 2014. Sources of indoor air pollution in New York City residences of asthmatic children. J Expo Sci Environ Epidemiol. 24, 269\u2010278. https://doi.org/10.1038/jes.2013.74. Hajat et al., 2015 A. Hajat M. Allison A.V. Diez-Roux N.S. Jenny N.W. Jorgensen A.A. Szpiro S. Vedal J.D. Kaufman Long-term exposure to air pollution and markers of inflammation, coagulation, and endothelial activation: a repeat-measures analysis in the Multi-Ethnic Study of Atherosclerosis (MESA) Epidemiology 26 2015 310 320 10.1097/ede.0000000000000267 Hajat, A., Allison, M., Diez-Roux, A. V., Jenny, N. S., Jorgensen, N. W., Szpiro, A. A., Vedal, S. and Kaufman, J. D., 2015. Long-term exposure to air pollution and markers of inflammation, coagulation, and endothelial activation: a repeat-measures analysis in the Multi-Ethnic Study of Atherosclerosis (MESA). Epidemiology. 26, 310\u2010320. https://doi.org/10.1097/ede.0000000000000267. Health Effects Institute, 2020 Health Effects Institute. 2020, State of Global Air 2020. Speical report.Boston, MA. Retrieved from: \u3008https://www.stateofglobalair.org/\u3009. He et al., 2020 L. He X. Cui Q. Xia F. Li J. Mo J. Gong Y. Zhang J.J. Zhang Effects of personal air pollutant exposure on oxidative stress: potential confounding by natural variation in melatonin levels Int J. Hyg. Environ. Health 223 2020 116 123 10.1016/j.ijheh.2019.09.012 He, L., Cui, X., Xia, Q., Li, F., Mo, J., Gong, J., Zhang, Y. and Zhang, J. J., 2020. Effects of personal air pollutant exposure on oxidative stress: Potential confounding by natural variation in melatonin levels. Int J Hyg Environ Health. 223, 116\u2010123. https://doi.org/10.1016/j.ijheh.2019.09.012. He et al., 2015 M. He T. Ichinose Y. Ren Y. Song Y. Yoshida K. Arashidani S. Yoshida M. Nishikawa H. Takano G. Sun PM2.5-rich dust collected from the air in Fukuoka, Kyushu, Japan, can exacerbate murine lung eosinophilia Inhal. Toxicol. 27 2015 287 299 10.3109/08958378.2015.1045051 He, M., Ichinose, T., Ren, Y., Song, Y., Yoshida, Y., Arashidani, K., Yoshida, S., Nishikawa, M., Takano, H. and Sun, G., 2015. PM2.5-rich dust collected from the air in Fukuoka, Kyushu, Japan, can exacerbate murine lung eosinophilia. Inhalation Toxicology. 27, 287\u2010299. https://doi.org/10.3109/08958378.2015.1045051. He et al., 2017 M. He T. Ichinose S. Yoshida T. Ito C. He Y. Yoshida K. Arashidani H. Takano G. Sun T. Shibamoto PM2.5-induced lung inflammation in mice: Differences of inflammatory response in macrophages and type II alveolar cells J. Appl. Toxicol. 37 2017 1203 1218 10.1002/jat.3482 He, M., Ichinose, T., Yoshida, S., Ito, T., He, C., Yoshida, Y., Arashidani, K., Takano, H., Sun, G. and Shibamoto, T., 2017. PM2.5-induced lung inflammation in mice: Differences of inflammatory response in macrophages and type II alveolar cells. J Appl Toxicol. 37, 1203\u20101218. https://doi.org/10.1002/jat.3482. Hemmingsen et al., 2015 J.G. Hemmingsen K. Jantzen P. M\u00f8ller S. Loft No oxidative stress or DNA damage in peripheral blood mononuclear cells after exposure to particles from urban street air in overweight elderly Mutagenesis 30 2015 635 642 10.1093/mutage/gev027 Hemmingsen, J. G., Jantzen, K., M\u00f8ller, P. and Loft, S., 2015. No oxidative stress or DNA damage in peripheral blood mononuclear cells after exposure to particles from urban street air in overweight elderly. Mutagenesis. 30, 635\u2010642. https://doi.org/10.1093/mutage/gev027. Hosseini et al., 2016 A. Hosseini J.A. Hirota T.L. Hackett K.M. McNagny S.J. Wilson C. Carlsten Morphometric analysis of inflammation in bronchial biopsies following exposure to inhaled diesel exhaust and allergen challenge in atopic subjects Part Fibre Toxicol. 13 2016 2 10.1186/s12989-016-0114-z Hosseini, A., Hirota, J. A., Hackett, T. L., McNagny, K. M., Wilson, S. J. and Carlsten, C., 2016. Morphometric analysis of inflammation in bronchial biopsies following exposure to inhaled diesel exhaust and allergen challenge in atopic subjects. Part Fibre Toxicol. 13, 2. https://doi.org/10.1186/s12989\u2010016\u20100114\u2010z. Huang et al., 2012a H.B. Huang C.H. Lai G.W. Chen Y.Y. Lin J.J. Jaakkola S.H. Liou S.L. Wang Traffic-related air pollution and DNA damage: a longitudinal study in Taiwanese traffic conductors PLoS One 7 2012 e37412 10.1371/journal.pone.0037412 Huang, H. B., Lai, C. H., Chen, G. W., Lin, Y. Y., Jaakkola, J. J., Liou, S. H. and Wang, S. L., 2012a. Traffic-related air pollution and DNA damage: a longitudinal study in Taiwanese traffic conductors. PLoS One. 7, e37412. https://doi.org/10.1371/journal.pone.0037412. Huang et al., 2018 Q. Huang D. Hu X. Wang Y. Chen Y. Wu L. Pan H. Li J. Zhang F. Deng X. Guo H. Shen The modification of indoor PM2.5 exposure to chronic obstructive pulmonary disease in Chinese elderly people: a meet-in-metabolite analysis Environ. Int. 121 2018 1243 1252 10.1016/j.envint.2018.10.046 Huang, Q., Hu, D., Wang, X., Chen, Y., Wu, Y., Pan, L., Li, H., Zhang, J., Deng, F., Guo, X. and Shen, H., 2018. The modification of indoor PM2.5 exposure to chronic obstructive pulmonary disease in Chinese elderly people: A meet-in-metabolite analysis. Environment International. 121, 1243\u20101252. https://doi.org/10.1016/j.envint.2018.10.046. Huang et al., 2012b W. Huang G. Wang S.E. Lu H. Kipen Y. Wang M. Hu W. Lin D. Rich P. Ohman-Strickland S.R. Diehl P. Zhu J. Tong J. Gong T. Zhu J. Zhang Inflammatory and oxidative stress responses of healthy young adults to changes in air quality during the Beijing Olympics Am. J. Respir. Crit. Care Med. 186 2012 1150 1159 10.1164/rccm.201205-0850OC Huang, W., Wang, G., Lu, S. E., Kipen, H., Wang, Y., Hu, M., Lin, W., Rich, D., Ohman-Strickland, P., Diehl, S. R., Zhu, P., Tong, J., Gong, J., Zhu, T. and Zhang, J., 2012b. Inflammatory and oxidative stress responses of healthy young adults to changes in air quality during the Beijing Olympics. Am J Respir Crit Care Med. 186, 1150\u20101159. https://doi.org/10.1164/rccm.201205\u20100850OC. Huang et al., 2019 Y. Huang M. Bao J. Xiao Z. Qiu K. Wu Effects of PM(2.5) on cardio-pulmonary function injury in open manganese mine workers Int. J. Environ. Res. Public Health 2019 16 10.3390/ijerph16112017 Huang, Y., Bao, M., Xiao, J., Qiu, Z. and Wu, K., 2019. Effects of PM(2.5) on Cardio-Pulmonary Function Injury in Open Manganese Mine Workers. Int J Environ Res Public Health. 16. https://doi.org/10.3390/ijerph16112017. Institute for Health Metrics and Evaluation, 2017 Institute for Health Metrics and Evaluation (IHME), 2017, GBD Compare Data Visualization. Seattle, WA: IHME, University of Washington. Available from: \u3008https://vizhub.healthdata.org/gbd-compare/\u3009. Isiugo et al., 2019 K. Isiugo R. Jandarov J. Cox P. Ryan N. Newman S.A. Grinshpun R. Indugula S. Vesper T. Reponen Indoor particulate matter and lung function in children Sci. Total Environ. 663 2019 408 417 10.1016/j.scitotenv.2019.01.309 Isiugo, K., Jandarov, R., Cox, J., Ryan, P., Newman, N., Grinshpun, S. A., Indugula, R., Vesper, S. and Reponen, T., 2019. Indoor particulate matter and lung function in children. Science of The Total Environment. 663, 408\u2010417. https://doi.org/10.1016/j.scitotenv.2019.01.309. Ito et al., 2005 K. Ito M. Ito W.M. Elliott B. Cosio G. Caramori O.M. Kon A. Barczyk S. Hayashi I.M. Adcock J.C. Hogg P.J. Barnes Decreased histone deacetylase activity in chronic obstructive pulmonary disease N. Engl. J. Med. 352 2005 1967 1976 10.1056/NEJMoa041892 Ito, K., Ito, M., Elliott, W. M., Cosio, B., Caramori, G., Kon, O. M., Barczyk, A., Hayashi, S., Adcock, I. M., Hogg, J. C. and Barnes, P. J., 2005. Decreased histone deacetylase activity in chronic obstructive pulmonary disease. N Engl J Med. 352, 1967\u20101976. https://doi.org/10.1056/NEJMoa041892. Ito et al., 2002 K. Ito S. Lim G. Caramori B. Cosio K.F. Chung I.M. Adcock P.J. Barnes A molecular mechanism of action of theophylline: Induction of histone deacetylase activity to decrease inflammatory gene expression Proc. Natl. Acad. Sci. U. S. A. 99 2002 8921 8926 10.1073/pnas.132556899 Ito, K., Lim, S., Caramori, G., Cosio, B., Chung, K. F., Adcock, I. M. and Barnes, P. J., 2002. A molecular mechanism of action of theophylline: Induction of histone deacetylase activity to decrease inflammatory gene expression. Proc Natl Acad Sci U S A. 99, 8921\u20108926. https://doi.org/10.1073/pnas.132556899. Jaafari et al., 2021 J. Jaafari K. Naddafi M. Yunesian R. Nabizadeh M.S. Hassanvand M. Shamsipour M. Ghanbari Ghozikali S. Nazmara H.R. Shamsollahi K. Yaghmaeian Associations between short term exposure to ambient particulate matter from dust storm and anthropogenic sources and inflammatory biomarkers in healthy young adults Sci. Total Environ. 761 2021 144503 10.1016/j.scitotenv.2020.144503 Jaafari, J., Naddafi, K., Yunesian, M., Nabizadeh, R., Hassanvand, M. S., Shamsipour, M., Ghanbari Ghozikali, M., Nazmara, S., Shamsollahi, H. R. and Yaghmaeian, K., 2021. Associations between short term exposure to ambient particulate matter from dust storm and anthropogenic sources and inflammatory biomarkers in healthy young adults. The Science of the total environment. 761, 144503. https://doi.org/10.1016/j.scitotenv.2020.144503. Jaafari et al., 2020 J. Jaafari K. Naddafi M. Yunesian R. Nabizadeh M.S. Hassanvand M. Shamsipour M.G. Ghozikali H.R. Shamsollahi S. Nazmara K. Yaghmaeian The acute effects of short term exposure to particulate matter from natural and anthropogenic sources on inflammation and coagulation markers in healthy young adults Sci. Total Environ. 735 2020 139417 10.1016/j.scitotenv.2020.139417 Jaafari, J., Naddafi, K., Yunesian, M., Nabizadeh, R., Hassanvand, M. S., Shamsipour, M., Ghozikali, M. G., Shamsollahi, H. R., Nazmara, S. and Yaghmaeian, K., 2020. The acute effects of short term exposure to particulate matter from natural and anthropogenic sources on inflammation and coagulation markers in healthy young adults. The Science of the total environment. 735, 139417. https://doi.org/10.1016/j.scitotenv.2020.139417. Jacquemin et al., 2009 B. Jacquemin T. Lanki T. Yli-Tuomi M. Vallius G. Hoek J. Heinrich K. Timonen J. Pekkanen Source category-specific PM2.5 and urinary levels of Clara cell protein CC16. The ULTRA study Inhal. Toxicol. 21 2009 1068 1076 10.3109/08958370902725292 Jacquemin, B., Lanki, T., Yli-Tuomi, T., Vallius, M., Hoek, G., Heinrich, J., Timonen, K. and Pekkanen, J., 2009. Source category-specific PM2.5 and urinary levels of Clara cell protein CC16. The ULTRA study. Inhal Toxicol. 21, 1068\u20101076. https://doi.org/10.3109/08958370902725292. Janssen et al., 2015 N.A.H. Janssen M. Strak A. Yang B. Hellack F.J. Kelly T.A.J. Kuhlbusch R.M. Harrison B. Brunekreef F.R. Cassee M. Steenhof G. Hoek Associations between three specific a-cellular measures of the oxidative potential of particulate matter and markers of acute airway and nasal inflammation in healthy volunteers Occup. Environ. Med. 72 2015 49 10.1136/oemed-2014-102303 Janssen, N. A. H., Strak, M., Yang, A., Hellack, B., Kelly, F. J., Kuhlbusch, T. A. J., Harrison, R. M., Brunekreef, B., Cassee, F. R., Steenhof, M. and Hoek, G., 2015. Associations between three specific a-cellular measures of the oxidative potential of particulate matter and markers of acute airway and nasal inflammation in healthy volunteers. Occupational and Environmental Medicine. 72, 49. https://doi.org/10.1136/oemed\u20102014\u2010102303. Jardim et al., 2009 M.J. Jardim R.C. Fry I. Jaspers L. Dailey D. Diaz-Sanchez Disruption of microRNA expression in human airway cells by diesel exhaust particles is linked to tumorigenesis-associated pathways Environ. Health Perspect. 117 2009 1745 1751 10.1289/ehp.0900756 Jardim, M. J., Fry, R. C., Jaspers, I., Dailey, L. and Diaz-Sanchez, D., 2009. Disruption of microRNA expression in human airway cells by diesel exhaust particles is linked to tumorigenesis-associated pathways. Environ Health Perspect. 117, 1745\u20101751. https://doi.org/10.1289/ehp.0900756. Ji et al., 2019 X. Ji H. Yue T. Ku Y. Zhang Y. Yun G. Li N. Sang Histone modification in the lung injury and recovery of mice in response to PM(2.5) exposure Chemosphere 220 2019 127 136 10.1016/j.chemosphere.2018.12.079 Ji, X., Yue, H., Ku, T., Zhang, Y., Yun, Y., Li, G. and Sang, N., 2019. Histone modification in the lung injury and recovery of mice in response to PM(2.5) exposure. Chemosphere. 220, 127\u2010136. https://doi.org/10.1016/j.chemosphere.2018.12.079. Jin et al., 2019 L. Jin J. Xie C.K.C. Wong S.K.Y. Chan G. Abbaszade J. Schnelle-Kreis R. Zimmermann J. Li G. Zhang P. Fu X. Li Contributions of city-specific fine particulate matter (PM2.5) to differential in vitro oxidative stress and toxicity implications between Beijing and Guangzhou of China Environ. Sci. Technol. 53 2019 2881 2891 10.1021/acs.est.9b00449 Jin, L., Xie, J., Wong, C. K. C., Chan, S. K. Y., Abbaszade, G., Schnelle-Kreis, J., Zimmermann, R., Li, J., Zhang, G., Fu, P. and Li, X., 2019. Contributions of City-Specific Fine Particulate Matter (PM(2.5)) to Differential In Vitro Oxidative Stress and Toxicity Implications between Beijing and Guangzhou of China. Environ Sci Technol. 53, 2881\u20102891. https://doi.org/10.1021/acs.est.9b00449. Jin et al., 2017 Y. Jin W. Wu W. Zhang Y. Zhao Y. Wu G. Ge Y. Ba Q. Guo T. Gao X. Chi H. Hao J. Wang F. Feng Involvement of EGF receptor signaling and NLRP12 inflammasome in fine particulate matter-induced lung inflammation in mice Environ. Toxicol. 32 2017 1121 1134 10.1002/tox.22308 Jin, Y., Wu, W., Zhang, W., Zhao, Y., Wu, Y., Ge, G., Ba, Y., Guo, Q., Gao, T., Chi, X., Hao, H., Wang, J. and Feng, F., 2017. Involvement of EGF receptor signaling and NLRP12 inflammasome in fine particulate matter-induced lung inflammation in mice. Environmental Toxicology. 32, 1121\u20101134. https://doi.org/10.1002/tox.22308. Jobling et al., 2006 M.F. Jobling J.D. Mott M.T. Finnegan V. Jurukovski A.C. Erickson P.J. Walian S.E. Taylor S. Ledbetter C.M. Lawrence D.B. Rifkin M.H. Barcellos-Hoff Isoform-specific activation of latent transforming growth factor beta (LTGF-beta) by reactive oxygen species Radiat. Res. 166 2006 839 848 10.1667/rr0695.1 Jobling, M. F., Mott, J. D., Finnegan, M. T., Jurukovski, V., Erickson, A. C., Walian, P. J., Taylor, S. E., Ledbetter, S., Lawrence, C. M., Rifkin, D. B. and Barcellos-Hoff, M. H., 2006. Isoform-specific activation of latent transforming growth factor beta (LTGF-beta) by reactive oxygen species. Radiat Res. 166, 839\u2010848. https://doi.org/10.1667/rr0695.1. Johansson et al., 2009 S. Johansson K. Andersson G. Wennergren C. Wenner\u00e5s A. Rudin CC16 inhibits the migration of eosinophils towards the formyl peptide fMLF but not towards PGD2 Inflammation 32 2009 65 69 10.1007/s10753-008-9103-1 Johansson, S., Andersson, K., Wennergren, G., Wenner\u00e5s, C. and Rudin, A., 2009. CC16 inhibits the migration of eosinophils towards the formyl peptide fMLF but not towards PGD2. Inflammation. 32, 65\u201069. https://doi.org/10.1007/s10753\u2010008\u20109103\u20101. Jung et al., 2017 K.H. Jung D. Torrone S. Lovinsky-Desir M. Perzanowski J. Bautista J.R. Jezioro L. Hoepner J. Ross F.P. Perera S.N. Chillrud R.L. Miller Short-term exposure to PM(2.5) and vanadium and changes in asthma gene DNA methylation and lung function decrements among urban children Respir. Res 18 2017 63 10.1186/s12931-017-0550-9 Jung, K. H., Torrone, D., Lovinsky-Desir, S., Perzanowski, M., Bautista, J., Jezioro, J. R., Hoepner, L., Ross, J., Perera, F. P., Chillrud, S. N. and Miller, R. L., 2017. Short-term exposure to PM(2.5) and vanadium and changes in asthma gene DNA methylation and lung function decrements among urban children. Respir Res. 18, 63\u201063. https://doi.org/10.1186/s12931\u2010017\u20100550\u20109. Ke et al., 2006 Q. Ke T. Davidson H. Chen T. Kluz M. Costa Alterations of histone modifications and transgene silencing by nickel chloride Carcinogenesis 27 2006 1481 1488 10.1093/carcin/bgl004 Ke, Q., Davidson, T., Chen, H., Kluz, T. and Costa, M., 2006. Alterations of histone modifications and transgene silencing by nickel chloride. Carcinogenesis. 27, 1481\u20101488. https://doi.org/10.1093/carcin/bgl004. Kile et al., 2013 M.L. Kile S. Fang A.A. Baccarelli L. Tarantini J. Cavallari D.C. Christiani A panel study of occupational exposure to fine particulate matter and changes in DNA methylation over a single workday and years worked in boilermaker welders Environ. Health 12 2013 47 10.1186/1476-069x-12-47 Kile, M. L., Fang, S., Baccarelli, A. A., Tarantini, L., Cavallari, J. and Christiani, D. C., 2013. A panel study of occupational exposure to fine particulate matter and changes in DNA methylation over a single workday and years worked in boilermaker welders. Environ Health. 12, 47. https://doi.org/10.1186/1476\u2010069x\u201012\u201047. Kim et al., 2017 H.J. Kim J.H. Park J.Y. Min K.B. Min Y.S. Seo J.M. Yun H. Kwon J.I. Kim B. Cho Abdominal adiposity intensifies the negative effects of ambient air pollution on lung function in Korean men Int J. Obes. (Lond.) 41 2017 1218 1223 10.1038/ijo.2017.97 Kim, H. J., Park, J. H., Min, J. Y., Min, K. B., Seo, Y. S., Yun, J. M., Kwon, H., Kim, J. I. and Cho, B., 2017. Abdominal adiposity intensifies the negative effects of ambient air pollution on lung function in Korean men. Int J Obes (Lond). 41, 1218\u20101223. https://doi.org/10.1038/ijo.2017.97. Kim et al., 2020 J.S. Kim J.M. Oh H. Choi S.W. Kim S.W. Kim B.G. Kim J.H. Cho J. Lee D.C. Lee Activation of the Nrf2/HO-1 pathway by curcumin inhibits oxidative stress in human nasal fibroblasts exposed to urban particulate matter BMC Complement Med Ther. 20 2020 101 10.1186/s12906-020-02886-8 Kim, J. S., Oh, J. M., Choi, H., Kim, S. W., Kim, S. W., Kim, B. G., Cho, J. H., Lee, J. and Lee, D. C., 2020. Activation of the Nrf2/HO-1 pathway by curcumin inhibits oxidative stress in human nasal fibroblasts exposed to urban particulate matter. BMC Complement Med Ther. 20, 101. https://doi.org/10.1186/s12906\u2010020\u201002886\u20108. Kim et al., 2004 J.Y. Kim S. Mukherjee L.C. Ngo D.C. Christiani Urinary 8-hydroxy-2\u2032-deoxyguanosine as a biomarker of oxidative DNA damage in workers exposed to fine particulates Environ. Health Perspect. 112 2004 666 671 10.1289/ehp.6827 Kim, J. Y., Mukherjee, S., Ngo, L. C. and Christiani, D. C., 2004. Urinary 8\u2010hydroxy\u20102'\u2010deoxyguanosine as a biomarker of oxidative DNA damage in workers exposed to fine particulates. Environ Health Perspect. 112, 666\u2010671. https://doi.org/10.1289/ehp.6827. Kloypan et al., 2015 C. Kloypan M. Srisa-art A. Mutirangura C. Boonla LINE-1 hypomethylation induced by reactive oxygen species is mediated via depletion of S-adenosylmethionine Cell Biochem Funct. 33 2015 375 385 10.1002/cbf.3124 Kloypan, C., Srisa-art, M., Mutirangura, A. and Boonla, C., 2015. LINE-1 hypomethylation induced by reactive oxygen species is mediated via depletion of S-adenosylmethionine. Cell Biochem Funct. 33, 375\u2010385. https://doi.org/10.1002/cbf.3124. Kostikas et al., 2013 K. Kostikas M. Minas E. Nikolaou A.I. Papaioannou P. Liakos S. Gougoura K.I. Gourgoulianis P.C. Dinas G.S. Metsios A.Z. Jamurtas A.D. Flouris Y. Koutedakis Secondhand smoke exposure induces acutely airway acidification and oxidative stress Respir. Med. 107 2013 172 179 10.1016/j.rmed.2012.10.017 Kostikas, K., Minas, M., Nikolaou, E., Papaioannou, A. I., Liakos, P., Gougoura, S., Gourgoulianis, K. I., Dinas, P. C., Metsios, G. S., Jamurtas, A. Z., Flouris, A. D. and Koutedakis, Y., 2013. Secondhand smoke exposure induces acutely airway acidification and oxidative stress. Respiratory medicine. 107, 172\u2010179. https://doi.org/10.1016/j.rmed.2012.10.017. Krauskopf et al., 2018 J. Krauskopf F. Caiment K. van Veldhoven M. Chadeau-Hyam R. Sinharay K.F. Chung P. Cullinan P. Collins B. Barratt F.J. Kelly R. Vermeulen P. Vineis T.M. de Kok J.C. Kleinjans The human circulating miRNome reflects multiple organ disease risks in association with short-term exposure to traffic-related air pollution Environ. Int. 113 2018 26 34 10.1016/j.envint.2018.01.014 Krauskopf, J., Caiment, F., van Veldhoven, K., Chadeau-Hyam, M., Sinharay, R., Chung, K. F., Cullinan, P., Collins, P., Barratt, B., Kelly, F. J., Vermeulen, R., Vineis, P., de Kok, T. M. and Kleinjans, J. C., 2018. The human circulating miRNome reflects multiple organ disease risks in association with short-term exposure to traffic-related air pollution. Environment International. 113, 26\u201034. https://doi.org/10.1016/j.envint.2018.01.014. Kuroki et al., 1993 Y. Kuroki S. Tsutahara N. Shijubo H. Takahashi M. Shiratori A. Hattori Y. Honda S. Abe T. Akino Elevated levels of lung surfactant protein A in sera from patients with idiopathic pulmonary fibrosis and pulmonary alveolar proteinosis Am. Rev. Respir. Dis. 147 1993 723 729 10.1164/ajrccm/147.3.723 Kuroki, Y., Tsutahara, S., Shijubo, N., Takahashi, H., Shiratori, M., Hattori, A., Honda, Y., Abe, S. and Akino, T., 1993. Elevated levels of lung surfactant protein A in sera from patients with idiopathic pulmonary fibrosis and pulmonary alveolar proteinosis. Am Rev Respir Dis. 147, 723\u2010729. https://doi.org/10.1164/ajrccm/147.3.723. Kwong et al., 2007 J. Kwong L.S. Chow A.Y. Wong W.K. Hung G.T. Chung K.F. To F.L. Chan Y. Daigo Y. Nakamura D.P. Huang K.W. Lo Epigenetic inactivation of the deleted in lung and esophageal cancer 1 gene in nasopharyngeal carcinoma Genes Chromosomes Cancer 46 2007 171 180 10.1002/gcc.20398 Kwong, J., Chow, L. S., Wong, A. Y., Hung, W. K., Chung, G. T., To, K. F., Chan, F. L., Daigo, Y., Nakamura, Y., Huang, D. P. and Lo, K. W., 2007. Epigenetic inactivation of the deleted in lung and esophageal cancer 1 gene in nasopharyngeal carcinoma. Genes Chromosomes Cancer. 46, 171\u2010180. https://doi.org/10.1002/gcc.20398. Ladd-Acosta and Fallin, 2015 C. Ladd-Acosta M.D. Fallin The role of epigenetics in genetic and environmental epidemiology Epigenomics 8 2015 271 283 10.2217/epi.15.102 Ladd-Acosta, C. and Fallin, M. D., 2015. The role of epigenetics in genetic and environmental epidemiology. Epigenomics. 8, 271\u2010283. https://doi.org/10.2217/epi.15.102. Lai et al., 2016 C.Y. Lai C.H. Lai H.C. Chuang C.H. Pan C.C. Yen W.Y. Lin J.K. Chen L.Y. Lin K.J. Chuang Physicochemistry and cardiovascular toxicity of metal fume PM2.5: a study of human coronary artery endothelial cells and welding workers Sci. Rep. 6 2016 33515 10.1038/srep33515 Lai, C. Y., Lai, C. H., Chuang, H. C., Pan, C. H., Yen, C. C., Lin, W. Y., Chen, J. K., Lin, L. Y. and Chuang, K. J., 2016. Physicochemistry and cardiovascular toxicity of metal fume PM2.5: a study of human coronary artery endothelial cells and welding workers. Scientific reports. 6, 33515. https://doi.org/10.1038/srep33515. Lamadema et al., 2019 N. Lamadema S. Burr A.C. Brewer Dynamic regulation of epigenetic demethylation by oxygen availability and cellular redox Free Radic. Biol. Med. 131 2019 282 298 10.1016/j.freeradbiomed.2018.12.009 Lamadema, N., Burr, S. and Brewer, A. C., 2019. Dynamic regulation of epigenetic demethylation by oxygen availability and cellular redox. Free radical biology & medicine. 131, 282\u2010298. https://doi.org/10.1016/j.freeradbiomed.2018.12.009. Lamouille et al., 2014 S. Lamouille J. Xu R. Derynck Molecular mechanisms of epithelial-mesenchymal transition Nat. Rev. Mol. Cell Biol. 15 2014 178 196 10.1038/nrm3758 Lamouille, S., Xu, J. and Derynck, R., 2014. Molecular mechanisms of epithelial-mesenchymal transition. Nature reviews. Molecular cell biology. 15, 178\u2010196. https://doi.org/10.1038/nrm3758. Leclercq et al., 2017 B. Leclercq A. Platel S. Antherieu L.Y. Alleman E.M. Hardy E. Perdrix N. Grova V. Riffault B.M. Appenzeller M. Happillon F. Nesslany P. Coddeville J.M. Lo-Guidice G. Gar\u00e7on Genetic and epigenetic alterations in normal and sensitive COPD-diseased human bronchial epithelial cells repeatedly exposed to air pollution-derived PM(2.5) Environ. Pollut. 230 2017 163 177 10.1016/j.envpol.2017.06.028 Leclercq, B., Platel, A., Antherieu, S., Alleman, L. Y., Hardy, E. M., Perdrix, E., Grova, N., Riffault, V., Appenzeller, B. M., Happillon, M., Nesslany, F., Coddeville, P., Lo-Guidice, J. M. and Gar\u00e7on, G., 2017. Genetic and epigenetic alterations in normal and sensitive COPD-diseased human bronchial epithelial cells repeatedly exposed to air pollution-derived PM(2.5). Environ Pollut. 230, 163\u2010177. https://doi.org/10.1016/j.envpol.2017.06.028. Lee et al., 2001 C.G. Lee R.J. Homer Z. Zhu S. Lanone X. Wang V. Koteliansky J.M. Shipley P. Gotwals P. Noble Q. Chen R.M. Senior J.A. Elias Interleukin-13 induces tissue fibrosis by selectively stimulating and activating transforming growth factor beta(1) J. Exp. Med. 194 2001 809 821 10.1084/jem.194.6.809 Lee, C. G., Homer, R. J., Zhu, Z., Lanone, S., Wang, X., Koteliansky, V., Shipley, J. M., Gotwals, P., Noble, P., Chen, Q., Senior, R. M. and Elias, J. A., 2001. Interleukin-13 induces tissue fibrosis by selectively stimulating and activating transforming growth factor beta(1). The Journal of experimental medicine. 194, 809\u2010821. https://doi.org/10.1084/jem.194.6.809. Lee et al., 2010 M.-W. Lee M.-L. Chen S.-C.C. Lung C.-J. Tsai X.-J. Yin I.F. Mao Exposure assessment of PM2.5 and urinary 8-OHdG for diesel exhaust emission inspector Sci. Total Environ. 408 2010 505 510 10.1016/j.scitotenv.2009.10.012 Lee, M.-W., Chen, M.-L., Lung, S.-C. C., Tsai, C.-J., Yin, X.-J. and Mao, I. F., 2010. Exposure assessment of PM2.5 and urinary 8-OHdG for diesel exhaust emission inspector. Science of The Total Environment. 408, 505\u2010510. https://doi.org/10.1016/j.scitotenv.2009.10.012. Lei et al., 2005 Y.C. Lei J.S. Hwang C.C. Chan C.T. Lee T.J. Cheng Enhanced oxidative stress and endothelial dysfunction in streptozotocin-diabetic rats exposed to fine particles Environ. Res. 99 2005 335 343 10.1016/j.envres.2005.03.011 Lei, Y. C., Hwang, J. S., Chan, C. C., Lee, C. T. and Cheng, T. J., 2005. Enhanced oxidative stress and endothelial dysfunction in streptozotocin-diabetic rats exposed to fine particles. Environ Res. 99, 335\u2010343. https://doi.org/10.1016/j.envres.2005.03.011. Leite et al., 2018 M.R. Leite D.M.T. Zanetta L. Antonangelo L.J. Mar\u00e7al D. Ramos E. Almeida Burdmann U. Paula Santos Burnt sugarcane harvesting work: effects on pulmonary and systemic inflammatory markers Inhal. Toxicol. 30 2018 205 212 10.1080/08958378.2018.1494765 Leite, M. R., Zanetta, D. M. T., Antonangelo, L., Mar\u00e7al, L. J., Ramos, D., Almeida Burdmann, E. and Paula Santos, U., 2018. Burnt sugarcane harvesting work: effects on pulmonary and systemic inflammatory markers. Inhalation Toxicology. 30, 205\u2010212. https://doi.org/10.1080/08958378.2018.1494765. Leon-Kabamba et al., 2018 N. Leon-Kabamba N.R. Ngatu S.J. Kakoma C. Nyembo E.P. Mbelambela R.J. Moribe S. Wembonyama B. Danuser N. Oscar-Luboya Respiratory health of dust-exposed Congolese coltan miners Int. Arch. Occup. Environ. Health 91 2018 859 864 10.1007/s00420-018-1329-0 Leon-Kabamba, N., Ngatu, N. R., Kakoma, S. J., Nyembo, C., Mbelambela, E. P., Moribe, R. J., Wembonyama, S., Danuser, B. and Oscar-Luboya, N., 2018. Respiratory health of dust-exposed Congolese coltan miners. International archives of occupational and environmental health. 91, 859\u2010864. https://doi.org/10.1007/s00420\u2010018\u20101329\u20100. Lepeule et al., 2012 J. Lepeule A. Baccarelli V. Motta L. Cantone A.A. Litonjua D. Sparrow P.S. Vokonas J. Schwartz Gene promoter methylation is associated with lung function in the elderly: the Normative Aging Study Epigenetics 7 2012 261 269 10.4161/epi.7.3.19216 Lepeule, J., Baccarelli, A., Motta, V., Cantone, L., Litonjua, A. A., Sparrow, D., Vokonas, P. S. and Schwartz, J., 2012. Gene promoter methylation is associated with lung function in the elderly: the Normative Aging Study. Epigenetics. 7, 261\u2010269. https://doi.org/10.4161/epi.7.3.19216. Lepeule et al., 2014 J. Lepeule M.A. Bind A.A. Baccarelli P. Koutrakis L. Tarantini A. Litonjua D. Sparrow P. Vokonas J.D. Schwartz Epigenetic influences on associations between air pollutants and lung function in elderly men: the normative aging study Environ. Health Perspect. 122 2014 566 572 10.1289/ehp.1206458 Lepeule, J., Bind, M. A., Baccarelli, A. A., Koutrakis, P., Tarantini, L., Litonjua, A., Sparrow, D., Vokonas, P. and Schwartz, J. D., 2014. Epigenetic influences on associations between air pollutants and lung function in elderly men: the normative aging study. Environ Health Perspect. 122, 566\u2010572. https://doi.org/10.1289/ehp.1206458. Ley et al., 2014 B. Ley K.K. Brown H.R. Collard Molecular biomarkers in idiopathic pulmonary fibrosis Am. J. Physiol. Lung Cell. Mol. Physiol. 307 2014 L681 L691 10.1152/ajplung.00014.2014 Ley, B., Brown, K. K. and Collard, H. R., 2014. Molecular biomarkers in idiopathic pulmonary fibrosis. American journal of physiology. Lung cellular and molecular physiology. 307, L681-L691. https://doi.org/10.1152/ajplung.00014.2014. Li et al., 2018b Y. Li S. Fu E. Li X. Sun H. Xu Y. Meng X. Wang Y. Chen C. Xie S. Geng J. Wu C. Zhong P. Xu Modulation of autophagy in the protective effect of resveratrol on PM2.5-induced pulmonary oxidative injury in mice Phytotherapy Research 32 2018 2480 2486 https://doi.org/10.1002/ptr.6187 Li, Y., Fu, S., Li, E., Sun, X., Xu, H., Meng, Y., Wang, X., Chen, Y., Xie, C., Geng, S., Wu, J., Zhong, C., Xu, P., 2018b. Modulation of autophagy in the protective effect of resveratrol on PM2.5-induced pulmonary oxidative injury in mice. Phytotherapy Research 32, 2480\u20132486. https://doi.org/10.1002/ptr.6187. Li et al., 2009 J. Li A.J. Ghio S.H. Cho C.E. Brinckerhoff S.A. Simon W. Liedtke Diesel exhaust particles activate the matrix-metalloproteinase-1 gene in human bronchial epithelia in a beta-arrestin-dependent manner via activation of RAS Environ. Health Perspect. 117 2009 400 409 10.1289/ehp.0800311 Li, J., Ghio, A. J., Cho, S. H., Brinckerhoff, C. E., Simon, S. A. and Liedtke, W., 2009. Diesel exhaust particles activate the matrix-metalloproteinase-1 gene in human bronchial epithelia in a beta-arrestin-dependent manner via activation of RAS. Environ Health Perspect. 117, 400\u2010409. https://doi.org/10.1289/ehp.0800311. Li et al., 2017a J. Li W.X. Li C. Bai Y. Song Particulate matter-induced epigenetic changes and lung cancer Clin. Respir. J. 11 2017 539 546 10.1111/crj.12389 Li, J., Li, W. X., Bai, C. and Song, Y., 2017a. Particulate matter-induced epigenetic changes and lung cancer. The Clinical Respiratory Journal. 11, 539\u2010546. https://doi.org/10.1111/crj.12389. Li et al., 2018a J. Li Q. Zhou Y. Liang W. Pan Y. Bei Y. Zhang J. Wang Z. Jiao miR-486 inhibits PM2.5-induced apoptosis and oxidative stress in human lung alveolar epithelial A549 cells Ann. Transl. Med 6 2018 209 10.21037/atm.2018.06.09 Li, J., Zhou, Q., Liang, Y., Pan, W., Bei, Y., Zhang, Y., Wang, J. and Jiao, Z., 2018a. miR-486 inhibits PM2.5-induced apoptosis and oxidative stress in human lung alveolar epithelial A549 cells. Ann Transl Med. 6, 209\u2010209. https://doi.org/10.21037/atm.2018.06.09. Li et al., 2003 N. Li M. Hao R.F. Phalen W.C. Hinds A.E. Nel Particulate air pollutants and asthma. A paradigm for the role of oxidative stress in PM-induced adverse health effects Clin. Immunol. 109 2003 250 265 10.1016/j.clim.2003.08.006 Li, N., Hao, M., Phalen, R. F., Hinds, W. C. and Nel, A. E., 2003. Particulate air pollutants and asthma. A paradigm for the role of oxidative stress in PM-induced adverse health effects. Clin Immunol. 109, 250\u2010265. https://doi.org/10.1016/j.clim.2003.08.006. Li et al., 2015 P. Li Y. Li J. Zhang S.F. Yu W. Tong X. Hu G. Jia Biomarkers for lung epithelium injury in occupational hexavalent chromium-exposed workers J. Occup. Environ. Med. 57 2015 e45 e50 10.1097/jom.0000000000000436 Li, P., Li, Y., Zhang, J., Yu, S. F., Tong, W., Hu, X. and Jia, G., 2015. Biomarkers for lung epithelium injury in occupational hexavalent chromium-exposed workers. J Occup Environ Med. 57, e45-e50. https://doi.org/10.1097/jom.0000000000000436. Li et al., 2017a R. Li L. Zhao J. Tong Y. Yan C. Xu Fine particulate matter and sulfur dioxide coexposures induce rat lung pathological injury and inflammatory responses via TLR4/p38/NF-\u03baB pathway Int J. Toxicol. 36 2017 165 173 10.1177/1091581816682225 Li, R., Zhao, L., Tong, J., Yan, Y. and Xu, C., 2017b. Fine Particulate Matter and Sulfur Dioxide Coexposures Induce Rat Lung Pathological Injury and Inflammatory Responses Via TLR4/p38/NF-\u03baB Pathway. Int J Toxicol. 36, 165\u2010173. https://doi.org/10.1177/1091581816682225. Li et al., 2017b R. Li L. Zhao L. Zhang M. Chen J. Shi C. Dong Z. Cai Effects of ambient PM(2.5) and 9-nitroanthracene on DNA damage and repair, oxidative stress and metabolic enzymes in the lungs of rats Toxicol. Res. 6 2017 654 663 10.1039/c7tx00065k Li, R., Zhao, L., Zhang, L., Chen, M., Shi, J., Dong, C. and Cai, Z., 2017c. Effects of ambient PM(2.5) and 9-nitroanthracene on DNA damage and repair, oxidative stress and metabolic enzymes in the lungs of rats. Toxicology research. 6, 654\u2010663. https://doi.org/10.1039/c7tx00065k. Li et al., 2016 X. Li Y. Lv N. Gao H. Sun R. Lu H. Yang C. Zhang Q. Meng S. Wu A.Q. Li Y. Xia R. Chen microRNA-802/Rnd3 pathway imposes on carcinogenesis and metastasis of fine particulate matter exposure Oncotarget 7 2016 35026 35043 10.18632/oncotarget.9019 Li, X., Lv, Y., Gao, N., Sun, H., Lu, R., Yang, H., Zhang, C., Meng, Q., Wu, S., Li, A. Q., Xia, Y. and Chen, R., 2016. microRNA-802/Rnd3 pathway imposes on carcinogenesis and metastasis of fine particulate matter exposure. Oncotarget. 7, 35026\u201035043. https://doi.org/10.18632/oncotarget.9019. Li et al., 2020 Z. Li Q. Liu Z. Xu X. Guo S. Wu Association between short-term exposure to ambient particulate air pollution and biomarkers of oxidative stress: a meta-analysis Environ. Res. 191 2020 110105 10.1016/j.envres.2020.110105 Li, Z., Liu, Q., Xu, Z., Guo, X. and Wu, S., 2020. Association between short-term exposure to ambient particulate air pollution and biomarkers of oxidative stress: A meta-analysis. Environ Res. 191, 110105. https://doi.org/10.1016/j.envres.2020.110105. Liang et al., 2021 Y. Liang L. Hu J. Li F. Liu K.C. Jones D. Li J. Liu D. Chen J. You Z. Yu G. Zhang G. Dong H. Ma Short-term personal PM(2.5) exposure and change in DNA methylation of imprinted genes: Panel study of healthy young adults in Guangzhou city, China Environ. Pollut. (Barking, Essex: 1987). 275 2021 116601 10.1016/j.envpol.2021.116601 Liang, Y., Hu, L., Li, J., Liu, F., Jones, K. C., Li, D., Liu, J., Chen, D., You, J., Yu, Z., Zhang, G., Dong, G. and Ma, H., 2021. Short-term personal PM(2.5) exposure and change in DNA methylation of imprinted genes: Panel study of healthy young adults in Guangzhou city, China. Environmental pollution (Barking, Essex: 1987). 275, 116601. https://doi.org/10.1016/j.envpol.2021.116601. Lin et al., 2015 W. Lin T. Zhu T. Xue W. Peng B. Brunekreef U. Gehring W. Huang M. Hu Y. Zhang X. Tang Association between changes in exposure to air pollution and biomarkers of oxidative stress in children before and during the Beijing Olympics Am. J. Epidemiol. 181 2015 575 583 10.1093/aje/kwu327 Lin, W., Zhu, T., Xue, T., Peng, W., Brunekreef, B., Gehring, U., Huang, W., Hu, M., Zhang, Y. and Tang, X., 2015. Association between changes in exposure to air pollution and biomarkers of oxidative stress in children before and during the Beijing Olympics. Am J Epidemiol. 181, 575\u2010583. https://doi.org/10.1093/aje/kwu327. Lin et al., 2009 Z.Q. Lin Z.G. Xi D.F. Yang F.H. Chao H.S. Zhang W. Zhang H.L. Liu Z.M. Yang R.B. Sun Oxidative damage to lung tissue and peripheral blood in endotracheal PM2.5-treated rats Biomed. Environ. Sci.: BES 22 2009 223 228 10.1016/s0895-3988(09)60049-0 Lin, Z. Q., Xi, Z. G., Yang, D. F., Chao, F. H., Zhang, H. S., Zhang, W., Liu, H. L., Yang, Z. M. and Sun, R. B., 2009. Oxidative damage to lung tissue and peripheral blood in endotracheal PM2.5-treated rats. Biomedical and environmental sciences: BES. 22, 223\u2010228. https://doi.org/10.1016/s0895\u20103988(09)60049\u20100. Liu et al., 2015 C. Liu J. Xu Y. Chen X. Guo Y. Zheng Q. Wang Y. Chen Y. Ni Y. Zhu B.T. Joyce A. Baccarelli F. Deng W. Zhang L. Hou Characterization of genome-wide H3K27ac profiles reveals a distinct PM2.5-associated histone modification signature Environ. Health 14 2015 65 10.1186/s12940-015-0052-5 Liu, C., Xu, J., Chen, Y., Guo, X., Zheng, Y., Wang, Q., Chen, Y., Ni, Y., Zhu, Y., Joyce, B. T., Baccarelli, A., Deng, F., Zhang, W. and Hou, L., 2015. Characterization of genome-wide H3K27ac profiles reveals a distinct PM2.5-associated histone modification signature. Environ Health. 14, 65\u201065. https://doi.org/10.1186/s12940\u2010015\u20100052\u20105. Liu et al., 2018 S. Liu W. Zhang F. Zhang P. Roepstorff F. Yang Z. Lu W. Ding TMT-based quantitative proteomics analysis reveals airborne PM(2.5)-induced pulmonary fibrosis Int. J. Environ. Res. Public Health 2018 16 10.3390/ijerph16010098 Liu, S., Zhang, W., Zhang, F., Roepstorff, P., Yang, F., Lu, Z. and Ding, W., 2018. TMT-Based Quantitative Proteomics Analysis Reveals Airborne PM(2.5)-Induced Pulmonary Fibrosis. Int J Environ Res Public Health. 16. https://doi.org/10.3390/ijerph16010098. Liu et al., 2020 X. Liu X. Zhao X. Li S. Lv R. Ma Y. Qi A. Abulikemu H. Duan C. Guo Y. Li Z. Sun PM(2.5) triggered apoptosis in lung epithelial cells through the mitochondrial apoptotic way mediated by a ROS-DRP1-mitochondrial fission axis J. Hazard. Mater. 397 2020 122608 10.1016/j.jhazmat.2020.122608 Liu, X., Zhao, X., Li, X., Lv, S., Ma, R., Qi, Y., Abulikemu, A., Duan, H., Guo, C., Li, Y. and Sun, Z., 2020. PM(2.5) triggered apoptosis in lung epithelial cells through the mitochondrial apoptotic way mediated by a ROS-DRP1-mitochondrial fission axis. J Hazard Mater. 397, 122608. https://doi.org/10.1016/j.jhazmat.2020.122608. Longhin et al., 2016 E. Longhin L. Capasso C. Battaglia M.C. Proverbio C. Cosentino I. Cifola E. Mangano M. Camatini M. Gualtieri Integrative transcriptomic and protein analysis of human bronchial BEAS-2B exposed to seasonal urban particulate matter Environ. Pollut. 209 2016 87 98 10.1016/j.envpol.2015.11.013 Longhin, E., Capasso, L., Battaglia, C., Proverbio, M. C., Cosentino, C., Cifola, I., Mangano, E., Camatini, M. and Gualtieri, M., 2016. Integrative transcriptomic and protein analysis of human bronchial BEAS-2B exposed to seasonal urban particulate matter. Environmental Pollution. 209, 87\u201098. https://doi.org/10.1016/j.envpol.2015.11.013. Loomis et al., 2013 D. Loomis Y. Grosse B. Lauby-Secretan F. El Ghissassi V. Bouvard L. Benbrahim-Tallaa N. Guha R. Baan H. Mattock K. Straif The carcinogenicity of outdoor air pollution Lancet Oncol. 14 2013 1262 1263 10.1016/s1470-2045(13)70487-x Loomis, D., Grosse, Y., Lauby-Secretan, B., El Ghissassi, F., Bouvard, V., Benbrahim-Tallaa, L., Guha, N., Baan, R., Mattock, H. and Straif, K., 2013. The carcinogenicity of outdoor air pollution. Lancet Oncol. 14, 1262\u20101263. https://doi.org/10.1016/s1470\u20102045(13)70487\u2010x. Lu et al., 2015 F. Lu D. Xu Y. Cheng S. Dong C. Guo X. Jiang X. Zheng Systematic review and meta-analysis of the adverse health effects of ambient PM2.5 and PM10 pollution in the Chinese population Environ. Res. 136 2015 196 204 10.1016/j.envres.2014.06.029 Lu, F., Xu, D., Cheng, Y., Dong, S., Guo, C., Jiang, X. and Zheng, X., 2015. Systematic review and meta-analysis of the adverse health effects of ambient PM2.5 and PM10 pollution in the Chinese population. Environmental Research. 136, 196\u2010204. https://doi.org/10.1016/j.envres.2014.06.029. Ma et al., 2017 J.H. Ma S.H. Song M. Guo J. Zhou F. Liu L. Peng Z.R. Fu Long-term exposure to PM2.5 lowers influenza virus resistance via down-regulating pulmonary macrophage Kdm6a and mediates histones modification in IL-6 and IFN-\u03b2 promoter regions Biochem Biophys. Res. Commun. 493 2017 1122 1128 10.1016/j.bbrc.2017.09.013 Ma, J. H., Song, S. H., Guo, M., Zhou, J., Liu, F., Peng, L. and Fu, Z. R., 2017. Long-term exposure to PM2.5 lowers influenza virus resistance via down-regulating pulmonary macrophage Kdm6a and mediates histones modification in IL-6 and IFN-\u03b2 promoter regions. Biochem Biophys Res Commun. 493, 1122\u20101128. https://doi.org/10.1016/j.bbrc.2017.09.013. Ma et al., 2015 M. Ma S. Li H. Jin Y. Zhang J. Xu D. Chen C. Kuimin Z. Yuan C. Xiao Characteristics and oxidative stress on rats and traffic policemen of ambient fine particulate matter from Shenyang Sci. Total Environ. 526 2015 110 115 10.1016/j.scitotenv.2015.04.075 Ma, M., Li, S., Jin, H., Zhang, Y., Xu, J., Chen, D., Kuimin, C., Yuan, Z. and Xiao, C., 2015. Characteristics and oxidative stress on rats and traffic policemen of ambient fine particulate matter from Shenyang. The Science of the total environment. 526, 110\u2010115. https://doi.org/10.1016/j.scitotenv.2015.04.075. Madsen et al., 2008 C. Madsen K.L. Durand P. Nafstad P.E. Schwarze K.S. R\u00f8nningen L.L. H\u00e5heim Associations between environmental exposures and serum concentrations of Clara cell protein among elderly men in Oslo, Norway Environ. Res. 108 2008 354 360 10.1016/j.envres.2008.07.017 Madsen, C., Durand, K. L., Nafstad, P., Schwarze, P. E., R\u00f8nningen, K. S. and H\u00e5heim, L. L., 2008. Associations between environmental exposures and serum concentrations of Clara cell protein among elderly men in Oslo, Norway. Environ Res. 108, 354\u2010360. https://doi.org/10.1016/j.envres.2008.07.017. Mah et al., 2010 L.J. Mah A. El-Osta T.C. Karagiannis gammaH2AX: a sensitive molecular marker of DNA damage and repair Leukemia 24 2010 679 686 10.1038/leu.2010.6 Mah, L. J., El-Osta, A. and Karagiannis, T. C., 2010. gammaH2AX: a sensitive molecular marker of DNA damage and repair. Leukemia. 24, 679\u2010686. https://doi.org/10.1038/leu.2010.6. Mantecca et al., 2010 P. Mantecca F. Farina E. Moschini D. Gallinotti M. Gualtieri A. Rohr G. Sancini P. Palestini M. Camatini Comparative acute lung inflammation induced by atmospheric PM and size-fractionated tire particles Toxicol. Lett. 198 2010 244 254 10.1016/j.toxlet.2010.07.002 Mantecca, P., Farina, F., Moschini, E., Gallinotti, D., Gualtieri, M., Rohr, A., Sancini, G., Palestini, P. and Camatini, M., 2010. Comparative acute lung inflammation induced by atmospheric PM and size-fractionated tire particles. Toxicology Letters. 198, 244\u2010254. https://doi.org/10.1016/j.toxlet.2010.07.002. Marchini et al., 2020 T. Marchini A. Zirlik D. Wolf Pathogenic role of air pollution particulate matter in cardiometabolic disease: evidence from mice and humans Antioxid. Redox Signal. 33 2020 263 279 10.1089/ars.2020.8096 Marchini, T., Zirlik, A. and Wolf, D., 2020. Pathogenic Role of Air Pollution Particulate Matter in Cardiometabolic Disease: Evidence from Mice and Humans. Antioxid Redox Signal. 33, 263\u2010279. https://doi.org/10.1089/ars.2020.8096. Mehta et al., 2008 M. Mehta L.C. Chen T. Gordon W. Rom M.S. Tang Particulate matter inhibits DNA repair and enhances mutagenesis Mutat. Res. 657 2008 116 121 10.1016/j.mrgentox.2008.08.015 Mehta, M., Chen, L.C., Gordon, T., Rom, W., Tang, M.S., 2008. Particulate matter inhibits DNA repair and enhances mutagenesis. Mutat. Res. 657, 116\u2013121. doi:10.1016/j.mrgentox.2008.08.015 Meng and Zhang, 2007 Z. Meng Q. Zhang Damage effects of dust storm PM2.5 on DNA in alveolar macrophages and lung cells of rats Food Chem. Toxicol. 45 2007 1368 1374 10.1016/j.fct.2007.01.014 Meng, Z. and Zhang, Q., 2007. Damage effects of dust storm PM2.5 on DNA in alveolar macrophages and lung cells of rats. Food Chem Toxicol. 45, 1368\u20101374. https://doi.org/10.1016/j.fct.2007.01.014. Menni et al., 2015 C. Menni S.J. Metrustry R.P. Mohney S. Beevers B. Barratt T.D. Spector F.J. Kelly A.M. Valdes Circulating levels of antioxidant vitamins correlate with better lung function and reduced exposure to ambient pollution Am. J. Respir. Crit. Care Med. 191 2015 1203 1207 10.1164/rccm.201411-2059LE Menni, C., Metrustry, S. J., Mohney, R. P., Beevers, S., Barratt, B., Spector, T. D., Kelly, F. J. and Valdes, A. M., 2015. Circulating levels of antioxidant vitamins correlate with better lung function and reduced exposure to ambient pollution. Am J Respir Crit Care Med. 191, 1203\u20101207. https://doi.org/10.1164/rccm.201411\u20102059LE. Milanzi et al., 2018 E.B. Milanzi G.H. Koppelman H.A. Smit A.H. Wijga M. Oldenwening J.M. Vonk B. Brunekreef U. Gehring Air pollution exposure and lung function until age 16 years: the PIAMA birth cohort study Eur. Respir. J. 52 2018 1800218 10.1183/13993003.00218-2018 Milanzi, E. B., Koppelman, G. H., Smit, H. A., Wijga, A. H., Oldenwening, M., Vonk, J. M., Brunekreef, B. and Gehring, U., 2018. Air pollution exposure and lung function until age 16 years: the PIAMA birth cohort study. European Respiratory Journal. 52, 1800218. https://doi.org/10.1183/13993003.00218\u20102018. Mitkus et al., 2013 R.J. Mitkus J.L. Powell R. Zeisler K.S. Squibb Comparative physicochemical and biological characterization of NIST Interim Reference Material PM2.5 and SRM 1648 in human A549 and mouse RAW264.7 cells Toxicol. Vitr. 27 2013 2289 2298 10.1016/j.tiv.2013.09.024 Mitkus, R. J., Powell, J. L., Zeisler, R. and Squibb, K. S., 2013. Comparative physicochemical and biological characterization of NIST Interim Reference Material PM2.5 and SRM 1648 in human A549 and mouse RAW264.7 cells. Toxicology in Vitro. 27, 2289\u20102298. https://doi.org/10.1016/j.tiv.2013.09.024. M\u00f8ller et al., 2014 P. M\u00f8ller P.H. Danielsen D.G. Karottki K. Jantzen M. Roursgaard H. Klingberg D.M. Jensen D.V. Christophersen J.G. Hemmingsen Y. Cao S. Loft Oxidative stress and inflammation generated DNA damage by exposure to air pollution particles Mutat. Res Rev. Mutat. Res. 762 2014 133 166 10.1016/j.mrrev.2014.09.001 M\u00f8ller, P., Danielsen, P. H., Karottki, D. G., Jantzen, K., Roursgaard, M., Klingberg, H., Jensen, D. M., Christophersen, D. V., Hemmingsen, J. G., Cao, Y. and Loft, S., 2014. Oxidative stress and inflammation generated DNA damage by exposure to air pollution particles. Mutat Res Rev Mutat Res. 762, 133\u2010166. https://doi.org/10.1016/j.mrrev.2014.09.001. Montgomery et al., 2020 M.T. Montgomery S.P. Sajuthi S.-H. Cho J.L. Everman C.L. Rios K.C. Goldfarbmuren N.D. Jackson B. Saef M. Cromie C. Eng V. Medina J.R. Elhawary S.S. Oh J. Rodriguez-Santana E.K. Vladar E.G. Burchard M.A. Seibold Genome-wide analysis reveals mucociliary remodeling of the nasal airway epithelium induced by urban PM2.5 Am. J. Respir. Cell Mol. Biol. 2020 10.1165/rcmb.2019-0454OC Montgomery, M. T., Sajuthi, S. P., Cho, S.-H., Everman, J. L., Rios, C. L., Goldfarbmuren, K. C., Jackson, N. D., Saef, B., Cromie, M., Eng, C., Medina, V., Elhawary, J. R., Oh, S. S., Rodriguez-Santana, J., Vladar, E. K., Burchard, E. G. and Seibold, M. A., 2020. Genome-wide Analysis Reveals Mucociliary Remodeling of the Nasal Airway Epithelium Induced by Urban PM2.5. American Journal of Respiratory Cell and Molecular Biology. https://doi.org/10.1165/rcmb.2019\u20100454OC. Montuschi et al., 2004 P. Montuschi P.J. Barnes L.J. Roberts 2nd Isoprostanes: markers and mediators of oxidative stress FASEB J.: Off. Publ. Fed. Am. Soc. Exp. Biol. 18 2004 1791 1800 10.1096/fj.04-2330rev Montuschi, P., Barnes, P. J. and Roberts, L. J., 2nd, 2004. Isoprostanes: markers and mediators of oxidative stress. FASEB journal: official publication of the Federation of American Societies for Experimental Biology. 18, 1791\u20101800. https://doi.org/10.1096/fj.04\u20102330rev. Nazariah et al., 2013 S.S.N. Nazariah J. Juliana M.A. Abdah Interleukin-6 via sputum induction as biomarker of inflammation for indoor particulate matter among primary school children in Klang Valley, Malaysia Glob. J. Health Sci. 5 2013 93 105 10.5539/gjhs.v5n4p93 Nazariah, S. S. N., Juliana, J. and Abdah, M. A., 2013. Interleukin-6 via sputum induction as biomarker of inflammation for indoor particulate matter among primary school children in Klang Valley, Malaysia. Glob J Health Sci. 5, 93\u2010105. https://doi.org/10.5539/gjhs.v5n4p93. Ndong Ba et al., 2019 A. Ndong Ba F. Cazier A. Verdin G. Garcon M. Cabral L. Courcot A. Diouf D. Courcot M. Gualtieri M. Fall Physico-chemical characterization and in vitro inflammatory and oxidative potency of atmospheric particles collected in Dakar city\u2019s (Senegal) Environ. Pollut. (Barking, Essex: 1987) 245 2019 568 581 10.1016/j.envpol.2018.11.026 Ndong Ba, A., Cazier, F., Verdin, A., Garcon, G., Cabral, M., Courcot, L., Diouf, A., Courcot, D., Gualtieri, M. and Fall, M., 2019. Physico-chemical characterization and in vitro inflammatory and oxidative potency of atmospheric particles collected in Dakar city's (Senegal). Environmental pollution (Barking, Essex: 1987). 245, 568\u2010581. https://doi.org/10.1016/j.envpol.2018.11.026. Neophytou et al., 2014 A.M. Neophytou J.E. Hart Y. Chang J.J. Zhang T.J. Smith E. Garshick F. Laden Short-term traffic related exposures and biomarkers of nitro-PAH exposure and oxidative DNA damage Toxics 2 2014 377 390 10.3390/toxics2030377 Neophytou, A. M., Hart, J. E., Chang, Y., Zhang, J. J., Smith, T. J., Garshick, E. and Laden, F., 2014. Short-term traffic related exposures and biomarkers of nitro-PAH exposure and oxidative DNA damage. Toxics. 2, 377\u2010390. https://doi.org/10.3390/toxics2030377. Ning et al., 2019 J. Ning P. Li B. Zhang B. Han X. Su Q. Wang X. Wang B. Li H. Kang L. Zhou C. Chu N. Zhang Y. Pang Y. Niu R. Zhang miRNAs deregulation in serum of mice is associated with lung cancer related pathway deregulation induced by PM2.5 Environ. Pollut. 254 2019 112875 10.1016/j.envpol.2019.07.043 Ning, J., Li, P., Zhang, B., Han, B., Su, X., Wang, Q., Wang, X., Li, B., Kang, H., Zhou, L., Chu, C., Zhang, N., Pang, Y., Niu, Y. and Zhang, R., 2019. miRNAs deregulation in serum of mice is associated with lung cancer related pathway deregulation induced by PM2.5. Environmental Pollution. 254, 112875. https://doi.org/10.1016/j.envpol.2019.07.043. Nishino et al., 2014 R. Nishino T. Fukuyama Y. Watanabe Y. Kurosawa H. Ueda T. Kosaka Effect of mouse strain in a model of chemical-induced respiratory allergy Exp. Anim. 63 2014 435 445 10.1538/expanim.63.435 Nishino, R., Fukuyama, T., Watanabe, Y., Kurosawa, Y., Ueda, H. and Kosaka, T., 2014. Effect of mouse strain in a model of chemical-induced respiratory allergy. Exp Anim. 63, 435\u2010445. https://doi.org/10.1538/expanim.63.435. Niu et al., 2017 Y. Niu R. Chen H. Kan Air pollution, disease burden, and health economic loss in China Adv. Exp. Med. Biol. 1017 2017 233 242 10.1007/978-981-10-5657-4_10 Niu, Y., Chen, R. and Kan, H., 2017. Air Pollution, Disease Burden, and Health Economic Loss in China. Adv Exp Med Biol. 1017, 233\u2010242. https://doi.org/10.1007/978\u2010981\u201010\u20105657\u20104_10. Ogino et al., 2017 K. Ogino K. Nagaoka T. Okuda A. Oka M. Kubo E. Eguchi Y. Fujikura PM2.5-induced airway inflammation and hyperresponsiveness in NC/Nga mice Environ. Toxicol. 32 2017 1047 1054 10.1002/tox.22303 Ogino, K., Nagaoka, K., Okuda, T., Oka, A., Kubo, M., Eguchi, E. and Fujikura, Y., 2017. PM2.5-induced airway inflammation and hyperresponsiveness in NC/Nga mice. Environmental toxicology. 32, 1047\u20101054. https://doi.org/10.1002/tox.22303. Paget-Brown et al., 2006 A.O. Paget-Brown L. Ngamtrakulpanit A. Smith D. Bunyan S. Hom A. Nguyen J.F. Hunt Normative data for pH of exhaled breath condensate Chest 129 2006 426 430 10.1378/chest.129.2.426 Paget-Brown, A. O., Ngamtrakulpanit, L., Smith, A., Bunyan, D., Hom, S., Nguyen, A. and Hunt, J. F., 2006. Normative data for pH of exhaled breath condensate. Chest. 129, 426\u2010430. https://doi.org/10.1378/chest.129.2.426. Pardo et al., 2016 A. Pardo S. Cabrera M. Maldonado M. Selman Role of matrix metalloproteinases in the pathogenesis of idiopathic pulmonary fibrosis Respir. Res 17 2016 23 10.1186/s12931-016-0343-6 Pardo, A., Cabrera, S., Maldonado, M. and Selman, M., 2016. Role of matrix metalloproteinases in the pathogenesis of idiopathic pulmonary fibrosis. Respir Res. 17, 23\u201023. https://doi.org/10.1186/s12931\u2010016\u20100343\u20106. Pedersen, 2017 B.K. Pedersen Anti-inflammatory effects of exercise: role in diabetes and cardiovascular disease Eur. J. Clin. Invest 47 2017 600 611 10.1111/eci.12781 Pedersen, B. K., 2017. Anti-inflammatory effects of exercise: role in diabetes and cardiovascular disease. Eur J Clin Invest. 47, 600\u2010611. https://doi.org/10.1111/eci.12781. Polette et al., 2004 M. Polette B. Nawrocki-Raby C. Gilles C. Clavel P. Birembaut Tumour invasion and matrix metalloproteinases Crit. Rev. Oncol. Hematol. 49 2004 179 186 10.1016/j.critrevonc.2003.10.008 Polette, M., Nawrocki-Raby, B., Gilles, C., Clavel, C. and Birembaut, P., 2004. Tumour invasion and matrix metalloproteinases. Crit Rev Oncol Hematol. 49, 179\u2010186. https://doi.org/10.1016/j.critrevonc.2003.10.008. Qiu et al., 2021 F. Qiu L. Chen H. Wang M. Huang X. Sun J. Kan J. Du Y. Li Protective effect of supplementation with Ginseng, Lilii Bulbus and Poria against PM(2) (.5) in air pollution-induced cardiopulmonary damage among adults Phytother. Res. 35 2021 877 887 10.1002/ptr.6835 Qiu, F., Chen, L., Wang, H., Huang, M., Sun, X., Kan, J., Du, J. and Li, Y., 2021. Protective effect of supplementation with Ginseng, Lilii Bulbus and Poria against PM(2) (.5) in air pollution-induced cardiopulmonary damage among adults. Phytother Res. 35, 877\u2010887. https://doi.org/10.1002/ptr.6835. Rava et al., 2013 M. Rava L. Tares I. Lavi E. Barreiro J.P. Zock A. Ferrer N. Muniozguren R. Nadif L. Cazzoletti F. Kauffmann J.M. Anto S. Guerra Serum levels of Clara cell secretory protein, asthma, and lung function in the adult general population J. Allergy Clin. Immunol. 132 2013 230 232 10.1016/j.jaci.2013.01.023 Rava, M., Tares, L., Lavi, I., Barreiro, E., Zock, J. P., Ferrer, A., Muniozguren, N., Nadif, R., Cazzoletti, L., Kauffmann, F., Anto, J. M. and Guerra, S., 2013. Serum levels of Clara cell secretory protein, asthma, and lung function in the adult general population. J Allergy Clin Immunol. 132, 230\u2010232. https://doi.org/10.1016/j.jaci.2013.01.023. Ren et al., 2020 H. Ren J. Lu J. Ning X. Su Y. Tong J. Chen Y. Ding Exposure to fine particulate matter induces self-recovery and susceptibility of oxidative stress and inflammation in rat lungs Environ. Sci. Pollut. Res. Int. 27 2020 40262 40276 10.1007/s11356-020-10029-2 Ren, H., Lu, J., Ning, J., Su, X., Tong, Y., Chen, J. and Ding, Y., 2020. Exposure to fine particulate matter induces self-recovery and susceptibility of oxidative stress and inflammation in rat lungs. Environmental science and pollution research international. 27, 40262\u201040276. https://doi.org/10.1007/s11356\u2010020\u201010029\u20102. Ricciardolo, 2014 F.L. Ricciardolo Revisiting the role of exhaled nitric oxide in asthma Curr. Opin. Pulm. Med. 20 2014 53 59 10.1097/MCP.0000000000000006 Ricciardolo, F. L., 2014. Revisiting the role of exhaled nitric oxide in asthma. Curr Opin Pulm Med. 20, 53\u201059. https://doi.org/10.1097/MCP.0000000000000006. Rios-Doria et al., 2006 J. Rios-Doria A. Fay A. Velkova A.N. Monteiro DNA damage response: determining the fate of phosphorylated histone H2AX Cancer Biol. Ther. 5 2006 142 144 10.4161/cbt.5.2.2530 Rios-Doria, J., Fay, A., Velkova, A. and Monteiro, A. N., 2006. DNA damage response: determining the fate of phosphorylated histone H2AX. Cancer biology & therapy. 5, 142\u2010144. https://doi.org/10.4161/cbt.5.2.2530. Riva et al., 2011 D.R. Riva C.B. Magalh\u00e3es A.A. Lopes T. Lan\u00e7as T. Mauad O. Malm S.S. Valen\u00e7a P.H. Saldiva D.S. Faffe W.A. Zin Low dose of fine particulate matter (PM2.5) can induce acute oxidative stress, inflammation and pulmonary impairment in healthy mice Inhal. Toxicol. 23 2011 257 267 10.3109/08958378.2011.566290 Riva, D. R., Magalh\u00e3es, C. B., Lopes, A. A., Lan\u00e7as, T., Mauad, T., Malm, O., Valen\u00e7a, S. S., Saldiva, P. H., Faffe, D. S. and Zin, W. A., 2011. Low dose of fine particulate matter (PM2.5) can induce acute oxidative stress, inflammation and pulmonary impairment in healthy mice. Inhalation Toxicology. 23, 257\u2010267. https://doi.org/10.3109/08958378.2011.566290. Rodr\u00edguez-Cotto et al., 2014 R.I. Rodr\u00edguez-Cotto M.G. Ortiz-Mart\u00ednez E. Rivera-Ram\u00edrez V.L. Mateus B.S. Amaral B.D. Jim\u00e9nez-V\u00e9lez A. Gioda Particle pollution in Rio de Janeiro, Brazil: increase and decrease of pro-inflammatory cytokines IL-6 and IL-8 in human lung cells Environ. Pollut. 194 2014 112 120 10.1016/j.envpol.2014.07.010 Rodr\u00edguez-Cotto, R. I., Ortiz-Mart\u00ednez, M. G., Rivera-Ram\u00edrez, E., Mateus, V. L., Amaral, B. S., Jim\u00e9nez-V\u00e9lez, B. D. and Gioda, A., 2014. Particle pollution in Rio de Janeiro, Brazil: increase and decrease of pro-inflammatory cytokines IL-6 and IL-8 in human lung cells. Environ Pollut. 194, 112\u2010120. https://doi.org/10.1016/j.envpol.2014.07.010. Rossnerova et al., 2013 A. Rossnerova E. Tulupova N. Tabashidze J. Schmuczerova M. Dostal P. Rossner H. Gmuender Jr. R.J. Sram Factors affecting the 27K DNA methylation pattern in asthmatic and healthy children from locations with various environments Mutat. Res. 741\u2013742 2013 18 26 10.1016/j.mrfmmm.2013.02.003 Rossnerova, A., Tulupova, E., Tabashidze, N., Schmuczerova, J., Dostal, M., Rossner, P., Jr., Gmuender, H. and Sram, R. J., 2013. Factors affecting the 27K DNA methylation pattern in asthmatic and healthy children from locations with various environments. Mutat Res. 741\u2010742, 18\u201026. https://doi.org/10.1016/j.mrfmmm.2013.02.003. Rylance et al., 2013 J. Rylance S.B. Gordon L.P. Naeher A. Patel J.R. Balmes O. Adetona D.K. Rogalsky W.J. Martin 2nd Household air pollution: a call for studies into biomarkers of exposure and predictors of respiratory disease Am. J. Physiol. Lung Cell. Mol. Physiol. 304 2013 L571 L578 10.1152/ajplung.00416.2012 Rylance, J., Gordon, S. B., Naeher, L. P., Patel, A., Balmes, J. R., Adetona, O., Rogalsky, D. K. and Martin, W. J., 2nd,2013. Household air pollution: a call for studies into biomarkers of exposure and predictors of respiratory disease. American journal of physiology. Lung cellular and molecular physiology. 304, L571-L578. https://doi.org/10.1152/ajplung.00416.2012. Salam et al., 2012 M.T. Salam H.M. Byun F. Lurmann C.V. Breton X. Wang S.P. Eckel F.D. Gilliland Genetic and epigenetic variations in inducible nitric oxide synthase promoter, particulate pollution, and exhaled nitric oxide levels in children J. Allergy Clin. Immunol. 129 232\u2013239 2012 e231 e237 10.1016/j.jaci.2011.09.037 Salam, M. T., Byun, H. M., Lurmann, F., Breton, C. V., Wang, X., Eckel, S. P. and Gilliland, F. D., 2012. Genetic and epigenetic variations in inducible nitric oxide synthase promoter, particulate pollution, and exhaled nitric oxide levels in children. J Allergy Clin Immunol. 129, 232\u2010239.e231\u2010e237. https://doi.org/10.1016/j.jaci.2011.09.037. Sampath and Lloyd, 2019 H. Sampath R.S. Lloyd Roles of OGG1 in transcriptional regulation and maintenance of metabolic homeostasis DNA Repair 81 2019 102667 10.1016/j.dnarep.2019.102667 Sampath, H. and Lloyd, R. S., 2019. Roles of OGG1 in transcriptional regulation and maintenance of metabolic homeostasis. DNA Repair. 81, 102667. https://doi.org/10.1016/j.dnarep.2019.102667. Schikowski et al., 2013 T. Schikowski E. Schaffner F. Meier H.C. Phuleria A. Vierk\u00f6tter C. Schindler S. Kriemler E. Zemp U. Kr\u00e4mer P.O. Bridevaux T. Rochat J. Schwartz N. K\u00fcnzli N. Probst-Hensch Improved air quality and attenuated lung function decline: modification by obesity in the SAPALDIA cohort Environ. Health Perspect. 121 2013 1034 1039 10.1289/ehp.1206145 Schikowski, T., Schaffner, E., Meier, F., Phuleria, H. C., Vierk\u00f6tter, A., Schindler, C., Kriemler, S., Zemp, E., Kr\u00e4mer, U., Bridevaux, P. O., Rochat, T., Schwartz, J., K\u00fcnzli, N. and Probst-Hensch, N., 2013. Improved air quality and attenuated lung function decline: modification by obesity in the SAPALDIA cohort. Environ Health Perspect. 121, 1034\u20101039. https://doi.org/10.1289/ehp.1206145. Schnekenburger et al., 2007 M. Schnekenburger G. Talaska A. Puga Chromium cross-links histone deacetylase 1-DNA methyltransferase 1 complexes to chromatin, inhibiting histone-remodeling marks critical for transcriptional activation Mol. Cell Biol. 27 2007 7089 7101 10.1128/mcb.00838-07 Schnekenburger, M., Talaska, G. and Puga, A., 2007. Chromium cross-links histone deacetylase 1-DNA methyltransferase 1 complexes to chromatin, inhibiting histone-remodeling marks critical for transcriptional activation. Mol Cell Biol. 27, 7089\u20107101. https://doi.org/10.1128/mcb.00838\u201007. Sehlstedt et al., 2010 M. Sehlstedt R. Dove C. Boman J. Pagels E. Swietlicki J. L\u00f6ndahl R. Westerholm J. Bosson S. Barath A.F. Behndig J. Pourazar T. Sandstr\u00f6m I.S. Mudway A. Blomberg Antioxidant airway responses following experimental exposure to wood smoke in man Part Fibre Toxicol. 7 2010 21 10.1186/1743-8977-7-21 Sehlstedt, M., Dove, R., Boman, C., Pagels, J., Swietlicki, E., L\u00f6ndahl, J., Westerholm, R., Bosson, J., Barath, S., Behndig, A. F., Pourazar, J., Sandstr\u00f6m, T., Mudway, I. S. and Blomberg, A., 2010. Antioxidant airway responses following experimental exposure to wood smoke in man. Part Fibre Toxicol. 7, 21\u201021. https://doi.org/10.1186/1743\u20108977\u20107\u201021. Shoenfelt et al., 2009 J. Shoenfelt R.J. Mitkus R. Zeisler R.O. Spatz J. Powell M.J. Fenton K.A. Squibb A.E. Medvedev Involvement of TLR2 and TLR4 in inflammatory immune responses induced by fine and coarse ambient air particulate matter J. Leukoc. Biol. 86 2009 303 312 10.1189/jlb.1008587 Shoenfelt, J., Mitkus, R. J., Zeisler, R., Spatz, R. O., Powell, J., Fenton, M. J., Squibb, K. A. and Medvedev, A. E., 2009. Involvement of TLR2 and TLR4 in inflammatory immune responses induced by fine and coarse ambient air particulate matter. J Leukoc Biol. 86, 303\u2010312. https://doi.org/10.1189/jlb.1008587. Shull et al., 2021 J.G. Shull M.T. Pay C. Lara Compte M. Olid G. Bermudo K. Portillo J. Sellar\u00e9s E. Balcells V. Vicens-Zygmunt L. Planas-Cerezales D. Badenes-Bonet R. Blavia P. Rivera-Ortega A. Moreno J. Sans D. Perich S. Barril L. Esteban L. Garcia-Bellmunt J. Esplugas G. Suarez-Cuartin J. Bordas-Martinez D. Castillo R. Jolis I. Salvador S. Eizaguirre Anton A. Villar A. Robles-Perez M.J. Cardona E. Barbeta M.G. Silveira C. Guevara J. Dorca A. Rosell P. Luburich R. Llatj\u00f3s O. Jorba M. Molina-Molina Mapping IPF helps identify geographic regions at higher risk for disease development and potential triggers Respirology 26 2021 352 359 10.1111/resp.13973 Shull, J. G., Pay, M. T., Lara Compte, C., Olid, M., Bermudo, G., Portillo, K., Sellar\u00e9s, J., Balcells, E., Vicens-Zygmunt, V., Planas-Cerezales, L., Badenes-Bonet, D., Blavia, R., Rivera-Ortega, P., Moreno, A., Sans, J., Perich, D., Barril, S., Esteban, L., Garcia-Bellmunt, L., Esplugas, J., Suarez-Cuartin, G., Bordas-Martinez, J., Castillo, D., Jolis, R., Salvador, I., Eizaguirre Anton, S., Villar, A., Robles-Perez, A., Cardona, M. J., Barbeta, E., Silveira, M. G., Guevara, C., Dorca, J., Rosell, A., Luburich, P., Llatj\u00f3s, R., Jorba, O. and Molina-Molina, M., 2021. Mapping IPF helps identify geographic regions at higher risk for disease development and potential triggers. Respirology. 26, 352\u2010359. https://doi.org/10.1111/resp.13973. Sklorz et al., 2007 M. Sklorz J.J. Bried\u00e9 J. Schnelle-Kreis Y. Liu J. Cyrys T.M. de Kok R. Zimmermann Concentration of oxygenated polycyclic aromatic hydrocarbons and oxygen free radical formation from urban particulate matter J. Toxicol. Environ. Health A 70 2007 1866 1869 10.1080/15287390701457654 Sklorz, M., Bried\u00e9, J. J., Schnelle-Kreis, J., Liu, Y., Cyrys, J., de Kok, T. M. and Zimmermann, R., 2007. Concentration of oxygenated polycyclic aromatic hydrocarbons and oxygen free radical formation from urban particulate matter. J Toxicol Environ Health A. 70, 1866\u20101869. https://doi.org/10.1080/15287390701457654. Smeester et al., 2014 L. Smeester A.E. Yosim M.D. Nye C. Hoyo S.K. Murphy R.C. Fry Imprinted genes and the environment: links to the toxic metals arsenic, cadmium and lead Genes 2014 5 10.3390/genes5020477 Smeester, L., Yosim, A. E., Nye, M. D., Hoyo, C., Murphy, S. K. and Fry, R. C., 2014. Imprinted Genes and the Environment: Links to the Toxic Metals Arsenic, Cadmium and Lead. Genes. 5. https://doi.org/10.3390/genes5020477. Soberanes et al., 2012 S. Soberanes A. Gonzalez D. Urich S.E. Chiarella K.A. Radigan A. Osornio-Vargas J. Joseph B. Kalyanaraman K.M. Ridge N.S. Chandel G.M. Mutlu A. De Vizcaya-Ruiz G.R. Budinger Particulate matter Air Pollution induces hypermethylation of the p16 promoter Via a mitochondrial ROS-JNK-DNMT1 pathway Sci. Rep. 2 2012 275 10.1038/srep00275 Soberanes, S., Gonzalez, A., Urich, D., Chiarella, S. E., Radigan, K. A., Osornio-Vargas, A., Joseph, J., Kalyanaraman, B., Ridge, K. M., Chandel, N. S., Mutlu, G. M., De Vizcaya-Ruiz, A. and Budinger, G. R., 2012. Particulate matter Air Pollution induces hypermethylation of the p16 promoter Via a mitochondrial ROS-JNK-DNMT1 pathway. Sci Rep. 2, 275. https://doi.org/10.1038/srep00275. Song et al., 2012 J.S. Song Y.S. Kim D.K. Kim S.I. Park S.J. Jang Global histone modification pattern associated with recurrence and disease-free survival in non-small cell lung cancer patients Pathol. Int. 62 2012 182 190 10.1111/j.1440-1827.2011.02776.x Song, J. S., Kim, Y. S., Kim, D. K., Park, S. I. and Jang, S. J., 2012. Global histone modification pattern associated with recurrence and disease-free survival in non-small cell lung cancer patients. Pathol Int. 62, 182\u2010190. https://doi.org/10.1111/j.1440\u20101827.2011.02776.x. Song et al., 2019 Y. Song R. Li Y. Zhang J. Wei W. Chen C.K.A. Chung Z. Cai Mass spectrometry-based metabolomics reveals the mechanism of ambient fine particulate matter and its components on energy metabolic reprogramming in BEAS-2B cells Sci. Total Environ. 651 2019 3139 3150 10.1016/j.scitotenv.2018.10.171 Song, Y., Li, R., Zhang, Y., Wei, J., Chen, W., Chung, C. K. A. and Cai, Z., 2019. Mass spectrometry-based metabolomics reveals the mechanism of ambient fine particulate matter and its components on energy metabolic reprogramming in BEAS-2B cells. Science of The Total Environment. 651, 3139\u20103150. https://doi.org/10.1016/j.scitotenv.2018.10.171. S\u00f8rensen et al., 2003 M. S\u00f8rensen H. Autrup O. Hertel H. Wallin L.E. Knudsen S. Loft Personal exposure to PM2.5 and biomarkers of DNA damage Cancer Epidemiol. Biomark. Prev. 12 2003 191 196 S\u00f8rensen, M., Autrup, H., Hertel, O., Wallin, H., Knudsen, L. E. and Loft, S., 2003. Personal exposure to PM2.5 and biomarkers of DNA damage. Cancer Epidemiol Biomarkers Prev. 12, 191\u2010196. S\u00f8rensen et al., 2005 M. S\u00f8rensen R.P. Schins O. Hertel S. Loft Transition metals in personal samples of PM2.5 and oxidative stress in human volunteers Cancer Epidemiol. Biomark. Prev. 14 2005 1340 1343 10.1158/1055-9965.Epi-04-0899 S\u00f8rensen, M., Schins, R. P., Hertel, O. and Loft, S., 2005. Transition metals in personal samples of PM2.5 and oxidative stress in human volunteers. Cancer Epidemiol Biomarkers Prev. 14, 1340\u20101343. https://doi.org/10.1158/1055\u20109965.Epi\u201004\u20100899. Stockfelt et al., 2013 L. Stockfelt G. Sallsten P. Almerud S. Basu L. Barregard Short-term chamber exposure to low doses of two kinds of wood smoke does not induce systemic inflammation, coagulation or oxidative stress in healthy humans Inhal. Toxicol. 25 2013 417 425 10.3109/08958378.2013.798387 Stockfelt, L., Sallsten, G., Almerud, P., Basu, S. and Barregard, L., 2013. Short-term chamber exposure to low doses of two kinds of wood smoke does not induce systemic inflammation, coagulation or oxidative stress in healthy humans. Inhalation toxicology. 25, 417\u2010425. https://doi.org/10.3109/08958378.2013.798387. Stockfelt et al., 2012 L. Stockfelt G. Sallsten A.-C. Olin P. Almerud L. Samuelsson S. Johannesson P. Molnar B. Strandberg A.-C. Almstrand K. Bergemalm-Rynell L. Barregard Effects on airways of short-term exposure to two kinds of wood smoke in a chamber study of healthy humans Inhal. Toxicol. 24 2012 47 59 10.3109/08958378.2011.633281 Stockfelt, L., Sallsten, G., Olin, A.-C., Almerud, P., Samuelsson, L., Johannesson, S., Molnar, P., Strandberg, B., Almstrand, A.-C., Bergemalm-Rynell, K. and Barregard, L., 2012. Effects on airways of short-term exposure to two kinds of wood smoke in a chamber study of healthy humans. Inhalation Toxicology. 24, 47\u201059. https://doi.org/10.3109/08958378.2011.633281. Strahl and Allis, 2000 B.D. Strahl C.D. Allis The language of covalent histone modifications Nature 403 2000 41 45 10.1038/47412 Strahl, B. D. and Allis, C. D., 2000. The language of covalent histone modifications. Nature. 403, 41\u201045. https://doi.org/10.1038/47412. Sturrock et al., 2006 A. Sturrock B. Cahill K. Norman T.P. Huecksteadt K. Hill K. Sanders S.V. Karwande J.C. Stringham D.A. Bull M. Gleich T.P. Kennedy J.R. Hoidal Transforming growth factor-beta1 induces Nox4 NAD(P)H oxidase and reactive oxygen species-dependent proliferation in human pulmonary artery smooth muscle cells Am. J. Physiol. Lung Cell. Mol. Physiol. 290 2006 L661 l673 10.1152/ajplung.00269.2005 Sturrock, A., Cahill, B., Norman, K., Huecksteadt, T. P., Hill, K., Sanders, K., Karwande, S. V., Stringham, J. C., Bull, D. A., Gleich, M., Kennedy, T. P. and Hoidal, J. R., 2006. Transforming growth factor-beta1 induces Nox4 NAD(P)H oxidase and reactive oxygen species-dependent proliferation in human pulmonary artery smooth muscle cells. American journal of physiology. Lung cellular and molecular physiology. 290, L661-l673. https://doi.org/10.1152/ajplung.00269.2005. Suga et al., 2000 M. Suga K. Iyonaga T. Okamoto Y. Gushima H. Miyakawa T. Akaike M. Ando Characteristic elevation of matrix metalloproteinase activity in idiopathic interstitial pneumonias Am. J. Respir. Crit. Care Med. 162 2000 1949 1956 10.1164/ajrccm.162.5.9906096 Suga, M., Iyonaga, K., Okamoto, T., Gushima, Y., Miyakawa, H., Akaike, T. and Ando, M., 2000. Characteristic Elevation of Matrix Metalloproteinase Activity in Idiopathic Interstitial Pneumonias. American Journal of Respiratory and Critical Care Medicine. 162, 1949\u20101956. https://doi.org/10.1164/ajrccm.162.5.9906096. Sullivan et al., 2009 D.E. Sullivan M. Ferris H. Nguyen E. Abboud A.R. Brody TNF-alpha induces TGF-beta1 expression in lung fibroblasts at the transcriptional level via AP-1 activation J. Cell Mol. Med. 13 2009 1866 1876 10.1111/j.1582-4934.2009.00647.x Sullivan, D. E., Ferris, M., Nguyen, H., Abboud, E. and Brody, A. R., 2009. TNF-alpha induces TGF-beta1 expression in lung fibroblasts at the transcriptional level via AP-1 activation. J Cell Mol Med. 13, 1866\u20101876. https://doi.org/10.1111/j.1582\u20104934.2009.00647.x. Sun et al., 2020 B. Sun Y. Shi Y. Li J. Jiang S. Liang J. Duan Z. Sun Short-term PM2.5 exposure induces sustained pulmonary fibrosis development during post-exposure period in rats J. Hazard. Mater. 385 2020 121566 10.1016/j.jhazmat.2019.121566 Sun, B., Shi, Y., Li, Y., Jiang, J., Liang, S., Duan, J. and Sun, Z., 2020. Short-term PM2.5 exposure induces sustained pulmonary fibrosis development during post-exposure period in rats. Journal of Hazardous Materials. 385, 121566. https://doi.org/10.1016/j.jhazmat.2019.121566. Sun et al., 2015 C. Sun M. Chu W. Chen G. Jin J. Gong M. Zhu J. Yuan J. Dai M. Wang Y. Pan Y. Song X. Ding M. Du J. Dong Z. Zhang Z. Hu T. Wu H. Shen Genetic variants of H2AX gene were associated with PM2.5-modulated DNA damage levels in Chinese Han populations Mutat. Res. 778 41\u201345 2015 10.1016/j.mrfmmm.2015.05.007 Sun, C., Chu, M., Chen, W., Jin, G., Gong, J., Zhu, M., Yuan, J., Dai, J., Wang, M., Pan, Y., Song, Y., Ding, X., Du, M., Dong, J., Zhang, Z., Hu, Z., Wu, T. and Shen, H., 2015. Genetic variants of H2AX gene were associated with PM2.5-modulated DNA damage levels in Chinese Han populations. Mutat Res. 778, 41\u201045. https://doi.org/10.1016/j.mrfmmm.2015.05.007. Sun et al., 2018 J. Sun Z. Shen Y. Zeng X. Niu J. Wang J. Cao X. Gong H. Xu T. Wang H. Liu L. Yang Characterization and cytotoxicity of PAHs in PM(2.5) emitted from residential solid fuel burning in the Guanzhong Plain, China Environ. Pollut. (Barking, Essex: 1987) 241 2018 359 368 10.1016/j.envpol.2018.05.076 Sun, J., Shen, Z., Zeng, Y., Niu, X., Wang, J., Cao, J., Gong, X., Xu, H., Wang, T., Liu, H. and Yang, L., 2018. Characterization and cytotoxicity of PAHs in PM(2.5) emitted from residential solid fuel burning in the Guanzhong Plain, China. Environmental pollution (Barking, Essex: 1987). 241, 359\u2010368. https://doi.org/10.1016/j.envpol.2018.05.076. Tarantini et al., 2009 L. Tarantini M. Bonzini P. Apostoli V. Pegoraro V. Bollati B. Marinelli L. Cantone G. Rizzo L. Hou J. Schwartz P.A. Bertazzi A. Baccarelli Effects of particulate matter on genomic DNA methylation content and iNOS promoter methylation Environ. Health Perspect. 117 2009 217 222 10.1289/ehp.11898 Tarantini, L., Bonzini, M., Apostoli, P., Pegoraro, V., Bollati, V., Marinelli, B., Cantone, L., Rizzo, G., Hou, L., Schwartz, J., Bertazzi, P. A. and Baccarelli, A., 2009. Effects of particulate matter on genomic DNA methylation content and iNOS promoter methylation. Environ Health Perspect. 117, 217\u2010222. https://doi.org/10.1289/ehp.11898. Thacker, 2006 E.L. Thacker Lung inflammatory responses Vet. Res. 37 2006 469 486 10.1051/vetres:2006011 Thacker, E. L., 2006. Lung inflammatory responses. Vet Res. 37, 469\u2010486. https://doi.org/10.1051/vetres:2006011. Thannickal et al., 2004 V.J. Thannickal G.B. Toews E.S. White J.P. Lynch 3rd F.J. Martinez Mechanisms of pulmonary fibrosis Annu Rev. Med. 55 2004 395 417 10.1146/annurev.med.55.091902.103810 Thannickal, V. J., Toews, G. B., White, E. S., Lynch, J. P., 3rd and Martinez, F. J., 2004. Mechanisms of pulmonary fibrosis. Annu Rev Med. 55, 395\u2010417. https://doi.org/10.1146/annurev.med.55.091902.103810. Timonen et al., 2004 K.L. Timonen G. Hoek J. Heinrich A. Bernard B. Brunekreef J. de Hartog K. H\u00e4meri A. Ibald-Mulli A. Mirme A. Peters P. Tiittanen W.G. Kreyling J. Pekkanen Daily variation in fine and ultrafine particulate air pollution and urinary concentrations of lung Clara cell protein CC16 Occup. Environ. Med. 61 2004 908 914 10.1136/oem.2004.012849 Timonen, K. L., Hoek, G., Heinrich, J., Bernard, A., Brunekreef, B., de Hartog, J., H\u00e4meri, K., Ibald-Mulli, A., Mirme, A., Peters, A., Tiittanen, P., Kreyling, W. G. and Pekkanen, J., 2004. Daily variation in fine and ultrafine particulate air pollution and urinary concentrations of lung Clara cell protein CC16. Occup Environ Med. 61, 908\u2010914. https://doi.org/10.1136/oem.2004.012849. Van Miert et al., 2005 E. Van Miert X. Dumont A. Bernard CC16 as a marker of lung epithelial hyperpermeability in an acute model of rats exposed to mainstream cigarette smoke Toxicol. Lett. 159 2005 115 123 10.1016/j.toxlet.2005.05.007 Van Miert, E., Dumont, X. and Bernard, A., 2005. CC16 as a marker of lung epithelial hyperpermeability in an acute model of rats exposed to mainstream cigarette smoke. Toxicol Lett. 159, 115\u2010123. https://doi.org/10.1016/j.toxlet.2005.05.007. Vattanasit et al., 2014 U. Vattanasit P. Navasumrit M.B. Khadka J. Kanitwithayanun J. Promvijit H. Autrup M. Ruchirawat Oxidative DNA damage and inflammatory responses in cultured human cells and in humans exposed to traffic-related particles Int. J. Hyg. Environ. Health 217 2014 23 33 10.1016/j.ijheh.2013.03.002 Vattanasit, U., Navasumrit, P., Khadka, M. B., Kanitwithayanun, J., Promvijit, J., Autrup, H. and Ruchirawat, M., 2014. Oxidative DNA damage and inflammatory responses in cultured human cells and in humans exposed to traffic-related particles. International Journal of Hygiene and Environmental Health. 217, 23\u201033. https://doi.org/10.1016/j.ijheh.2013.03.002. Vaughan et al., 2003 J. Vaughan L. Ngamtrakulpanit T.N. Pajewski R. Turner T.A. Nguyen A. Smith P. Urban S. Hom B. Gaston J. Hunt Exhaled breath condensate pH is a robust and reproducible assay of airway acidity Eur. Respir. J. 22 2003 889 894 10.1183/09031936.03.00038803 Vaughan, J., Ngamtrakulpanit, L., Pajewski, T. N., Turner, R., Nguyen, T. A., Smith, A., Urban, P., Hom, S., Gaston, B. and Hunt, J., 2003. Exhaled breath condensate pH is a robust and reproducible assay of airway acidity. Eur Respir J. 22, 889\u2010894. https://doi.org/10.1183/09031936.03.00038803. Verma et al., 2015 V. Verma T. Fang L. Xu R.E. Peltier A.G. Russell N.L. Ng R.J. Weber Organic aerosols associated with the generation of reactive oxygen species (ROS) by water-soluble PM2.5 Environ. Sci. Technol. 49 2015 4646 4656 10.1021/es505577w Verma, V., Fang, T., Xu, L., Peltier, R. E., Russell, A. G., Ng, N. L. and Weber, R. J., 2015. Organic aerosols associated with the generation of reactive oxygen species (ROS) by water-soluble PM2.5. Environ Sci Technol. 49, 4646\u20104656. https://doi.org/10.1021/es505577w. Verma et al., 2012 V. Verma R. Rico-Martinez N. Kotra L. King J. Liu T.W. Snell R.J. Weber Contribution of water-soluble and insoluble components and their hydrophobic/hydrophilic subfractions to the reactive oxygen species-generating potential of fine ambient aerosols Environ. Sci. Technol. 46 2012 11384 11392 10.1021/es302484r Verma, V., Rico-Martinez, R., Kotra, N., King, L., Liu, J., Snell, T. W. and Weber, R. J., 2012. Contribution of water-soluble and insoluble components and their hydrophobic/hydrophilic subfractions to the reactive oxygen species-generating potential of fine ambient aerosols. Environ Sci Technol. 46, 11384\u201011392. https://doi.org/10.1021/es302484r. Vineis et al., 2013 P. Vineis K. van Veldhoven M. Chadeau-Hyam T.J. Athersuch Advancing the application of omics-based biomarkers in environmental epidemiology Environ. Mol. Mutagen 54 2013 461 467 10.1002/em.21764 Vineis, P., van Veldhoven, K., Chadeau-Hyam, M. and Athersuch, T. J., 2013. Advancing the application of omics-based biomarkers in environmental epidemiology. Environ Mol Mutagen. 54, 461\u2010467. https://doi.org/10.1002/em.21764. Wang et al., 2020a B. Wang R. Li Y. Cai B. Li S. Qin K. Zheng M. Zeng F. Xiao Z. Zhang X. Xu Alteration of DNA methylation induced by PM2.5 in human bronchial epithelial cells Toxicol. Res. 9 2020 552 560 10.1093/toxres/tfaa061 Wang, B., Li, R., Cai, Y., Li, B., Qin, S., Zheng, K., Zeng, M., Xiao, F., Zhang, Z. and Xu, X., 2020a. Alteration of DNA methylation induced by PM2.5 in human bronchial epithelial cells. Toxicology research. 9, 552\u2010560. https://doi.org/10.1093/toxres/tfaa061. Wang et al., 2017 C. Wang J. Cai R. Chen J. Shi C. Yang H. Li Z. Lin X. Meng C. Liu Y. Niu Y. Xia Z. Zhao W. Li H. Kan Personal exposure to fine particulate matter, lung function and serum club cell secretory protein (Clara) Environ. Pollut. 225 2017 450 455 10.1016/j.envpol.2017.02.068 Wang, C., Cai, J., Chen, R., Shi, J., Yang, C., Li, H., Lin, Z., Meng, X., Liu, C., Niu, Y., Xia, Y., Zhao, Z., Li, W. and Kan, H., 2017. Personal exposure to fine particulate matter, lung function and serum club cell secretory protein (Clara). Environmental Pollution. 225, 450\u2010455. https://doi.org/10.1016/j.envpol.2017.02.068. Wang et al., 2018a C. Wang R. Chen M. Shi J. Cai J. Shi C. Yang H. Li Z. Lin X. Meng C. Liu Y. Niu Y. Xia Z. Zhao H. Kan C.R. Weinberg Possible mediation by methylation in acute inflammation following personal exposure to fine particulate air pollution Am. J. Epidemiol. 187 2018 484 493 10.1093/aje/kwx277 Wang, C., Chen, R., Shi, M., Cai, J., Shi, J., Yang, C., Li, H., Lin, Z., Meng, X., Liu, C., Niu, Y., Xia, Y., Zhao, Z., Kan, H. and Weinberg, C. R., 2018a. Possible Mediation by Methylation in Acute Inflammation Following Personal Exposure to Fine Particulate Air Pollution. Am J Epidemiol. 187, 484\u2010493. https://doi.org/10.1093/aje/kwx277. Wang et al., 2015a G. Wang J. Zhao R. Jiang W. Song Rat lung response to ozone and fine particulate matter (PM2.5) exposures Environ. Toxicol. 30 2015 343 356 10.1002/tox.21912 Wang, G., Zhao, J., Jiang, R. and Song, W., 2015a. Rat lung response to ozone and fine particulate matter (PM2.5) exposures. Environ Toxicol. 30, 343\u2010356. https://doi.org/10.1002/tox.21912. Wang et al., 2019a L. Wang J. Xu H. Liu J. Li H. Hao PM2.5 inhibits SOD1 expression by up-regulating microRNA-206 and promotes ROS accumulation and disease progression in asthmatic mice Int. Immunopharmacol. 76 2019 105871 10.1016/j.intimp.2019.105871 Wang, L., Xu, J., Liu, H., Li, J. and Hao, H., 2019a. PM2.5 inhibits SOD1 expression by up-regulating microRNA-206 and promotes ROS accumulation and disease progression in asthmatic mice. Int Immunopharmacol. 76, 105871. https://doi.org/10.1016/j.intimp.2019.105871. Wang et al., 2015b T. Wang W. Feng D. Kuang Q. Deng W. Zhang S. Wang M. He X. Zhang T. Wu H. Guo The effects of heavy metals and their interactions with polycyclic aromatic hydrocarbons on the oxidative stress among coke-oven workers Environ. Res. 140 2015 405 413 10.1016/j.envres.2015.04.013 Wang, T., Feng, W., Kuang, D., Deng, Q., Zhang, W., Wang, S., He, M., Zhang, X., Wu, T. and Guo, H., 2015b. The effects of heavy metals and their interactions with polycyclic aromatic hydrocarbons on the oxidative stress among coke-oven workers. Environmental Research. 140, 405\u2010413. https://doi.org/10.1016/j.envres.2015.04.013. Wang et al., 2018b Y. Wang H. Duan T. Meng M. Shen Q. Ji J. Xing Q. Wang T. Wang Y. Niu T. Yu Z. Liu H. Jia Y. Zhan W. Chen Z. Zhang W. Su Y. Dai X. Zhang Y. Zheng Reduced serum club cell protein as a pulmonary damage marker for chronic fine particulate matter exposure in Chinese population Environ. Int. 112 2018 207 217 10.1016/j.envint.2017.12.024 Wang, Y., Duan, H., Meng, T., Shen, M., Ji, Q., Xing, J., Wang, Q., Wang, T., Niu, Y., Yu, T., Liu, Z., Jia, H., Zhan, Y., Chen, W., Zhang, Z., Su, W., Dai, Y., Zhang, X. and Zheng, Y., 2018b. Reduced serum club cell protein as a pulmonary damage marker for chronic fine particulate matter exposure in Chinese population. Environment International. 112, 207\u2010217. https://doi.org/10.1016/j.envint.2017.12.024. Wang et al., 2019b Y. Wang Y. Zhong T. Hou J. Liao C. Zhang C. Sun G. Wang PM2.5 induces EMT and promotes CSC properties by activating Notch pathway in vivo and vitro Ecotoxicol. Environ. Saf. 178 2019 159 167 10.1016/j.ecoenv.2019.03.086 Wang, Y., Zhong, Y., Hou, T., Liao, J., Zhang, C., Sun, C. and Wang, G., 2019b. PM2.5 induces EMT and promotes CSC properties by activating Notch pathway in vivo and vitro. Ecotoxicol Environ Saf. 178, 159\u2010167. https://doi.org/10.1016/j.ecoenv.2019.03.086. Wang et al., 2020b Y. Wang Y. Zhong C. Zhang J. Liao G. Wang PM2.5 downregulates MicroRNA-139-5p and induces EMT in Bronchiolar Epithelium Cells by targeting Notch1 J. Cancer 11 2020 5758 5767 10.7150/jca.46976 Wang, Y., Zhong, Y., Zhang, C., Liao, J. and Wang, G., 2020b. PM2.5 downregulates MicroRNA\u2010139\u20105p and induces EMT in Bronchiolar Epithelium Cells by targeting Notch1. J Cancer. 11, 5758\u20105767. https://doi.org/10.7150/jca.46976. Wei et al., 2017 H. Wei F. Liang W. Cheng R. Zhou X. Wu Y. Feng Y. Wang The mechanisms for lung cancer risk of PM(2.5): Induction of epithelial-mesenchymal transition and cancer stem cell properties in human non-small cell lung cancer cells Environ. Toxicol. 32 2017 2341 2351 10.1002/tox.22437 Wei, H., Liang, F., Cheng, W., Zhou, R., Wu, X., Feng, Y. and Wang, Y., 2017. The mechanisms for lung cancer risk of PM(2.5): Induction of epithelial-mesenchymal transition and cancer stem cell properties in human non-small cell lung cancer cells. Environmental toxicology. 32, 2341\u20102351. https://doi.org/10.1002/tox.22437. Wei et al., 2009 Y. Wei I.-K. Han M. Shao M. Hu J. Zhang X. Tang PM2.5 constituents and oxidative DNA damage in humans Environ. Sci. Technol. 43 2009 4757 4762 10.1021/es803337c Wei, Y., Han, I.-K., Shao, M., Hu, M., Zhang, J. and Tang, X., 2009. PM2.5 Constituents and Oxidative DNA Damage in Humans. Environmental Science & Technology. 43, 4757\u20104762. https://doi.org/10.1021/es803337c. Wei et al., 2013 Y. Wei Z. Wang C.Y. Chang T. Fan L. Su F. Chen D.C. Christiani Global metabolomic profiling reveals an association of metal fume exposure and plasma unsaturated fatty acids PLoS One 8 2013 e77413 10.1371/journal.pone.0077413 Wei, Y., Wang, Z., Chang, C. Y., Fan, T., Su, L., Chen, F. and Christiani, D. C., 2013. Global metabolomic profiling reveals an association of metal fume exposure and plasma unsaturated fatty acids. PLoS One. 8, e77413. https://doi.org/10.1371/journal.pone.0077413. Wessels et al., 2010 A. Wessels W. Birmili C. Albrecht B. Hellack E. Jermann G. Wick R.M. Harrison R.P. Schins Oxidant generation and toxicity of size-fractionated ambient particles in human lung epithelial cells Environ. Sci. Technol. 44 2010 3539 3545 10.1021/es9036226 Wessels, A., Birmili, W., Albrecht, C., Hellack, B., Jermann, E., Wick, G., Harrison, R. M. and Schins, R. P., 2010. Oxidant generation and toxicity of size-fractionated ambient particles in human lung epithelial cells. Environ Sci Technol. 44, 3539\u20103545. https://doi.org/10.1021/es9036226. Westberg et al., 2016 H. Westberg K. Elihn E. Andersson B. Persson L. Andersson I.-L. Bryngelsson C. Karlsson B. Sj\u00f6gren Inflammatory markers and exposure to airborne particles among workers in a Swedish pulp and paper mill Int. Arch. Occup. Environ. Health 89 2016 813 822 10.1007/s00420-016-1119-5 Westberg, H., Elihn, K., Andersson, E., Persson, B., Andersson, L., Bryngelsson, I.-L., Karlsson, C. and Sj\u00f6gren, B., 2016. Inflammatory markers and exposure to airborne particles among workers in a Swedish pulp and paper mill. Int Arch Occup Environ Health. 89, 813\u2010822. https://doi.org/10.1007/s00420\u2010016\u20101119\u20105. Willis and Borok, 2007 B.C. Willis Z. Borok TGF-beta-induced EMT: mechanisms and implications for fibrotic lung disease Am. J. Physiol. Lung Cell. Mol. Physiol. 293 2007 L525 L534 10.1152/ajplung.00163.2007 Willis, B. C. and Borok, Z., 2007. TGF-beta-induced EMT: mechanisms and implications for fibrotic lung disease. American journal of physiology. Lung cellular and molecular physiology. 293, L525-L534. https://doi.org/10.1152/ajplung.00163.2007. Wu et al., 2017a J. Wu Y. Shi C.O. Asweto L. Feng X. Yang Y. Zhang H. Hu J. Duan Z. Sun Fine particle matters induce DNA damage and G2/M cell cycle arrest in human bronchial epithelial BEAS-2B cells Environ. Sci. Pollut. Res. Int. 24 2017 25071 25081 10.1007/s11356-017-0090-3 Wu, J., Shi, Y., Asweto, C. O., Feng, L., Yang, X., Zhang, Y., Hu, H., Duan, J. and Sun, Z., 2017a. Fine particle matters induce DNA damage and G2/M cell cycle arrest in human bronchial epithelial BEAS-2B cells. Environmental science and pollution research international. 24, 25071\u201025081. https://doi.org/10.1007/s11356\u2010017\u20100090\u20103. Wu et al., 2014 S. Wu F. Deng Y. Hao X. Wang C. Zheng H. Lv X. Lu H. Wei J. Huang Y. Qin M. Shima X. Guo Fine particulate matter, temperature, and lung function in healthy adults: findings from the HVNR study Chemosphere 108 2014 168 174 10.1016/j.chemosphere.2014.01.032 Wu, S., Deng, F., Hao, Y., Wang, X., Zheng, C., Lv, H., Lu, X., Wei, H., Huang, J., Qin, Y., Shima, M. and Guo, X., 2014. Fine particulate matter, temperature, and lung function in healthy adults: findings from the HVNR study. Chemosphere. 108, 168\u2010174. https://doi.org/10.1016/j.chemosphere.2014.01.032. Wu et al., 2017b X. Wu J. Lintelmann S. Klingbeil J. Li H. Wang E. Kuhn S. Ritter R. Zimmermann Determination of air pollution-related biomarkers of exposure in urine of travellers between Germany and China using liquid chromatographic and liquid chromatographic-mass spectrometric methods: a pilot study Biomarkers 22 2017 525 536 10.1080/1354750x.2017.1306753 Wu, X., Lintelmann, J., Klingbeil, S., Li, J., Wang, H., Kuhn, E., Ritter, S. and Zimmermann, R., 2017b. Determination of air pollution-related biomarkers of exposure in urine of travellers between Germany and China using liquid chromatographic and liquid chromatographic-mass spectrometric methods: a pilot study. Biomarkers. 22, 525\u2010536. https://doi.org/10.1080/1354750x.2017.1306753. Wuyts et al., 2013 W.A. Wuyts C. Agostini K.M. Antoniou D. Bouros R.C. Chambers V. Cottin J.J. Egan B.N. Lambrecht R. Lories H. Parfrey A. Prasse C. Robalo-Cordeiro E. Verbeken J.A. Verschakelen A.U. Wells G.M. Verleden The pathogenesis of pulmonary fibrosis: a moving target Eur. Respir. J. 41 2013 1207 10.1183/09031936.00073012 Wuyts, W. A., Agostini, C., Antoniou, K. M., Bouros, D., Chambers, R. C., Cottin, V., Egan, J. J., Lambrecht, B. N., Lories, R., Parfrey, H., Prasse, A., Robalo-Cordeiro, C., Verbeken, E., Verschakelen, J. A., Wells, A. U. and Verleden, G. M., 2013. The pathogenesis of pulmonary fibrosis: a moving target. European Respiratory Journal. 41, 1207. https://doi.org/10.1183/09031936.00073012. Wynn, 2011 T.A. Wynn Integrating mechanisms of pulmonary fibrosis J. Exp. Med. 208 2011 1339 1350 10.1084/jem.20110551 Wynn, T. A., 2011. Integrating mechanisms of pulmonary fibrosis, J Exp Med. 208, 1339\u20101350. https://doi.org/10.1084/jem.20110551. Xing et al., 2020 X. Xing L. Hu Y. Guo M.S. Bloom S. Li G. Chen S.H.L. Yim N. Gurram M. Yang X. Xiao S. Xu Q. Wei H. Yu B. Yang X. Zeng W. Chen Q. Hu G. Dong Interactions between ambient air pollution and obesity on lung function in children: The Seven Northeastern Chinese Cities (SNEC) Study Sci. Total Environ. 699 2020 134397 10.1016/j.scitotenv.2019.134397 Xing, X., Hu, L., Guo, Y., Bloom, M. S., Li, S., Chen, G., Yim, S. H. L., Gurram, N., Yang, M., Xiao, X., Xu, S., Wei, Q., Yu, H., Yang, B., Zeng, X., Chen, W., Hu, Q. and Dong, G., 2020. Interactions between ambient air pollution and obesity on lung function in children: The Seven Northeastern Chinese Cities (SNEC) Study. The Science of the total environment. 699, 134397. https://doi.org/10.1016/j.scitotenv.2019.134397. Xing et al., 2016 Y.F. Xing Y.H. Xu M.H. Shi Y.X. Lian The impact of PM2.5 on the human respiratory system J. Thorac. Dis. 8 E69\u201374 2016 10.3978/j.issn.2072-1439.2016.01.19 Xing, Y. F., Xu, Y. H., Shi, M. H. and Lian, Y. X., 2016. The impact of PM2.5 on the human respiratory system. J Thorac Dis. 8, E69\u201074. https://doi.org/10.3978/j.issn.2072\u20101439.2016.01.19. Xu et al., 2019a Z. Xu W. Ding X. Deng PM(2.5), fine particulate matter: a novel player in the epithelial-mesenchymal transition? Front Physiol. 10 2019 1404 10.3389/fphys.2019.01404 Xu, Z., Ding, W. and Deng, X., 2019a. PM(2.5), Fine Particulate Matter: A Novel Player in the Epithelial-Mesenchymal Transition? Front Physiol. 10, 1404. https://doi.org/10.3389/fphys.2019.01404. Xu et al., 2019b Z. Xu Z. Li Z. Liao S. Gao L. Hua X. Ye Y. Wang S. Jiang N. Wang D. Zhou X. Deng PM2.5 induced pulmonary fibrosis in vivo and in vitro Ecotoxicol. Environ. Saf. 171 2019 112 121 10.1016/j.ecoenv.2018.12.061 Xu, Z., Li, Z., Liao, Z., Gao, S., Hua, L., Ye, X., Wang, Y., Jiang, S., Wang, N., Zhou, D. and Deng, X., 2019b. PM2.5 induced pulmonary fibrosis in vivo and in vitro. Ecotoxicology and Environmental Safety. 171, 112\u2010121. https://doi.org/10.1016/j.ecoenv.2018.12.061. Yang et al., 2018a B. Yang J. Guo C. Xiao Effect of PM2.5 environmental pollution on rat lung Environ. Sci. Pollut. Res. Int. 25 2018 36136 36146 10.1007/s11356-018-3492-y Yang, B., Guo, J. and Xiao, C., 2018a. Effect of PM2.5 environmental pollution on rat lung. Environmental science and pollution research international. 25, 36136\u201036146. https://doi.org/10.1007/s11356\u2010018\u20103492\u2010y. Yang et al., 2018b L. Yang Z. Duan X. Liu Y. Yuan N-acetyl-l-cysteine ameliorates the PM(2.5)-induced oxidative stress by regulating SIRT-1 in rats Environ. Toxicol. Pharm. 57 2018 70 75 10.1016/j.etap.2017.11.011 Yang, L., Duan, Z., Liu, X. and Yuan, Y., 2018b. N-acetyl-l-cysteine ameliorates the PM(2.5)-induced oxidative stress by regulating SIRT-1 in rats. Environ Toxicol Pharmacol. 57, 70\u201075. https://doi.org/10.1016/j.etap.2017.11.011. Yang et al., 2017 L. Yang X.Y. Hou Y. Wei P. Thai F. Chai Biomarkers of the health outcomes associated with ambient particulate matter exposure Sci. Total Environ. 579 2017 1446 1459 10.1016/j.scitotenv.2016.11.146 Yang, L., Hou, X. Y., Wei, Y., Thai, P. and Chai, F., 2017. Biomarkers of the health outcomes associated with ambient particulate matter exposure. The Science of the total environment. 579, 1446\u20101459. https://doi.org/10.1016/j.scitotenv.2016.11.146. Yang et al., 2020 L. Yang G. Liu L. Fu W. Zhong X. Li Q. Pan DNA repair enzyme OGG1 promotes alveolar progenitor cell renewal and relieves PM2.5-induced lung injury and fibrosis Ecotoxicol. Environ. Saf. 205 2020 111283 10.1016/j.ecoenv.2020.111283 Yang, L., Liu, G., Fu, L., Zhong, W., Li, X. and Pan, Q., 2020. DNA repair enzyme OGG1 promotes alveolar progenitor cell renewal and relieves PM2.5-induced lung injury and fibrosis. Ecotoxicol Environ Saf. 205, 111283. https://doi.org/10.1016/j.ecoenv.2020.111283. Yang et al., 2016 L. Yang G. Liu Z. Lin Y. Wang H. He T. Liu D.W. Kamp Pro-inflammatory response and oxidative stress induced by specific components in ambient particulate matter in human bronchial epithelial cells Environ. Toxicol. 31 2016 923 936 10.1002/tox.22102 Yang, L., Liu, G., Lin, Z., Wang, Y., He, H., Liu, T. and Kamp, D. W., 2016. Pro-inflammatory response and oxidative stress induced by specific components in ambient particulate matter in human bronchial epithelial cells. Environmental Toxicology. 31, 923\u2010936. https://doi.org/10.1002/tox.22102. Yang et al., 2015 L. Yang Y. Wang Z. Lin X. Zhou T. Chen H. He H. Huang T. Yang Y. Jiang W. Xu W. Yao T. Liu G. Liu Mitochondrial OGG1 protects against PM2.5-induced oxidative DNA damage in BEAS-2B cells Exp. Mol. Pathol. 99 2015 365 373 10.1016/j.yexmp.2015.08.005 Yang, L., Wang, Y., Lin, Z., Zhou, X., Chen, T., He, H., Huang, H., Yang, T., Jiang, Y., Xu, W., Yao, W., Liu, T. and Liu, G., 2015. Mitochondrial OGG1 protects against PM2.5-induced oxidative DNA damage in BEAS-2B cells. Experimental and Molecular Pathology. 99, 365\u2010373. https://doi.org/10.1016/j.yexmp.2015.08.005. Yin et al., 2020 P. Yin M. Brauer A.J. Cohen H. Wang J. Li R.T. Burnett J.D. Stanaway K. Causey S. Larson W. Godwin J. Frostad A. Marks L. Wang M. Zhou C.J.L. Murray The effect of air pollution on deaths, disease burden, and life expectancy across China and its provinces, 1990-2017: an analysis for the Global Burden of Disease Study 2017 Lancet Planet Health 4 2020 e386 e398 10.1016/s2542-5196(20)30161-3 Yin, P., Brauer, M., Cohen, A. J., Wang, H., Li, J., Burnett, R. T., Stanaway, J. D., Causey, K., Larson, S., Godwin, W., Frostad, J., Marks, A., Wang, L., Zhou, M. and Murray, C. J. L., 2020. The effect of air pollution on deaths, disease burden, and life expectancy across China and its provinces, 1990\u20102017: an analysis for the Global Burden of Disease Study 2017. Lancet Planet Health. 4, e386-e398. https://doi.org/10.1016/s2542\u20105196(20)30161\u20103. Zanolin et al., 2015 M.E. Zanolin P. Girardi P. Degan M. Rava M. Olivieri G. Di Gennaro M. Nicolis R. De Marco Measurement of a urinary marker (8-hydroxydeoxy-guanosine, 8-OHdG) of DNA oxidative stress in epidemiological surveys: a pilot study Int J. Biol. Markers 30 2015 e341 e345 10.5301/jbm.5000129 Zanolin, M. E., Girardi, P., Degan, P., Rava, M., Olivieri, M., Di Gennaro, G., Nicolis, M. and De Marco, R., 2015. Measurement of a urinary marker (8-hydroxydeoxy-guanosine, 8-OHdG) of DNA oxidative stress in epidemiological surveys: a pilot study. Int J Biol Markers. 30, e341-e345. https://doi.org/10.5301/jbm.5000129. Zhang et al., 2018 J.-B. Zhang L. Zhang S.-Q. Li A.-H. Hou W.-C. Liu L.-L. Dai Tubeimoside I attenuates inflammation and oxidative damage in a mice model of PM(2.5)-induced pulmonary injury Exp. Ther. Med. 15 2018 1602 1607 10.3892/etm.2017.5597 Zhang, J.-B., Zhang, L., Li, S.-Q., Hou, A.-H., Liu, W.-C. and Dai, L.-L., 2018. Tubeimoside I attenuates inflammation and oxidative damage in a mice model of PM(2.5)-induced pulmonary injury. Exp Ther Med. 15, 1602\u20101607. https://doi.org/10.3892/etm.2017.5597. Zhang et al., 2017 L.P. Zhang X. Zhang H.W. Duan T. Meng Y. Niu C.F. Huang W.M. Gao S.F. Yu Y.X. Zheng Long-term exposure to diesel engine exhaust induced lung function decline in a cross sectional study Ind. Health 55 2017 13 26 10.2486/indhealth.2016-0031 Zhang, L. P., Zhang, X., Duan, H. W., Meng, T., Niu, Y., Huang, C. F., Gao, W. M., Yu, S. F. and Zheng, Y. X., 2017. Long-term exposure to diesel engine exhaust induced lung function decline in a cross sectional study. Ind Health. 55, 13\u201026. https://doi.org/10.2486/indhealth.2016\u20100031. Zhang et al., 2013 R. Zhang K.A. Kang K.C. Kim S.Y. Na W.Y. Chang G.Y. Kim H.S. Kim J.W. Hyun Oxidative stress causes epigenetic alteration of CDX1 expression in colorectal cancer cells Gene 524 2013 214 219 10.1016/j.gene.2013.04.024 Zhang, R., Kang, K. A., Kim, K. C., Na, S. Y., Chang, W. Y., Kim, G. Y., Kim, H. S. and Hyun, J. W., 2013. Oxidative stress causes epigenetic alteration of CDX1 expression in colorectal cancer cells. Gene. 524, 214\u2010219. https://doi.org/10.1016/j.gene.2013.04.024. Zhang et al., 2019 R. Zhang F. Zhang Z. Sun P. Liu X. Zhang Y. Ye B. Cai M.J. Walsh X. Ren X. Hao W. Zhang J. Yu LINE-1 retrotransposition promotes the development and progression of lung squamous cell carcinoma by disrupting the tumor-suppressor gene FGGY Cancer Res. 79 2019 4453 4465 10.1158/0008-5472.Can-19-0076 Zhang, R., Zhang, F., Sun, Z., Liu, P., Zhang, X., Ye, Y., Cai, B., Walsh, M. J., Ren, X., Hao, X., Zhang, W. and Yu, J., 2019. LINE-1 Retrotransposition Promotes the Development and Progression of Lung Squamous Cell Carcinoma by Disrupting the Tumor-Suppressor Gene FGGY. Cancer Res. 79, 4453\u20104465. https://doi.org/10.1158/0008\u20105472.Can\u201019\u20100076. Zhang et al., 2016 X. Zhang N. Staimer D.L. Gillen T. Tjoa J.J. Schauer M.M. Shafer S. Hasheminassab P. Pakbin N.D. Vaziri C. Sioutas R.J. Delfino Associations of oxidative stress and inflammatory biomarkers with chemically-characterized air pollutant exposures in an elderly cohort Environ. Res. 150 2016 306 319 10.1016/j.envres.2016.06.019 Zhang, X., Staimer, N., Gillen, D. L., Tjoa, T., Schauer, J. J., Shafer, M. M., Hasheminassab, S., Pakbin, P., Vaziri, N. D., Sioutas, C. and Delfino, R. J., 2016. Associations of oxidative stress and inflammatory biomarkers with chemically-characterized air pollutant exposures in an elderly cohort. Environ Res. 150, 306\u2010319. https://doi.org/10.1016/j.envres.2016.06.019. Zhang et al., 2015 Y. Zhang Z. Yang R. Li H. Geng C. Dong Investigation of fine chalk dust particles\u2019 chemical compositions and toxicities on alveolar macrophages in vitro Chemosphere 120 2015 500 506 10.1016/j.chemosphere.2014.09.009 Zhang, Y., Yang, Z., Li, R., Geng, H. and Dong, C., 2015. Investigation of fine chalk dust particles\u2019 chemical compositions and toxicities on alveolar macrophages in vitro. Chemosphere. 120, 500\u2010506. https://doi.org/10.1016/j.chemosphere.2014.09.009. Zhao et al., 2019a C. Zhao L. Zhu R. Li H. Wang Z. Cai Omics approach reveals metabolic disorders associated with the cytotoxicity of airborne particulate matter in human lung carcinoma cells Environ. Pollut. 246 2019 45 52 10.1016/j.envpol.2018.11.108 Zhao, C., Zhu, L., Li, R., Wang, H. and Cai, Z., 2019a. Omics approach reveals metabolic disorders associated with the cytotoxicity of airborne particulate matter in human lung carcinoma cells. Environmental Pollution. 246, 45\u201052. https://doi.org/10.1016/j.envpol.2018.11.108. Zhao et al., 2015 J. Zhao L. Bo C. Gong P. Cheng H. Kan Y. Xie W. Song Preliminary study to explore gene-PM2.5 interactive effects on respiratory system in traffic policemen Int J. Occup. Med. Environ. Health 28 2015 971 983 10.13075/ijomeh.1896.00370 Zhao, J., Bo, L., Gong, C., Cheng, P., Kan, H., Xie, Y. and Song, W., 2015. Preliminary study to explore gene-PM2.5 interactive effects on respiratory system in traffic policemen. Int J Occup Med Environ Health. 28, 971\u2010983. https://doi.org/10.13075/ijomeh.1896.00370. Zhao et al., 2019b J. Zhao M. Li Z. Wang J. Chen J. Zhao Y. Xu X. Wei J. Wang J. Xie Role of PM(2.5) in the development and progression of COPD and its mechanisms Respir. Res. 20 2019 120 10.1186/s12931-019-1081-3 Zhao, J., Li, M., Wang, Z., Chen, J., Zhao, J., Xu, Y., Wei, X., Wang, J. and Xie, J., 2019b. Role of PM(2.5) in the development and progression of COPD and its mechanisms. Respir Res. 20, 120\u2010120. https://doi.org/10.1186/s12931\u2010019\u20101081\u20103. Zhao et al., 2014 L. Zhao Y. Song J. Pu J. Guo Y. Wang Z. Chen T. Chen Y. Gu G. Jia Effects of repeated Cr(VI) intratracheal instillation on club (Clara) cells and activation of nuclear factor-kappa B pathway via oxidative stress Toxicol. Lett. 231 2014 72 81 10.1016/j.toxlet.2014.09.011 Zhao, L., Song, Y., Pu, J., Guo, J., Wang, Y., Chen, Z., Chen, T., Gu, Y. and Jia, G., 2014. Effects of repeated Cr(VI) intratracheal instillation on club (Clara) cells and activation of nuclear factor-kappa B pathway via oxidative stress. Toxicol Lett. 231, 72\u201081. https://doi.org/10.1016/j.toxlet.2014.09.011. Zhao et al., 2021 X. Zhao A. Abulikemu S. Lv Y. Qi J. Duan J. Zhang R. Chen C. Guo Y. Li Z. Sun Oxidative stress- and mitochondrial dysfunction-mediated cytotoxicity by silica nanoparticle in lung epithelial cells from metabolomic perspective Chemosphere 275 2021 129969 10.1016/j.chemosphere.2021.129969 Zhao, X., Abulikemu, A., Lv, S., Qi, Y., Duan, J., Zhang, J., Chen, R., Guo, C., Li, Y. and Sun, Z., 2021. Oxidative stress- and mitochondrial dysfunction-mediated cytotoxicity by silica nanoparticle in lung epithelial cells from metabolomic perspective. Chemosphere. 275, 129969. https://doi.org/10.1016/j.chemosphere.2021.129969. Zhao et al., 2018 Y. Zhao G. Xu S. Wang X. Yi W. Wu Chitosan oligosaccharides alleviate PM2.5-induced lung inflammation in rats Environ. Sci. Pollut. Res. 25 2018 34221 34227 10.1007/s11356-018-3365-4 Zhao, Y., Xu, G., Wang, S., Yi, X. and Wu, W., 2018. Chitosan oligosaccharides alleviate PM2.5-induced lung inflammation in rats. Environmental Science and Pollution Research. 25, 34221\u201034227. https://doi.org/10.1007/s11356\u2010018\u20103365\u20104. Zhao et al., 2019c Y. Zhao H. Zhang X. Yang Y. Zhang S. Feng X. Yan Fine particulate matter (PM2.5) enhances airway hyperresponsiveness (AHR) by inducing necroptosis in BALB/c mice Environ. Toxicol. Pharmacol. 68 2019 155 163 10.1016/j.etap.2019.03.013 Zhao, Y., Zhang, H., Yang, X., Zhang, Y., Feng, S. and Yan, X., 2019c. Fine particulate matter (PM2.5) enhances airway hyperresponsiveness (AHR) by inducing necroptosis in BALB/c mice. Environmental Toxicology and Pharmacology. 68, 155\u2010163. https://doi.org/10.1016/j.etap.2019.03.013. Zheng et al., 2017 Y. Zheng M. Sanchez-Guerra Z. Zhang B.T. Joyce J. Zhong J.K. Kresovich L. Liu W. Zhang T. Gao D. Chang C. Osorio-Yanez J.J. Carmona S. Wang J.P. McCracken X. Zhang Y. Chervona A. D\u00edaz P.A. Bertazzi P. Koutrakis C.M. Kang J. Schwartz A.A. Baccarelli L. Hou Traffic-derived particulate matter exposure and histone H3 modification: a repeated measures study Environ. Res. 153 2017 112 119 10.1016/j.envres.2016.11.015 Zheng, Y., Sanchez-Guerra, M., Zhang, Z., Joyce, B. T., Zhong, J., Kresovich, J. K., Liu, L., Zhang, W., Gao, T., Chang, D., Osorio-Yanez, C., Carmona, J. J., Wang, S., McCracken, J. P., Zhang, X., Chervona, Y., D\u00edaz, A., Bertazzi, P. A., Koutrakis, P., Kang, C. M., Schwartz, J., Baccarelli, A. A. and Hou, L., 2017. Traffic-derived particulate matter exposure and histone H3 modification: A repeated measures study. Environ Res. 153, 112\u2010119. https://doi.org/10.1016/j.envres.2016.11.015. Zhou et al., 2019a J. Zhou F. Geng J. Xu L. Peng X. Ye D. Yang J. Zhao Q. Sun PM(2.5) exposure and cold stress exacerbates asthma in mice by increasing histone acetylation in IL-4 gene promoter in CD4(+) T cells Toxicol. Lett. 316 2019 147 153 10.1016/j.toxlet.2019.09.011 Zhou, J., Geng, F., Xu, J., Peng, L., Ye, X., Yang, D., Zhao, J. and Sun, Q., 2019a. PM(2.5) exposure and cold stress exacerbates asthma in mice by increasing histone acetylation in IL-4 gene promoter in CD4(+) T cells. Toxicol Lett. 316, 147\u2010153. https://doi.org/10.1016/j.toxlet.2019.09.011. Zhou et al., 2019b L. Zhou Y. Le J. Tian X. Yang R. Jin X. Gai Y. Sun Cigarette smoke-induced RANKL expression enhances MMP-9 production by alveolar macrophages Int. J. Chron. lanObstruct Pulmon Dis. 14 2019 81 91 10.2147/copd.S190023 Zhou, L., Le, Y., Tian, J., Yang, X., Jin, R., Gai, X. and Sun, Y., 2019b. Cigarette smoke-induced RANKL expression enhances MMP-9 production by alveolar macrophages. Int J Chron lanObstruct Pulmon Dis. 14, 81\u201091. https://doi.org/10.2147/copd.S190023. Zhou et al., 2018a T. Zhou Q. Yu C. Sun Y. Wang Y. Zhong G. Wang A pilot study of blood microRNAs and lung function in young healthy adults with fine particulate matter exposure J. Thorac. Dis. 10 2018 7073 7080 10.21037/jtd.2018.12.42 Zhou, T., Yu, Q., Sun, C., Wang, Y., Zhong, Y. and Wang, G., 2018a. A pilot study of blood microRNAs and lung function in young healthy adults with fine particulate matter exposure. J Thorac Dis. 10, 7073\u20107080. https://doi.org/10.21037/jtd.2018.12.42. Zhou et al., 2018b T. Zhou Y. Zhong Y. Hu C. Sun Y. Wang G. Wang PM(2.5) downregulates miR-194-3p and accelerates apoptosis in cigarette-inflamed bronchial epithelium by targeting death-associated protein kinase 1 Int. J. Chron. Obstruct Pulmon Dis. 13 2018 2339 2349 10.2147/copd.S168629 Zhou, T., Zhong, Y., Hu, Y., Sun, C., Wang, Y. and Wang, G., 2018b. PM(2.5) downregulates miR\u2010194\u20103p and accelerates apoptosis in cigarette-inflamed bronchial epithelium by targeting death-associated protein kinase 1. Int J Chron Obstruct Pulmon Dis. 13, 2339\u20102349. https://doi.org/10.2147/copd.S168629. Zhou et al., 2016 W. Zhou D. Tian J. He Y. Wang L. Zhang L. Cui L. Jia L. Zhang L. Li Y. Shu S. Yu J. Zhao X. Yuan S. Peng Repeated PM2.5 exposure inhibits BEAS-2B cell P53 expression through ROS-Akt-DNMT3B pathway-mediated promoter hypermethylation Oncotarget 7 2016 20691 20703 10.18632/oncotarget.7842 Zhou, W., Tian, D., He, J., Wang, Y., Zhang, L., Cui, L., Jia, L., Zhang, L., Li, L., Shu, Y., Yu, S., Zhao, J., Yuan, X. and Peng, S., 2016. Repeated PM2.5 exposure inhibits BEAS-2B cell P53 expression through ROS-Akt-DNMT3B pathway-mediated promoter hypermethylation. Oncotarget. 7, 20691\u201020703. https://doi.org/10.18632/oncotarget.7842. Zhou et al., 2015 Z. Zhou Y. Liu F. Duan M. Qin F. Wu W. Sheng L. Yang J. Liu K. He Transcriptomic analyses of the biological effects of airborne PM2.5 exposure on human bronchial epithelial cells PloS One 10 2015 10.1371/journal.pone.0138267 Zhou, Z., Liu, Y., Duan, F., Qin, M., Wu, F., Sheng, W., Yang, L., Liu, J. and He, K., 2015. Transcriptomic Analyses of the Biological Effects of Airborne PM2.5 Exposure on Human Bronchial Epithelial Cells. PloS one. 10, e0138267-e0138267. https://doi.org/10.1371/journal.pone.0138267. Zhu et al., 2021 H. Zhu Y. Wu X. Kuang H. Liu Z. Guo J. Qian D. Wang M. Wang H. Chu W. Gong Z. Zhang Effect of PM(2.5) exposure on circulating fibrinogen and IL-6 levels: a systematic review and meta-analysis Chemosphere 271 2021 129565 10.1016/j.chemosphere.2021.129565 Zhu, H., Wu, Y., Kuang, X., Liu, H., Guo, Z., Qian, J., Wang, D., Wang, M., Chu, H., Gong, W. and Zhang, Z., 2021. Effect of PM(2.5) exposure on circulating fibrinogen and IL-6 levels: A systematic review and meta-analysis. Chemosphere. 271, 129565. https://doi.org/10.1016/j.chemosphere.2021.129565. Zhu et al., 2015 L. Zhu P.Y. Di R. Wu K.E. Pinkerton Y. Chen Repression of CC16 by cigarette smoke (CS) exposure PLoS One 10 2015 e0116159 10.1371/journal.pone.0116159 Zhu, L., Di, P. Y., Wu, R., Pinkerton, K. E. and Chen, Y., 2015. Repression of CC16 by cigarette smoke (CS) exposure. PLoS One. 10, e0116159. https://doi.org/10.1371/journal.pone.0116159. Zhu et al., 2019 Z. Zhu H. Wu W. Su R. Shi P. Li Y. Liao Y. Wang P. Li Effects of total flavonoids from exocarpium citri grandis on air pollution particle-induced pulmonary inflammation and oxidative stress in mice J. Food Sci. 84 2019 3843 3849 10.1111/1750-3841.14966 Zhu, Z., Wu, H., Su, W., Shi, R., Li, P., Liao, Y., Wang, Y. and Li, P., 2019. Effects of Total Flavonoids from Exocarpium Citri Grandis on Air Pollution Particle-Induced Pulmonary Inflammation and Oxidative Stress in Mice. Journal of food science. 84, 3843\u20103849. https://doi.org/10.1111/1750\u20103841.14966. Zou et al., 2016 Y. Zou C. Jin Y. Su J. Li B. Zhu Water soluble and insoluble components of urban PM2.5 and their cytotoxic effects on epithelial cells (A549) in vitro Environ. Pollut. (Barking, Essex: 1987) 212 2016 627 635 10.1016/j.envpol.2016.03.022 Zou, Y., Jin, C., Su, Y., Li, J. and Zhu, B., 2016. Water soluble and insoluble components of urban PM2.5 and their cytotoxic effects on epithelial cells (A549) in vitro. Environmental pollution (Barking, Essex: 1987). 212, 627\u2010635. https://doi.org/10.1016/j.envpol.2016.03.022. Zou et al., 2014 Y. Zou S. Li W. Zou G. Hu Y. Zhou G. Peng F. He B. Li P. Ran Upregulation of gelatinases and epithelial-mesenchymal transition in small airway remodeling associated with chronic exposure to wood smoke PLoS One 9 2014 e96708 10.1371/journal.pone.0096708 Zou, Y., Li, S., Zou, W., Hu, G., Zhou, Y., Peng, G., He, F., Li, B. and Ran, P., 2014. Upregulation of gelatinases and epithelial-mesenchymal transition in small airway remodeling associated with chronic exposure to wood smoke. PLoS One. 9, e96708. https://doi.org/10.1371/journal.pone.0096708. Zuurbier et al., 2011 M. Zuurbier G. Hoek M. Oldenwening K. Meliefste E. Krop P. van den Hazel B. Brunekreef In-traffic air pollution exposure and CC16, blood coagulation, and inflammation markers in healthy adults Environ. Health Perspect. 119 2011 1384 1389 10.1289/ehp.1003151 Zuurbier, M., Hoek, G., Oldenwening, M., Meliefste, K., Krop, E., van den Hazel, P. and Brunekreef, B., 2011. In-traffic air pollution exposure and CC16, blood coagulation, and inflammation markers in healthy adults. Environmental health perspectives. 119, 1384\u20101389. https://doi.org/10.1289/ehp.1003151.", "scopus-id": "85112377394", "coredata": {"eid": "1-s2.0-S0304389421017258", "dc:description": "Large amounts of epidemiological evidence have confirmed the atmospheric particulate matter (PM2.5) exposure was positively correlated with the morbidity and mortality of respiratory diseases. Nevertheless, its pathogenesis remains incompletely understood, probably resulting from the activation of oxidative stress, inflammation, altered genetic and epigenetic modifications in the lung upon PM2.5 exposure. Currently, biomarker investigations have been widely used in epidemiological and toxicological studies, which may help in understanding the biologic mechanisms underlying PM2.5-elicited adverse health outcomes. Here, the emerging biomarkers to indicate PM2.5-respiratory system interactions were summarized, primarily related to oxidative stress (ROS, MDA, GSH, etc.), inflammation (Interleukins, FENO, CC16, etc.), DNA damage (8-OHdG, \u03b3H2AX, OGG1) and also epigenetic modulation (DNA methylation, histone modification, microRNAs). The identified biomarkers shed light on PM2.5-elicited inflammation, fibrogenesis and carcinogenesis, thus may favor more precise interventions in public health. It is worth noting that some inconsistent findings may possibly relate to the inter-study differentials in the airborne PM2.5 sample, exposure mode and targeted subjects, as well as methodological issues. Further research, particularly by -omics technique to identify novel, specific biomarkers, is warranted to illuminate the causal relationship between PM2.5 pollution and deleterious lung outcomes.", "openArchiveArticle": "false", "prism:coverDate": "2022-01-05", "openaccessUserLicense": null, "prism:aggregationType": "Journal", "prism:url": "https://api.elsevier.com/content/article/pii/S0304389421017258", "dc:creator": [{"@_fa": "true", "$": "Guo, Caixia"}, {"@_fa": "true", "$": "Lv, Songqing"}, {"@_fa": "true", "$": "Liu, Yufan"}, {"@_fa": "true", "$": "Li, Yanbo"}], "link": [{"@_fa": "true", "@rel": "self", "@href": "https://api.elsevier.com/content/article/pii/S0304389421017258"}, {"@_fa": "true", "@rel": "scidir", "@href": "https://www.sciencedirect.com/science/article/pii/S0304389421017258"}], "dc:format": "application/json", "openaccessType": null, "pii": "S0304-3894(21)01725-8", "prism:volume": "421", "articleNumber": "126760", "prism:publisher": "Elsevier B.V.", "dc:title": "Biomarkers for the adverse effects on respiratory system health associated with atmospheric particulate matter exposure", "prism:copyright": "\u00a9 2021 Elsevier B.V. All rights reserved.", "openaccess": "0", "prism:issn": "03043894", "dcterms:subject": [{"@_fa": "true", "$": "Particulate matter"}, {"@_fa": "true", "$": "Oxidative stress"}, {"@_fa": "true", "$": "Inflammation"}, {"@_fa": "true", "$": "Epigenetics"}, {"@_fa": "true", "$": "Pulmonary function"}, {"@_fa": "true", "$": "Biomarker"}], "openaccessArticle": "false", "prism:publicationName": "Journal of Hazardous Materials", "openaccessSponsorType": null, "prism:pageRange": "126760", "pubType": "rev", "prism:coverDisplayDate": "5 January 2022", "prism:doi": "10.1016/j.jhazmat.2021.126760", "prism:startingPage": "126760", "dc:identifier": "doi:10.1016/j.jhazmat.2021.126760", "openaccessSponsorName": null}, "objects": {"object": [{"@category": "standard", "@height": "200", "@width": "336", "@_fa": "true", "$": "https://api.elsevier.com/content/object/eid/1-s2.0-S0304389421017258-ga1.jpg?httpAccept=%2A%2F%2A", "@multimediatype": "JPEG image file", "@type": "IMAGE-DOWNSAMPLED", "@size": "110184", "@ref": "ga1", "@mimetype": "image/jpeg"}, {"@category": "thumbnail", "@height": "130", "@width": "219", "@_fa": "true", "$": "https://api.elsevier.com/content/object/eid/1-s2.0-S0304389421017258-ga1.sml?httpAccept=%2A%2F%2A", "@multimediatype": "GIF image file", "@type": "IMAGE-THUMBNAIL", "@size": "80735", "@ref": "ga1", "@mimetype": "image/gif"}, {"@category": "high", "@height": "886", "@width": "1487", "@_fa": "true", "$": "https://api.elsevier.com/content/object/eid/1-s2.0-S0304389421017258-ga1_lrg.jpg?httpAccept=%2A%2F%2A", "@multimediatype": "JPEG image file", "@type": "IMAGE-HIGH-RES", "@size": "338333", "@ref": "ga1", "@mimetype": "image/jpeg"}]}, "link": {"@rel": "abstract", "@href": "https://api.elsevier.com/content/abstract/scopus_id/85112377394"}}